seller_city,seller_state,product_weight_g,product_length_cm,product_height_cm,product_width_cm,product_photos_qty,product_category_name,review_score,review_comment_title,payment_value,payment_installments,payment_type,payment_sequential,freight_value,price,geolocation_city,geolocation_city.1,order_estimated_delivery_date,order_delivered_customer_date,order_delivered_carrier_date,order_approved_at,order_status,order_purchase_timestamp,customer_city,customer_state,delivery_time_days,category,order_handlingtime,delay_days
campinas,SP,225,16,10,14,1.0,perfumaria,4,,99.33,8,credit_card,1,13.29,58.9,sao paulo,sao paulo,2017-10-18,2017-10-10 21:25:13,10/04/2017 19:55:00,2017-10-02 11:07:15,delivered,2017-10-02 10:56:33,franca,SP,8.0,health_beauty,0,-8.0
mogi guacu,SP,1000,30,18,20,1.0,artes,5,,24.39,1,credit_card,1,19.93,239.9,sao paulo,sao paulo,2018-08-13,2018-08-07 15:27:45,07/26/2018 14:31:00,2018-07-26 03:24:27,delivered,2018-07-24 20:41:37,sao bernardo do campo,SP,13.0,computers_accessories,1,-6.0
rio de janeiro,RJ,154,18,9,15,1.0,esporte_lazer,5,,65.71,1,credit_card,1,17.87,199.0,sao paulo,sao paulo,2018-09-04,2018-08-17 18:06:29,08/08/2018 13:50:00,2018-08-08 08:55:23,delivered,2018-08-08 08:38:49,sao paulo,SP,9.0,auto,0,-18.0
sao paulo,SP,371,26,4,26,1.0,bebes,5,,107.78,8,credit_card,1,12.79,12.99,sao paulo,sao paulo,2017-12-15,2017-12-02 00:28:42,11/22/2017 13:39:59,2017-11-18 19:45:59,delivered,2017-11-18 19:28:06,mogi das cruzes,SP,13.0,bed_bath_table,0,-13.0
braganca paulista,SP,625,20,17,13,4.0,utilidades_domesticas,5,,128.45,2,credit_card,1,18.14,199.9,sao paulo,sao paulo,2018-02-26,2018-02-16 18:17:02,02/14/2018 19:46:34,2018-02-13 22:20:29,delivered,2018-02-13 21:18:39,campinas,SP,2.0,furniture_decor,0,-10.0
rio de janeiro,RJ,200,38,5,11,1.0,instrumentos_musicais,1,,96.12,2,credit_card,1,12.69,21.9,são paulo,são paulo,2017-08-01,2017-07-26 10:57:55,07/11/2017 14:58:04,2017-07-09 22:10:13,delivered,2017-07-09 21:57:05,jaragua do sul,SC,16.0,sports_leisure,0,-6.0
brejao,PE,18350,70,24,44,4.0,cool_stuff,5,,81.16,1,credit_card,1,11.85,19.9,sao paulo,sao paulo,2017-05-09,,,2017-04-13 13:25:17,invoiced,2017-04-11 12:22:08,sao paulo,SP,,perfumery,2,
penapolis,SP,900,40,8,40,2.0,moveis_decoracao,5,,51.84,3,credit_card,1,70.75,810.0,sao paulo,sao paulo,2017-06-07,2017-05-26 12:55:51,05/22/2017 10:07:46,2017-05-16 13:22:11,delivered,2017-05-16 13:10:30,timoteo,MG,9.0,housewares,0,-12.0
sao paulo,SP,400,27,13,17,1.0,eletrodomesticos,5,,341.09,6,credit_card,1,11.65,145.95,sao paulo,sao paulo,2017-03-06,2017-02-02 14:08:10,01/26/2017 14:16:31,2017-01-25 02:50:47,delivered,2017-01-23 18:29:09,curitiba,PR,9.0,telephony,1,-32.0
curitiba,PR,600,17,10,12,1.0,brinquedos,4,recomendo,51.95,1,boleto,1,11.4,53.99,sao paulo,sao paulo,2017-08-23,2017-08-16 17:14:30,08/10/2017 19:45:24,2017-07-29 12:05:32,delivered,2017-07-29 11:55:02,belo horizonte,MG,18.0,watches_gifts,0,-7.0
anapolis,GO,1100,16,10,16,1.0,cama_mesa_banho,5,,188.73,8,credit_card,1,8.88,59.99,sao paulo,sao paulo,2017-06-07,2017-05-29 11:18:31,05/18/2017 11:40:40,2017-05-16 19:50:18,delivered,2017-05-16 19:41:10,montes claros,MG,12.0,food_drink,0,-9.0
itirapina,SP,7150,50,19,45,4.0,bebes,5,,141.9,1,credit_card,1,12.98,45.0,sao paulo,sao paulo,2017-08-08,2017-07-19 14:04:48,07/14/2017 18:43:29,2017-07-13 20:10:08,delivered,2017-07-13 19:58:11,rio de janeiro,RJ,5.0,baby,0,-20.0
sao paulo,SP,250,17,7,17,3.0,instrumentos_musicais,4,,75.78,1,credit_card,1,23.32,74.0,sao paulo,sao paulo,2018-07-18,2018-06-19 12:05:52,06/11/2018 13:29:00,2018-06-09 03:13:12,delivered,2018-06-07 10:06:19,lencois paulista,SP,12.0,stationery,1,-29.0
sao paulo,SP,600,68,11,13,2.0,moveis_decoracao,4,,102.66,5,credit_card,1,13.37,49.9,sao paulo,sao paulo,2018-08-08,2018-07-30 15:52:25,07/26/2018 13:16:00,2018-07-25 17:55:14,delivered,2018-07-25 17:44:10,sao paulo,SP,4.0,tablets_printing_image,0,-9.0
tubarao,SC,200,17,7,17,4.0,construcao_ferramentas_seguranca,3,,105.28,4,credit_card,1,13.37,49.9,são paulo,são paulo,2018-03-21,2018-03-12 23:36:26,03/02/2018 21:09:20,2018-03-01 15:10:47,delivered,2018-03-01 14:14:28,caxias do sul,RS,11.0,toys,0,-9.0
lauro de freitas,BA,800,16,2,11,1.0,esporte_lazer,5,Super recomendo,157.45,10,credit_card,1,27.65,99.9,sao paulo,sao paulo,2018-07-04,2018-06-21 15:34:32,06/11/2018 14:54:00,2018-06-12 23:31:02,delivered,2018-06-07 19:03:12,piracicaba,SP,13.0,fixed_telephony,5,-13.0
imbituba,SC,400,27,5,20,2.0,perfumaria,2,,132.04,1,credit_card,1,11.34,639.0,sao paulo,sao paulo,2018-02-06,2018-01-20 01:38:59,01/03/2018 18:19:09,2018-01-02 19:09:04,delivered,2018-01-02 19:00:43,rio de janeiro,RJ,17.0,garden_tools,0,-17.0
brasilia,DF,900,40,15,20,1.0,informatica_acessorios,5,,98.94,1,credit_card,1,8.77,144.0,são paulo,são paulo,2018-01-29,2018-01-08 22:36:36,12/28/2017 18:33:05,2017-12-26 23:50:22,delivered,2017-12-26 23:41:31,guarulhos,SP,12.0,fashion_bags_accessories,0,-21.0
porto seguro,BA,1700,100,7,15,2.0,moveis_decoracao,3,,244.15,4,credit_card,1,13.71,99.0,sao paulo,sao paulo,2017-12-11,2017-11-27 18:28:00,11/23/2017 21:32:26,2017-11-21 00:14:22,delivered,2017-11-21 00:03:41,sao paulo,SP,6.0,small_appliances,0,-14.0
sao paulo,SP,500,16,10,16,1.0,cama_mesa_banho,1,Não chegou meu produto ,136.71,3,credit_card,1,16.11,25.0,sao paulo,sao paulo,2017-11-23,2017-11-08 22:22:00,10/26/2017 21:46:53,2017-10-26 16:08:14,delivered,2017-10-26 15:54:26,pacaja,PA,13.0,consoles_games,0,-15.0
guaruja,SP,2550,29,24,45,4.0,moveis_decoracao,4,,47.69,4,credit_card,1,8.88,47.9,sao paulo,sao paulo,2017-09-28,2017-10-09 22:23:46,10/06/2017 17:50:03,2017-09-19 04:04:09,delivered,2017-09-18 14:31:30,florianopolis,SC,21.0,audio,0,11.0
tabatinga,SP,800,36,8,16,2.0,cama_mesa_banho,5,,170.57,2,credit_card,1,11.85,21.99,são paulo,são paulo,2018-03-29,2018-03-19 18:08:32,03/15/2018 19:52:48,2018-03-15 09:09:31,delivered,2018-03-15 08:52:40,aparecida de goiania,GO,4.0,fashion_shoes,0,-10.0
sao paulo,SP,75,21,7,13,3.0,beleza_saude,5,Ótimo,67.5,4,credit_card,1,44.4,119.99,são paulo,são paulo,2018-02-21,2018-02-08 16:13:46,02/05/2018 22:37:28,2018-02-03 20:50:22,delivered,2018-02-03 20:37:35,sao paulo,SP,4.0,cool_stuff,0,-13.0
salto,SP,500,20,13,13,1.0,bebes,5,,353.09,10,credit_card,1,15.1,49.0,são paulo,são paulo,2018-02-21,2018-01-26 17:32:38,01/24/2018 23:16:37,2018-01-08 08:07:31,delivered,2018-01-08 07:55:29,curitiba,PR,18.0,luggage_accessories,0,-26.0
tres de maio,RS,1800,40,10,30,1.0,moveis_decoracao,5,,330.66,1,boleto,1,16.6,48.9,sao paulo,sao paulo,2018-08-17,2018-08-13 18:24:27,08/10/2018 12:29:00,2018-08-10 03:24:51,delivered,2018-08-09 11:44:40,sao paulo,SP,4.0,air_conditioning,0,-4.0
belo horizonte,MG,900,50,5,50,1.0,utilidades_domesticas,5,,45.17,1,voucher,2,16.98,219.9,sao paulo,sao paulo,2018-03-12,2018-03-21 22:03:54,02/26/2018 22:25:22,2018-02-22 02:30:46,delivered,2018-02-20 23:46:53,santo andre,SP,28.0,construction_tools_construction,1,9.0
arapongas,PR,3600,35,25,50,5.0,malas_acessorios,4,,541.0,2,credit_card,1,26.33,289.0,sao paulo,sao paulo,2018-07-18,2018-06-16 15:20:55,06/05/2018 13:24:00,2018-06-05 00:35:10,delivered,2018-06-04 00:00:13,goiania,GO,12.0,kitchen_dining_laundry_garden_furniture,1,-32.0
sao bernardo do campo,SP,300,42,2,30,2.0,informatica_acessorios,5,,139.22,2,credit_card,1,25.51,109.9,sao paulo,sao paulo,2018-03-28,2018-03-21 14:41:50,03/12/2018 21:06:37,2018-03-12 03:28:34,delivered,2018-03-12 01:50:26,sao paulo,SP,9.0,costruction_tools_garden,0,-7.0
sao paulo,SP,740,23,13,13,2.0,informatica_acessorios,5,,290.16,2,credit_card,1,7.94,27.9,são paulo,são paulo,2018-05-23,2018-05-16 20:56:24,05/10/2018 16:16:00,2018-05-03 12:55:01,delivered,2018-05-02 11:45:38,cachoeiro de itapemirim,ES,14.0,fashion_male_clothing,1,-7.0
tatui,SP,3600,62,23,23,2.0,esporte_lazer,1,,283.34,1,boleto,1,17.32,119.9,sao paulo,sao paulo,2018-04-13,2018-03-27 23:29:14,02/26/2018 22:28:50,2018-02-25 14:47:35,delivered,2018-02-25 13:50:30,sao paulo,SP,30.0,pet_shop,0,-17.0
curitiba,PR,650,16,10,16,1.0,cama_mesa_banho,5,,13.78,1,credit_card,1,24.65,397.0,sao paulo,sao paulo,2017-08-23,2017-08-18 14:28:02,08/17/2017 15:35:07,2017-08-12 02:45:24,delivered,2017-08-10 11:58:33,sao jose dos campos,SP,8.0,office_furniture,1,-5.0
sao paulo,SP,2150,70,8,34,9.0,ferramentas_jardim,5,,30.28,1,credit_card,1,23.35,59.9,são paulo,são paulo,2018-05-15,2018-05-05 12:28:34,04/18/2018 13:05:09,2018-04-16 22:10:26,delivered,2018-04-16 21:15:39,sao roque,SP,18.0,market_place,0,-10.0
garopaba,SC,800,40,10,34,1.0,moveis_decoracao,1,,26.58,1,credit_card,1,15.1,21.33,são paulo,são paulo,2018-01-08,2018-01-03 18:03:36,12/16/2017 00:18:57,2017-12-14 13:54:13,delivered,2017-12-12 13:56:04,camacari,BA,22.0,electronics,1,-5.0
sao paulo,SP,8950,52,51,17,1.0,moveis_escritorio,5,,89.68,1,credit_card,1,15.1,21.33,sao paulo,sao paulo,2018-03-07,2018-02-22 00:07:55,02/05/2018 21:26:53,2018-02-03 12:50:30,delivered,2018-02-03 12:38:58,resende,RJ,18.0,home_appliances,0,-13.0
camanducaia,MG,1388,34,9,31,4.0,esporte_lazer,4,Muito bom.,65.09,1,credit_card,1,15.1,21.33,sao paulo,sao paulo,2018-08-06,2018-07-31 22:48:50,07/30/2018 14:43:00,2018-07-29 23:45:15,delivered,2018-07-29 23:34:51,curitiba,PR,1.0,party_supplies,0,-6.0
tupa,SP,7950,33,30,44,9.0,bebes,5,,173.84,1,credit_card,1,14.1,16.5,sao paulo,sao paulo,2018-03-20,2018-03-20 00:59:25,02/20/2018 23:03:56,2018-02-17 16:15:34,delivered,2018-02-17 15:59:46,sumare,SP,30.0,home_confort,0,0.0
guarulhos,SP,6000,87,3,42,2.0,automotivo,5,Bom,103.49,1,credit_card,1,15.1,21.9,sao paulo,sao paulo,2018-03-29,2018-03-13 23:58:43,02/27/2018 18:52:09,2018-02-23 02:10:52,delivered,2018-02-21 18:15:12,guarulhos,SP,20.0,costruction_tools_tools,1,-16.0
sao jose dos pinhais,PR,263,18,12,16,1.0,eletronicos,5,,64.03,1,credit_card,1,16.11,39.0,sao paulo,sao paulo,2017-08-22,2017-08-08 21:24:41,08/03/2017 18:32:48,2017-08-02 02:56:02,delivered,2017-07-31 21:37:10,novo hamburgo,RS,7.0,agro_industry_and_commerce,1,-14.0
sao paulo,SP,3900,19,20,15,1.0,utilidades_domesticas,5,Maravilhoso!,157.15,3,credit_card,1,20.8,49.75,sao paulo,sao paulo,2018-07-17,2018-06-18 21:32:52,06/08/2018 11:49:00,2018-06-05 03:35:15,delivered,2018-06-01 12:23:13,sao luis,MA,17.0,furniture_mattress_and_upholstery,3,-29.0
sao paulo,SP,600,25,25,25,1.0,moveis_decoracao,1,,130.88,1,boleto,1,44.29,809.1,sao paulo,sao paulo,2018-04-12,2018-04-05 22:11:18,03/28/2018 17:22:53,2018-03-26 17:28:27,delivered,2018-03-26 17:12:18,sao jose,SC,10.0,books_technical,0,-7.0
brasilia,DF,2050,49,13,41,2.0,moveis_decoracao,2,,47.72,2,credit_card,1,13.72,99.99,sao paulo,sao paulo,2017-06-12,2017-05-31 13:58:46,05/22/2017 10:16:07,2017-05-19 19:05:17,delivered,2017-05-19 18:53:40,guarulhos,SP,11.0,home_construction,0,-12.0
brasilia,DF,725,22,17,15,2.0,brinquedos,1,,117.74,8,credit_card,1,19.95,59.9,sao paulo,sao paulo,2017-12-21,2017-12-28 18:59:23,12/13/2017 21:14:05,2017-11-25 00:21:09,delivered,2017-11-24 21:27:48,santa barbara,MG,33.0,musical_instruments,0,7.0
sao ludgero,SC,6350,45,15,35,4.0,cama_mesa_banho,5,,56.6,1,boleto,1,17.63,24.89,sao paulo,sao paulo,2017-09-01,2017-08-12 14:08:40,08/07/2017 17:52:01,2017-08-04 17:25:11,delivered,2017-08-04 17:10:39,sao paulo,SP,7.0,furniture_living_room,0,-20.0
sao jose,SC,600,70,11,11,4.0,bebes,5,Entrega perfeita,266.16,1,credit_card,1,17.63,24.89,sao paulo,sao paulo,2018-09-13,2018-08-13 23:34:42,08/06/2018 15:03:00,2018-08-04 23:35:13,delivered,2018-08-04 23:25:30,guarulhos,SP,9.0,construction_tools_lights,0,-31.0
piracicaba,SP,11750,18,40,79,2.0,cool_stuff,5,,31.38,1,boleto,1,17.63,24.89,sao paulo,sao paulo,2018-06-28,,06/05/2018 14:32:00,2018-06-05 04:31:18,shipped,2018-06-04 16:44:48,ribeirao preto,SP,,industry_commerce_and_business,0,
porto alegre,RS,2550,22,32,38,3.0,brinquedos,4,,121.49,1,credit_card,1,8.54,54.0,sao paulo,sao paulo,2017-06-09,2017-05-29 12:47:20,05/19/2017 12:01:38,2017-05-18 14:05:17,delivered,2017-05-18 13:55:47,belo horizonte,MG,10.0,food,0,-11.0
congonhal,MG,15350,47,40,47,3.0,cool_stuff,5,,32.0,1,credit_card,1,13.01,81.99,sao paulo,sao paulo,2017-06-12,2017-05-25 09:14:31,05/16/2017 08:17:46,2017-05-14 20:42:45,delivered,2017-05-14 20:28:25,ituiutaba,MG,10.0,art,0,-18.0
belo horizonte,MG,1300,25,16,25,2.0,moveis_decoracao,5,,153.41,5,credit_card,1,13.71,99.0,sao paulo,sao paulo,2018-05-25,2018-05-21 15:22:11,05/18/2018 13:02:00,2018-05-18 01:17:39,delivered,2018-05-17 16:59:11,taquarituba,SP,3.0,furniture_bedroom,0,-4.0
belo horizonte,MG,850,69,11,11,2.0,moveis_decoracao,5,,65.71,5,credit_card,1,7.78,18.99,sao paulo,sao paulo,2018-08-13,2018-08-02 22:09:11,07/30/2018 13:47:00,2018-07-29 11:44:19,delivered,2018-07-29 11:24:17,sao jose dos pinhais,PR,4.0,books_general_interest,0,-11.0
santo andre,SP,1300,19,28,17,1.0,beleza_saude,5,,278.22,4,credit_card,1,7.78,18.99,sao paulo,sao paulo,2017-08-31,2017-08-16 17:16:44,08/11/2017 17:52:32,2017-08-11 04:15:29,delivered,2017-08-09 20:19:05,jaragua do sul,SC,6.0,construction_tools_safety,1,-15.0
sao paulo,SP,4800,60,30,15,5.0,esporte_lazer,5,,91.66,4,credit_card,1,16.79,38.33,sao paulo,sao paulo,2018-02-23,2018-02-14 13:41:59,02/06/2018 19:13:26,2018-02-03 02:53:07,delivered,2018-02-01 14:02:19,sao paulo,SP,12.0,fashion_underwear_beach,1,-9.0
osasco,SP,1300,36,16,24,2.0,cool_stuff,1,,132.51,1,credit_card,1,18.0,69.9,sao paulo,sao paulo,2018-07-20,2018-07-03 18:37:46,06/27/2018 13:20:00,2018-06-27 08:35:32,delivered,2018-06-26 13:42:52,montes claros,MG,7.0,fashion_sport,0,-17.0
valinhos,SP,220,18,14,17,1.0,automotivo,5,,542.66,4,credit_card,1,18.21,195.0,sao paulo,sao paulo,2018-08-16,2018-07-31 22:26:55,07/27/2018 12:04:00,2018-07-26 14:55:10,delivered,2018-07-26 14:39:59,barrinha,SP,5.0,signaling_and_security,0,-16.0
joinville,SC,5700,41,17,49,4.0,bebes,5,Ótimo,166.04,1,boleto,1,15.2,35.9,sao paulo,sao paulo,2018-01-16,2018-01-03 15:09:32,12/19/2017 01:58:00,2017-12-15 00:14:55,delivered,2017-12-15 00:06:10,rio de janeiro,RJ,19.0,computers,0,-13.0
guaruja,SP,450,20,40,30,2.0,malas_acessorios,5,,368.98,1,boleto,1,21.05,79.5,sao paulo,sao paulo,2017-09-20,2017-09-04 20:59:55,08/31/2017 20:06:14,2017-08-31 08:30:17,delivered,2017-08-31 08:15:24,parati,RJ,4.0,christmas_supplies,0,-16.0
saquarema,RJ,2000,32,12,37,2.0,fashion_calcados,5,,113.2,2,credit_card,1,15.1,29.99,sao paulo,sao paulo,2018-07-16,2018-06-19 00:31:13,06/14/2018 13:03:00,2018-06-11 10:58:32,delivered,2018-06-11 10:25:52,dourados,MS,7.0,fashio_female_clothing,0,-27.0
barra velha,SC,100,19,3,11,2.0,telefonia,3,,99.43,3,credit_card,1,13.21,109.9,sao paulo,sao paulo,2018-07-05,2018-06-14 21:32:21,06/11/2018 14:54:00,2018-06-11 08:31:50,delivered,2018-06-11 08:18:19,sao paulo,SP,3.0,home_appliances_2,0,-21.0
petropolis,RJ,1100,30,20,23,1.0,cool_stuff,3,,27.35,2,credit_card,1,16.49,74.9,são paulo,são paulo,2018-04-02,2018-04-03 13:28:46,03/15/2018 00:31:19,2018-03-09 15:40:39,delivered,2018-03-09 14:50:15,trindade,GO,24.0,books_imported,0,1.0
santo antonio da patrulha,RS,1400,38,40,39,3.0,papelaria,4,,43.77,4,credit_card,1,18.23,14.95,sao paulo,sao paulo,2017-03-30,2017-04-06 13:37:16,03/22/2017 14:03:09,2017-03-13 18:14:36,delivered,2017-03-13 18:14:36,cascavel,PR,23.0,drinks,0,7.0
ponta grossa,PR,250,20,14,12,4.0,brinquedos,5,MT lindo,68.49,2,credit_card,1,43.11,149.9,sao paulo,sao paulo,2017-07-06,2017-06-19 18:51:28,06/16/2017 14:55:37,2017-06-15 03:05:45,delivered,2017-06-13 21:11:26,fortaleza,CE,5.0,cine_photo,1,-17.0
santana de parnaiba,SP,1050,25,20,14,1.0,esporte_lazer,5,,105.53,2,credit_card,1,14.1,19.99,sao paulo,sao paulo,2017-12-18,2017-12-05 20:28:40,12/04/2017 22:07:01,2017-12-02 02:51:18,delivered,2017-11-30 22:02:15,brasilia,DF,4.0,la_cuisine,1,-13.0
santo andre,SP,500,24,7,16,1.0,papelaria,5,,387.8,8,credit_card,1,29.39,390.0,sao paulo,sao paulo,2018-08-15,2018-08-10 18:35:40,08/06/2018 13:41:00,2018-08-05 13:24:34,delivered,2018-08-05 13:09:48,sao paulo,SP,5.0,music,0,-5.0
sao carlos,SP,1467,23,16,20,1.0,beleza_saude,5,,84.14,1,boleto,1,21.75,135.0,são paulo,são paulo,2017-12-05,2017-11-22 22:41:07,11/16/2017 22:03:00,2017-11-15 11:46:42,delivered,2017-11-15 11:31:41,pelotas,RS,7.0,home_comfort_2,0,-13.0
osasco,SP,100,16,5,11,3.0,fashion_bolsas_e_acessorios,5,,210.82,4,credit_card,1,16.43,104.0,sao paulo,sao paulo,2018-03-13,2018-03-09 22:22:25,02/22/2018 21:04:23,2018-02-21 06:15:25,delivered,2018-02-19 20:31:09,porto alegre,RS,18.0,small_appliances_home_oven_and_coffee,1,-4.0
ibitinga,SP,100,16,5,16,1.0,papelaria,4,,90.05,1,boleto,1,15.8,149.0,sao paulo,sao paulo,2018-05-15,2018-04-24 19:31:58,04/23/2018 19:19:14,2018-04-24 18:25:22,delivered,2018-04-22 08:48:13,rio de janeiro,RJ,2.0,cds_dvds_musicals,2,-21.0
sao paulo,SP,300,23,7,15,2.0,papelaria,5,,67.88,1,credit_card,1,13.46,279.9,sao paulo,sao paulo,2018-02-14,2018-01-17 20:26:31,01/10/2018 21:56:09,2018-01-07 21:51:28,delivered,2018-01-07 21:44:54,salto,SP,9.0,dvds_blu_ray,0,-28.0
sao jose dos pinhais,PR,950,60,15,15,2.0,esporte_lazer,5,,37.58,2,credit_card,1,23.22,44.9,sao paulo,sao paulo,2018-03-12,2018-02-20 22:13:08,02/14/2018 20:47:38,2018-02-10 13:35:31,delivered,2018-02-10 13:26:59,belo horizonte,MG,10.0,flowers,0,-20.0
sao paulo,SP,250,17,3,11,1.0,ferramentas_jardim,5,Ótimo Produto! ,89.63,1,boleto,1,19.18,37.99,sao paulo,sao paulo,2018-07-13,2018-06-22 21:18:51,06/19/2018 15:55:00,2018-06-18 17:00:57,delivered,2018-06-18 16:02:23,jundiai,SP,4.0,arts_and_craftmanship,0,-21.0
barueri,SP,12000,27,50,53,1.0,pcs,1,,69.46,1,voucher,1,15.31,29.99,são paulo,são paulo,2018-06-26,2018-06-18 22:32:44,06/15/2018 14:22:00,2018-06-15 02:37:29,delivered,2018-06-13 13:47:39,cachoeiro de itapemirim,ES,5.0,diapers_and_hygiene,1,-8.0
osasco,SP,921,17,9,16,6.0,automotivo,5,,78.3,2,credit_card,1,15.59,120.0,sao paulo,sao paulo,2018-08-02,2018-07-24 16:41:18,07/17/2018 15:33:00,2018-07-16 14:31:10,delivered,2018-07-15 08:33:19,cacapava,SP,9.0,fashion_childrens_clothes,1,-9.0
caxias do sul,SP,10000,60,25,25,1.0,casa_construcao,3,,50.8,1,voucher,1,21.62,492.75,sao paulo,sao paulo,2017-09-25,2017-09-16 15:40:08,09/15/2017 18:42:29,2017-09-13 14:44:39,delivered,2017-09-13 14:27:11,fortaleza,CE,3.0,security_and_services,0,-9.0
sao paulo,SP,250,16,11,11,2.0,relogios_presentes,5,,34.0,1,credit_card,1,18.54,94.9,são paulo,são paulo,2018-05-08,2018-04-19 20:41:45,04/13/2018 22:19:21,2018-04-13 13:30:02,delivered,2018-04-13 08:44:17,sao vicente,SP,6.0,,0,-19.0
joinville,SC,1200,44,20,20,3.0,cool_stuff,4,,77.1,1,boleto,1,21.11,88.34,sao paulo,sao paulo,2018-03-07,2018-02-24 19:15:56,02/20/2018 14:15:09,2018-02-15 10:47:59,delivered,2018-02-15 10:33:30,uberlandia,MG,9.0,,0,-11.0
araguari,MG,4800,25,8,25,1.0,construcao_ferramentas_construcao,3,,566.4,5,credit_card,1,65.56,199.99,sao paulo,sao paulo,2017-03-21,2017-03-09 14:27:58,02/23/2017 06:47:35,2017-02-22 03:10:20,delivered,2017-02-20 11:45:39,botelhos,MG,17.0,,1,-12.0
contagem,MG,700,40,20,20,1.0,pet_shop,5,,402.42,8,credit_card,1,19.67,99.9,sao paulo,sao paulo,2017-05-12,2017-05-10 09:17:55,04/24/2017 09:34:13,2017-04-21 05:15:56,delivered,2017-04-20 17:15:46,sao goncalo,RJ,19.0,,0,-2.0
jaragua do sul,SC,1050,18,21,27,3.0,beleza_saude,3,,57.53,1,voucher,2,8.9,78.0,sao paulo,sao paulo,2017-10-11,2017-09-25 20:14:48,09/18/2017 18:20:00,2017-09-15 09:35:18,delivered,2017-09-15 09:19:48,sao paulo,SP,10.0,,0,-16.0
ibitinga,SP,350,20,20,20,3.0,eletroportateis,1,,44.01,3,credit_card,1,8.9,78.0,sao paulo,sao paulo,2018-08-08,2018-08-06 18:44:46,08/01/2018 16:01:00,2018-07-31 03:50:24,delivered,2018-07-28 16:52:55,sao paulo,SP,9.0,,2,-2.0
sao bernardo do campo,SP,422,21,16,18,1.0,perfumaria,5,,187.51,3,credit_card,1,14.84,155.0,sao paulo,sao paulo,2017-08-31,2017-08-16 18:17:54,08/10/2017 20:21:53,2017-08-09 18:45:18,delivered,2017-08-09 18:32:47,araucaria,PR,6.0,,0,-15.0
lages - sc,SC,317,19,13,16,1.0,relogios_presentes,4,,77.7,3,credit_card,1,34.23,249.9,sao paulo,sao paulo,2018-08-30,2018-08-29 12:40:53,08/28/2018 12:56:00,2018-08-28 04:10:18,delivered,2018-08-26 22:04:34,sao vicente,SP,2.0,,1,-1.0
bento goncalves,RS,16400,63,66,56,1.0,agro_industria_e_comercio,5,RECOMENDO SEMPRE!!,48.68,1,credit_card,1,23.31,53.98,sao paulo,sao paulo,2017-08-16,2017-08-01 14:27:31,07/31/2017 16:42:54,2017-07-30 03:25:08,delivered,2017-07-30 03:06:35,nova iguacu,RJ,2.0,,0,-15.0
catanduva,SP,938,29,22,23,1.0,beleza_saude,5,,77.29,1,credit_card,1,32.57,8.99,sao paulo,sao paulo,2018-01-19,2018-01-09 19:52:32,12/27/2017 19:54:46,2017-12-23 02:15:31,delivered,2017-12-22 00:17:37,sao paulo,SP,18.0,,1,-10.0
ribeirao pires,SP,2700,21,16,31,1.0,beleza_saude,5,,117.71,8,credit_card,1,7.16,44.9,sao paulo,sao paulo,2017-04-27,2017-04-11 12:31:36,04/07/2017 14:54:18,2017-04-06 22:50:24,delivered,2017-04-06 22:39:29,areia branca,RN,4.0,,0,-16.0
sao paulo,SP,1750,30,18,30,1.0,cama_mesa_banho,5,,169.34,3,credit_card,1,17.67,60.6,sao paulo,sao paulo,2017-06-01,2017-05-18 13:22:35,05/10/2017 11:22:15,2017-05-09 21:02:45,delivered,2017-05-09 20:48:59,sao paulo,SP,8.0,,0,-14.0
jaboticabal,SP,3850,29,12,24,1.0,ferramentas_jardim,4,,37.61,1,credit_card,1,67.24,225.0,sao paulo,sao paulo,2017-05-25,2017-05-11 13:07:46,04/25/2017 08:23:08,2017-04-20 20:55:09,delivered,2017-04-20 20:42:44,campos dos goytacazes,RJ,20.0,,0,-14.0
echapora,SP,267,17,13,17,2.0,perfumaria,5,,13.8,1,credit_card,1,15.38,39.9,sao paulo,sao paulo,2017-11-21,2017-11-08 21:25:24,10/27/2017 22:14:21,2017-10-17 03:49:34,delivered,2017-10-16 14:56:50,sao carlos,SP,23.0,,0,-13.0
cotia,SP,16200,55,40,40,3.0,instrumentos_musicais,5,,227.12,1,debit_card,1,34.07,76.0,sao paulo,sao paulo,2018-01-03,2017-12-19 18:43:35,12/11/2017 15:19:04,2017-12-09 02:49:54,delivered,2017-12-08 09:42:43,sao paulo,SP,11.0,,0,-15.0
rio do sul,SC,1400,38,9,27,2.0,cama_mesa_banho,5,,34.78,3,credit_card,1,27.19,159.0,são paulo,são paulo,2017-09-21,2017-09-08 20:39:56,08/30/2017 13:26:32,2017-08-27 17:04:12,delivered,2017-08-26 16:53:30,itajuba,MG,13.0,,1,-13.0
sao paulo,SP,6450,100,10,11,1.0,cama_mesa_banho,3,,342.56,10,credit_card,1,14.45,102.9,sao paulo,sao paulo,2018-03-29,2018-03-16 14:59:01,03/03/2018 02:27:03,2018-03-01 02:48:54,delivered,2018-02-27 12:55:42,porto alegre,RS,17.0,,1,-13.0
sorocaba,SP,2300,105,3,70,3.0,moveis_decoracao,5,,73.34,7,credit_card,1,14.45,102.9,sao paulo,sao paulo,2018-06-05,2018-05-21 16:09:55,05/16/2018 14:43:00,2018-05-11 13:36:50,delivered,2018-05-11 13:10:51,sao bernardo do campo,SP,10.0,,0,-15.0
rio de janeiro,RJ,300,25,8,18,2.0,informatica_acessorios,1,,117.85,4,credit_card,1,16.89,63.9,sao paulo,sao paulo,2018-02-19,2018-02-15 20:08:15,01/24/2018 23:32:21,2018-01-22 19:36:35,delivered,2018-01-22 19:22:22,salto,SP,24.0,,0,-4.0
pradopolis,SP,600,50,10,12,1.0,esporte_lazer,5,***** Recomendo,48.62,1,credit_card,1,8.21,168.8,sao paulo,sao paulo,2018-05-16,2018-05-04 14:02:26,05/02/2018 19:01:00,2018-05-01 08:52:58,delivered,2018-05-01 08:12:37,cruz das almas,BA,3.0,,0,-12.0
rio de janeiro,RJ,3600,20,20,20,1.0,beleza_saude,1,,53.99,1,credit_card,1,9.94,59.9,sao paulo,sao paulo,2017-10-13,2017-10-10 18:43:53,09/22/2017 17:23:09,2017-09-20 07:55:14,delivered,2017-09-19 22:17:15,vassouras,RJ,20.0,,0,-3.0
sao paulo,SP,150,20,24,33,6.0,beleza_saude,5,,51.14,1,credit_card,1,9.94,59.9,sao paulo,sao paulo,2018-05-21,2018-04-27 23:14:42,04/14/2018 00:02:39,2018-04-11 22:49:32,delivered,2018-04-11 22:32:31,feira de santana,BA,16.0,,0,-24.0
itaborai,RJ,400,16,4,11,4.0,esporte_lazer,5,,121.45,2,credit_card,1,28.58,232.75,são paulo,são paulo,2018-01-22,2018-01-09 18:14:02,12/23/2017 13:10:45,2017-12-22 02:37:45,delivered,2017-12-20 23:45:07,sao paulo,SP,19.0,,1,-13.0
sao paulo,SP,100,18,6,11,1.0,telefonia,2,,73.34,1,credit_card,1,18.44,48.9,sao paulo,sao paulo,2018-05-07,2018-04-30 17:57:25,04/27/2018 13:46:00,2018-04-24 19:24:14,delivered,2018-04-22 23:23:18,brasilia,DF,7.0,,1,-7.0
mirassol,SP,800,53,8,20,2.0,moveis_decoracao,5,,117.68,10,credit_card,1,12.11,87.0,sao paulo,sao paulo,2018-08-27,2018-08-17 00:49:41,08/03/2018 10:10:00,2018-08-03 09:31:36,delivered,2018-08-03 08:59:39,sao carlos,SP,13.0,,0,-10.0
santo andre,SP,5250,47,19,23,6.0,automotivo,5,,56.77,1,credit_card,1,18.54,131.9,são paulo,são paulo,2018-06-08,2018-05-18 14:48:38,05/16/2018 14:46:00,2018-05-14 08:52:24,delivered,2018-05-14 08:35:33,sao paulo,SP,4.0,,0,-21.0
birigui,SP,200,35,4,26,1.0,automotivo,5,,115.59,2,credit_card,1,14.1,19.9,sao paulo,sao paulo,2017-12-11,2017-12-28 19:43:00,11/27/2017 13:39:35,2017-11-22 11:46:50,delivered,2017-11-22 11:32:22,sao paulo,SP,36.0,,0,17.0
sao paulo,SP,335,17,11,12,2.0,relogios_presentes,3,,60.07,6,credit_card,1,66.04,136.99,são paulo,são paulo,2017-04-26,2017-04-10 02:59:52,03/30/2017 10:55:54,2017-03-30 08:05:08,delivered,2017-03-30 07:50:33,niteroi,RJ,10.0,,0,-16.0
belo horizonte,MG,1300,50,12,12,1.0,cama_mesa_banho,5,,27.27,1,credit_card,1,23.64,399.99,sao paulo,sao paulo,2018-07-23,2018-06-18 12:36:54,06/06/2018 15:37:00,2018-06-05 09:32:22,delivered,2018-06-05 09:10:34,sao luis,MA,13.0,,0,-35.0
rio de janeiro,RJ,150,35,2,25,3.0,moveis_decoracao,5,,32.15,1,boleto,1,11.85,41.0,sao paulo,sao paulo,2018-08-30,2018-08-28 21:06:31,08/27/2018 15:52:00,2018-08-26 11:15:29,delivered,2018-08-26 11:04:26,sao paulo,SP,2.0,,0,-2.0
rio de janeiro,RJ,367,16,4,11,3.0,informatica_acessorios,4,,195.71,3,credit_card,1,18.58,69.0,sao paulo,sao paulo,2017-06-06,2017-05-23 13:32:30,05/17/2017 10:13:52,2017-05-17 08:45:09,delivered,2017-05-17 08:36:11,sao paulo,SP,6.0,,0,-14.0
ibitinga,SP,250,16,2,11,4.0,relogios_presentes,4,,43.12,1,voucher,2,18.58,69.0,sao paulo,sao paulo,2018-08-02,2018-08-03 19:28:47,08/02/2018 10:35:00,2018-08-01 02:50:15,delivered,2018-07-30 22:41:44,jaragua do sul,SC,3.0,,1,1.0
sao paulo,SP,8500,75,25,55,1.0,moveis_decoracao,5,,88.49,1,credit_card,1,33.33,169.9,sao paulo,sao paulo,2018-08-21,,,2018-08-07 06:15:14,invoiced,2018-08-03 17:44:42,sobral,CE,,,3,
sao paulo,SP,2150,42,25,15,1.0,bebes,3,Não recebi o produto.,34.09,3,credit_card,1,15.28,119.0,são paulo,são paulo,2018-03-26,2018-03-09 14:48:21,03/05/2018 17:32:31,2018-03-02 22:08:51,delivered,2018-03-01 22:14:26,divinopolis,MG,7.0,,0,-17.0
assis,SP,650,17,14,12,,,5,,40.99,1,credit_card,1,18.08,39.9,sao paulo,sao paulo,2018-03-07,2018-02-16 20:24:42,02/07/2018 17:13:05,2018-02-06 21:29:40,delivered,2018-02-06 21:09:10,mogi das cruzes,SP,9.0,,0,-19.0
jaguariuna,SP,150,16,5,11,4.0,esporte_lazer,1,,71.99,3,credit_card,1,12.9,85.0,sao paulo,sao paulo,2017-03-10,2017-02-10 17:30:19,02/01/2017 14:25:06,2017-01-29 01:31:48,delivered,2017-01-28 23:45:53,brasilia,DF,12.0,,0,-28.0
araraquara,SP,650,27,10,22,1.0,cama_mesa_banho,5,,47.0,1,boleto,1,8.89,220.0,sao paulo,sao paulo,2018-02-26,2018-02-09 20:16:40,02/03/2018 03:56:00,2018-01-27 22:16:18,delivered,2018-01-27 22:04:34,sao paulo,SP,12.0,,0,-17.0
macae,RJ,2700,20,26,32,4.0,eletroportateis,5,OTIMO,81.78,3,credit_card,1,35.74,277.0,sao paulo,sao paulo,2017-07-25,2017-07-12 20:17:57,07/04/2017 14:52:46,2017-07-04 04:10:19,delivered,2017-07-01 15:42:32,sao paulo,SP,11.0,,2,-13.0
salto,SP,1200,23,22,16,1.0,utilidades_domesticas,5,,231.45,3,credit_card,1,27.75,66.99,sao paulo,sao paulo,2017-10-16,2017-09-30 17:13:01,09/29/2017 22:25:42,2017-09-27 12:26:02,delivered,2017-09-27 12:07:22,paraiba do sul,RJ,3.0,,0,-16.0
rio claro,SP,6050,55,10,46,2.0,moveis_sala,3,,144.2,7,credit_card,1,50.85,14.0,sao paulo,sao paulo,2017-12-22,2018-01-23 21:38:52,12/14/2017 20:37:43,2017-12-01 09:31:15,delivered,2017-11-28 21:00:44,paulista,PE,56.0,,2,32.0
londrina,PR,150,16,6,11,1.0,esporte_lazer,5,,35.14,1,debit_card,1,17.03,85.0,sao paulo,sao paulo,2018-02-19,2018-02-02 16:12:53,02/02/2018 00:39:31,2018-02-01 12:54:33,delivered,2018-02-01 12:31:21,sao paulo,SP,1.0,,0,-17.0
sao paulo,SP,1050,16,20,16,6.0,casa_construcao,5,,285.79,10,credit_card,1,17.03,85.0,sao paulo,sao paulo,2018-09-05,2018-08-28 14:52:43,08/23/2018 14:33:00,2018-08-22 16:25:19,delivered,2018-08-22 16:10:29,carapicuiba,SP,5.0,,0,-8.0
ribeirao preto,SP,1350,23,7,30,1.0,pet_shop,5,,176.7,2,credit_card,1,9.8,229.0,sao paulo,sao paulo,2018-08-10,2018-07-13 17:18:42,07/10/2018 14:25:00,2018-07-07 10:10:09,delivered,2018-07-06 23:36:15,sao paulo,SP,6.0,,0,-28.0
rio de janeiro,RN,600,36,6,19,1.0,utilidades_domesticas,5,,27.63,2,credit_card,1,0.0,99.9,sao paulo,sao paulo,2018-05-29,2018-05-22 00:08:26,05/10/2018 16:07:00,2018-05-09 18:54:13,delivered,2018-05-09 18:27:00,bom principio,RS,12.0,,0,-7.0
tres coracoes,MG,1000,30,18,18,1.0,moveis_decoracao,1,,134.56,8,credit_card,1,34.39,84.9,sao paulo,sao paulo,2017-12-19,2018-01-20 13:42:22,11/28/2017 23:17:09,2017-11-26 17:58:34,delivered,2017-11-26 17:49:46,sao paulo,SP,54.0,,0,32.0
sao paulo,SP,1550,43,8,33,2.0,cama_mesa_banho,5,,96.98,4,credit_card,1,33.91,189.0,sao paulo,sao paulo,2017-10-17,2017-09-30 16:55:39,09/29/2017 21:58:48,2017-09-29 09:44:12,delivered,2017-09-29 09:32:17,astolfo dutra,MG,1.0,,0,-17.0
nhandeara,SP,2700,45,13,35,1.0,cama_mesa_banho,5,,110.03,2,credit_card,1,7.78,49.0,sao paulo,sao paulo,2017-07-10,2017-06-29 10:16:35,06/28/2017 14:28:00,2017-06-27 23:35:09,delivered,2017-06-27 23:11:57,curitiba,PR,1.0,,0,-11.0
ibitinga,SP,200,19,5,11,9.0,telefonia,5,,17.78,1,credit_card,1,15.37,37.9,sao paulo,sao paulo,2018-02-21,2018-02-07 14:59:03,01/26/2018 19:12:26,2018-01-23 10:59:10,delivered,2018-01-23 10:32:39,belo horizonte,MG,15.0,,0,-14.0
sao paulo,SP,800,38,8,28,1.0,malas_acessorios,1,,44.0,1,credit_card,1,16.14,179.93,sao paulo,sao paulo,2018-09-13,2018-08-28 13:43:41,08/21/2018 11:53:00,2018-08-20 18:35:26,delivered,2018-08-20 18:24:30,marialva,PR,7.0,,0,-16.0
brasilia,DF,377,18,13,15,3.0,perfumaria,4,,110.11,4,credit_card,1,13.84,116.9,sao paulo,sao paulo,2018-02-21,2018-02-20 15:25:04,01/31/2018 15:06:03,2018-01-30 08:13:43,delivered,2018-01-30 07:51:17,sao paulo,SP,21.0,,0,-1.0
barueri,SP,400,45,22,43,3.0,esporte_lazer,4,,22.49,1,voucher,4,15.51,94.9,sao paulo,sao paulo,2018-05-04,2018-04-07 00:06:33,04/05/2018 00:44:42,2018-04-03 05:10:21,delivered,2018-03-31 14:20:46,sao jose do rio preto,SP,6.0,,2,-27.0
sao paulo,SP,450,16,5,16,1.0,sinalizacao_e_seguranca,1,,46.63,4,credit_card,1,15.73,121.99,sao paulo,sao paulo,2018-03-29,2018-03-19 18:46:32,03/14/2018 02:08:26,2018-03-09 03:00:35,delivered,2018-03-07 23:00:33,cabo frio,RJ,11.0,,1,-10.0
orleans,SC,2000,32,51,16,1.0,climatizacao,4,,52.21,1,boleto,1,7.78,7.79,sao paulo,sao paulo,2018-05-23,2018-05-14 18:55:59,05/10/2018 13:35:00,2018-05-08 22:31:43,delivered,2018-05-08 22:12:34,contagem,MG,5.0,,0,-9.0
brasilia,DF,300,16,2,11,1.0,fashion_bolsas_e_acessorios,5,,61.77,2,credit_card,1,85.97,179.99,sao paulo,sao paulo,2017-05-12,2017-04-27 11:08:55,04/10/2017 18:53:49,2017-03-30 14:55:17,delivered,2017-03-30 14:46:00,uberlandia,MG,27.0,,0,-15.0
sao paulo,SP,250,26,14,14,1.0,moveis_decoracao,4,,121.88,1,boleto,1,10.96,7.6,sao paulo,sao paulo,2017-12-15,2017-12-01 21:11:40,11/28/2017 22:37:15,2017-11-25 01:31:43,delivered,2017-11-24 21:55:22,cafeara,PR,6.0,,0,-14.0
sao paulo,SP,1950,60,15,15,2.0,esporte_lazer,5,,75.75,1,credit_card,1,17.6,49.9,sao paulo,sao paulo,2018-05-14,2018-04-27 16:50:03,04/26/2018 12:35:00,2018-04-25 22:31:56,delivered,2018-04-25 22:18:10,porto alegre,RS,1.0,,0,-17.0
cuiaba,MT,500,16,15,11,2.0,telefonia,5,,130.22,1,credit_card,1,8.03,110.32,sao paulo,sao paulo,2017-08-04,2017-07-21 19:59:36,07/18/2017 12:34:04,2017-07-16 10:35:14,delivered,2017-07-16 10:27:45,sao joaquim da barra,SP,5.0,,0,-14.0
sao carlos,SP,300,16,7,20,,,2,,57.53,3,credit_card,1,11.85,49.0,são paulo,são paulo,2017-10-03,,,2017-09-03 14:30:09,processing,2017-09-03 14:22:03,foz do iguacu,PR,,,0,
sao paulo,SP,7900,70,15,70,6.0,artes,5,,76.02,7,credit_card,1,61.18,159.9,sao paulo,sao paulo,2017-12-14,2017-11-28 20:33:38,11/22/2017 20:17:08,2017-11-21 12:40:55,delivered,2017-11-21 12:08:32,belo horizonte,MG,7.0,,0,-16.0
sao paulo,SP,1800,41,9,34,2.0,cama_mesa_banho,5,,90.17,1,boleto,1,27.39,120.0,sao paulo,sao paulo,2017-10-31,2017-10-24 15:57:46,10/23/2017 13:14:16,2017-10-19 15:35:35,delivered,2017-10-19 15:08:48,sao bernardo do campo,SP,5.0,,0,-7.0
rio de janeiro,RJ,900,37,3,23,1.0,ferramentas_jardim,3,Entrega atrasou,31.0,1,credit_card,1,11.98,21.5,sao paulo,sao paulo,2018-08-13,2018-08-02 21:08:57,07/25/2018 10:06:00,2018-07-23 12:32:22,delivered,2018-07-22 15:19:05,sao goncalo,RJ,11.0,,0,-11.0
formosa do oeste,PR,200,16,2,11,7.0,fashion_bolsas_e_acessorios,1,,106.77,10,credit_card,1,15.61,122.99,sao paulo,sao paulo,2018-01-04,2017-12-11 16:17:04,12/04/2017 21:54:27,2017-12-02 14:38:30,delivered,2017-12-02 14:28:03,suzano,SP,9.0,,0,-24.0
rio de janeiro,RJ,4500,80,70,28,4.0,bebes,5,,163.25,1,voucher,1,19.75,72.99,sao paulo,sao paulo,2018-04-20,2018-03-29 20:08:43,03/27/2018 17:21:48,2018-03-26 09:28:24,delivered,2018-03-26 09:14:26,guarulhos,SP,3.0,,0,-22.0
santos,SP,250,21,7,15,3.0,consoles_games,4,,233.66,1,boleto,1,13.93,129.99,sao paulo,sao paulo,2018-02-06,2018-01-15 14:56:58,01/09/2018 18:35:02,2018-01-09 07:27:15,delivered,2018-01-09 06:37:43,timbo,SC,6.0,,0,-22.0
sao paulo,SP,550,16,25,12,1.0,utilidades_domesticas,3,,163.08,1,credit_card,1,17.89,92.0,sao paulo,sao paulo,2018-03-08,2018-02-14 19:07:41,02/07/2018 22:15:04,2018-02-07 02:35:40,delivered,2018-02-06 18:25:39,camboriu,SC,8.0,,0,-22.0
santa terezinha de goias,GO,1100,39,12,28,4.0,malas_acessorios,5,,135.93,4,credit_card,1,17.89,92.0,sao paulo,sao paulo,2018-07-30,2018-07-26 18:26:37,07/24/2018 14:14:00,2018-07-18 13:50:14,delivered,2018-07-18 13:39:54,nova bassano,RS,8.0,,0,-4.0
curitiba,PR,3600,40,20,40,1.0,cama_mesa_banho,5,,267.05,1,credit_card,1,8.4,33.89,sao paulo,sao paulo,2017-04-17,2017-03-31 10:07:25,03/29/2017 13:23:55,2017-03-28 16:15:15,delivered,2017-03-28 16:03:34,rio grande,RS,2.0,,0,-17.0
sao paulo,SP,100,16,3,11,1.0,consoles_games,3,,186.72,7,credit_card,1,8.4,33.89,são paulo,são paulo,2018-07-05,2018-06-15 20:58:47,06/11/2018 08:23:00,2018-06-08 12:37:01,delivered,2018-06-08 12:19:58,brasilia,DF,7.0,,0,-20.0
arvorezinha,RS,150,16,18,16,2.0,esporte_lazer,3,,30.0,1,voucher,2,8.4,33.89,sao paulo,sao paulo,2017-07-28,2017-07-17 17:03:47,07/13/2017 18:35:37,2017-07-12 02:10:59,delivered,2017-07-10 12:23:05,braganca paulista,SP,7.0,,1,-11.0
sao paulo,SP,3775,18,13,16,1.0,esporte_lazer,5,,97.28,4,credit_card,1,8.4,33.89,são paulo,são paulo,2018-06-04,2018-05-24 19:04:00,05/21/2018 07:09:00,2018-05-18 04:54:31,delivered,2018-05-16 16:10:21,barra do garcas,MT,8.0,,1,-11.0
ribeirao preto,SP,1400,25,20,20,2.0,cool_stuff,5,,48.61,1,credit_card,1,40.37,149.0,sao paulo,sao paulo,2018-07-19,2018-07-11 21:16:47,07/10/2018 15:10:00,2018-07-05 18:55:15,delivered,2018-07-05 18:40:47,sao paulo,SP,6.0,,0,-8.0
guiricema,MG,900,22,7,18,5.0,consoles_games,5,,116.7,1,boleto,1,16.79,20.3,sao paulo,sao paulo,2017-10-18,2017-09-28 19:47:42,09/22/2017 17:54:05,2017-09-21 14:44:35,delivered,2017-09-20 17:12:34,embu,SP,8.0,,0,-20.0
caxias do sul,RS,250,20,12,20,2.0,relogios_presentes,5,,41.42,1,credit_card,1,15.01,179.9,sao paulo,sao paulo,2018-03-16,2018-03-22 00:03:53,02/23/2018 22:42:43,2018-02-22 16:10:41,delivered,2018-02-21 17:15:49,sao bernardo do campo,SP,28.0,,0,6.0
caruaru,PE,350,21,9,16,1.0,brinquedos,4,,42.19,1,boleto,1,15.01,179.9,são paulo,são paulo,2018-01-31,2018-01-24 23:16:49,01/12/2018 14:15:26,2018-01-11 02:48:39,delivered,2018-01-10 14:18:40,brasilia,DF,14.0,,0,-7.0
curitiba,PR,200,20,20,20,,,1,,125.53,6,credit_card,1,12.27,109.9,sao paulo,sao paulo,2017-05-29,2017-05-12 14:04:02,04/28/2017 12:43:07,2017-04-27 17:22:58,delivered,2017-04-26 16:14:11,urussanga,SC,15.0,,1,-17.0
franca,SP,1800,18,32,27,3.0,bebes,5,,92.76,5,credit_card,1,25.9,89.0,sao paulo,sao paulo,2017-12-27,2017-12-08 15:41:46,11/28/2017 22:58:14,2017-11-27 19:39:02,delivered,2017-11-27 19:24:52,silvianopolis,MG,10.0,,0,-19.0
curitiba,PR,5050,50,8,50,2.0,moveis_sala,3,,348.02,8,credit_card,1,13.75,120.0,sao paulo,sao paulo,2018-05-21,2018-05-15 18:38:39,05/14/2018 15:16:00,2018-05-12 03:32:26,delivered,2018-05-11 16:35:19,sao paulo,SP,4.0,,0,-6.0
salvador,BA,27100,50,50,50,1.0,automotivo,4,,203.3,2,credit_card,1,14.28,75.0,são paulo,são paulo,2018-06-12,2018-05-30 15:06:44,05/28/2018 15:43:00,2018-05-25 09:16:24,delivered,2018-05-25 08:54:21,gameleiras,MG,5.0,,0,-13.0
diadema,SP,1500,65,8,38,1.0,eletrodomesticos,1,,44.35,3,credit_card,1,14.52,46.86,sao paulo,sao paulo,2017-12-19,2017-12-11 19:03:18,11/28/2017 19:18:52,2017-11-28 09:35:11,delivered,2017-11-26 09:32:06,belem,PA,15.0,,2,-8.0
itaquaquecetuba,SP,500,16,11,11,2.0,relogios_presentes,1,,116.05,10,credit_card,1,14.84,96.0,sao paulo,sao paulo,2017-12-20,2017-12-05 20:23:33,11/22/2017 17:37:09,2017-11-22 02:49:29,delivered,2017-11-17 21:14:42,pocos de caldas,MG,17.0,,4,-15.0
lencois paulista,SP,350,16,10,16,2.0,cama_mesa_banho,5,,85.14,1,boleto,1,18.12,49.99,sao paulo,sao paulo,2018-08-10,2018-08-01 19:31:47,07/25/2018 14:10:00,2018-07-24 10:32:48,delivered,2018-07-23 18:27:07,contagem,MG,9.0,,0,-9.0
guarulhos,SP,500,16,12,17,3.0,automotivo,5,,236.66,4,credit_card,1,13.58,24.99,sao paulo,sao paulo,2018-03-09,2018-03-09 21:52:36,02/20/2018 20:12:57,2018-02-14 13:15:38,delivered,2018-02-14 13:05:17,santos,SP,23.0,,0,0.0
carapicuiba,SP,1000,20,20,20,1.0,esporte_lazer,5,,220.3,4,credit_card,1,13.58,24.99,sao paulo,sao paulo,2017-06-05,2017-05-12 12:04:38,05/02/2017 13:58:16,2017-04-30 22:55:09,delivered,2017-04-30 22:43:56,piracaia,SP,11.0,,0,-24.0
uruacu,GO,18500,41,30,41,,,1,,180.55,1,credit_card,1,16.6,120.1,são paulo,são paulo,2018-02-07,,01/11/2018 19:39:23,2018-01-11 02:32:30,shipped,2018-01-10 11:33:07,rio de janeiro,RJ,,,0,
itajai,SC,300,24,11,24,2.0,brinquedos,5,,45.46,1,boleto,1,16.25,69.9,sao paulo,sao paulo,2017-06-08,2017-05-23 12:51:55,05/17/2017 09:24:51,2017-05-16 03:35:16,delivered,2017-05-15 16:29:03,santos,SP,7.0,,0,-16.0
sao paulo,SP,250,16,2,20,1.0,beleza_saude,2,,26.08,1,boleto,1,54.02,39.9,sao paulo,sao paulo,2017-08-11,2017-07-31 18:17:45,07/25/2017 19:14:13,2017-07-22 19:25:18,delivered,2017-07-22 19:16:47,sinop,MT,8.0,,0,-11.0
sao paulo,SP,10700,40,40,40,1.0,beleza_saude,5,,375.74,1,credit_card,1,20.31,159.9,sao paulo,sao paulo,2018-07-27,2018-06-28 13:03:08,06/25/2018 15:57:00,2018-06-24 19:20:23,delivered,2018-06-24 19:01:52,guaruja,SP,3.0,,0,-29.0
sao paulo,SP,1700,32,21,22,1.0,utilidades_domesticas,4,,123.41,5,credit_card,1,16.22,540.0,sao paulo,sao paulo,2018-07-25,2018-07-06 11:52:07,07/03/2018 15:04:00,2018-07-02 13:10:15,delivered,2018-07-02 12:54:20,barueri,SP,3.0,,0,-19.0
curitiba,PR,7700,39,28,25,1.0,ferramentas_jardim,5,,379.07,10,credit_card,1,31.17,189.9,sao paulo,sao paulo,2017-04-11,2017-03-20 09:28:56,03/06/2017 09:54:32,2017-03-06 00:33:11,delivered,2017-03-06 00:14:28,sao paulo,SP,14.0,,0,-22.0
loanda,PR,5200,20,60,35,4.0,esporte_lazer,5,,2027.16,10,credit_card,1,8.27,14.9,sao paulo,sao paulo,2017-11-09,2017-10-20 16:18:59,10/05/2017 18:37:19,2017-10-04 23:14:17,delivered,2017-10-04 23:02:21,feliz,RS,15.0,,0,-20.0
sao paulo,SP,125,17,10,14,1.0,telefonia,5,,45.5,1,credit_card,1,11.85,43.9,sao paulo,sao paulo,2018-01-22,2018-01-04 21:56:01,12/26/2017 16:59:04,2017-12-21 17:56:24,delivered,2017-12-21 17:43:41,sao paulo,SP,14.0,,0,-18.0
sao paulo,SP,15700,58,28,58,1.0,moveis_escritorio,3,,91.17,1,credit_card,1,87.28,139.0,sao paulo,sao paulo,2017-06-08,,05/11/2017 13:21:47,2017-05-11 11:45:14,shipped,2017-05-09 11:48:37,belo horizonte,MG,,,1,
sao paulo,SP,350,16,11,11,2.0,relogios_presentes,5,muito boa,93.26,1,boleto,1,13.71,40.35,sao paulo,sao paulo,2018-03-07,2018-02-20 18:09:29,02/06/2018 01:28:26,2018-02-02 16:36:26,delivered,2018-02-02 16:15:41,jambeiro,SP,18.0,,0,-15.0
maringa,PR,213,16,10,13,1.0,esporte_lazer,5,,30.0,1,voucher,2,20.85,469.0,sao paulo,sao paulo,2018-07-04,2018-06-05 17:44:39,06/04/2018 13:08:00,2018-06-02 03:15:28,delivered,2018-06-01 11:26:06,sao jose do rio preto,SP,4.0,,0,-29.0
sao paulo,SP,150,16,11,11,3.0,fashion_bolsas_e_acessorios,5,,165.96,10,credit_card,1,16.17,59.0,sao paulo,sao paulo,2018-08-21,2018-08-14 19:12:05,08/10/2018 12:32:00,2018-08-09 17:30:25,delivered,2018-08-09 16:23:03,ipatinga,MG,5.0,,0,-7.0
sao paulo,SP,18200,56,15,15,3.0,automotivo,4,4,50.0,1,voucher,2,15.79,35.9,sao paulo,sao paulo,2017-12-14,2017-12-06 01:12:12,11/17/2017 15:12:12,2017-11-15 13:55:31,delivered,2017-11-15 13:47:34,tupa,SP,20.0,,0,-8.0
belo horizonte,MG,850,18,21,15,1.0,utilidades_domesticas,1,Médio,1002.73,10,credit_card,1,15.79,35.9,sao paulo,sao paulo,2018-05-07,2018-05-03 02:52:58,04/27/2018 11:49:00,2018-04-26 12:11:18,delivered,2018-04-26 11:59:05,sao paulo,SP,6.0,,0,-4.0
ferraz de vasconcelos,SP,1050,16,20,16,6.0,casa_construcao,1,,116.56,1,boleto,1,16.44,96.99,são paulo,são paulo,2018-08-13,2018-07-23 23:56:47,07/16/2018 14:33:00,2018-07-16 12:30:53,delivered,2018-07-15 12:37:12,brasilia,DF,8.0,,0,-21.0
sao paulo,SP,200,16,9,11,5.0,fashion_bolsas_e_acessorios,1,,240.52,2,credit_card,1,13.89,77.9,são paulo,são paulo,2018-07-16,2018-06-18 23:07:33,06/11/2018 14:44:00,2018-05-30 22:55:45,delivered,2018-05-30 22:33:08,blumenau,SC,19.0,,0,-28.0
limeira,SP,300,16,15,11,1.0,utilidades_domesticas,5,prazo entrega,33.13,3,credit_card,1,20.8,229.99,sao paulo,sao paulo,2017-12-27,2017-12-13 09:44:38,12/08/2017 21:21:12,2017-12-02 14:17:20,delivered,2017-12-02 14:08:33,moncoes,SP,10.0,,0,-14.0
santos,SP,200,23,9,13,1.0,informatica_acessorios,3,,213.9,1,credit_card,1,14.14,56.0,sao paulo,sao paulo,2018-04-11,2018-04-06 22:52:39,04/04/2018 23:16:22,2018-03-29 14:35:21,delivered,2018-03-29 14:27:41,rio de janeiro,RJ,8.0,,0,-5.0
barueri,SP,800,20,25,25,1.0,esporte_lazer,5,,362.17,8,credit_card,1,11.99,69.99,sao paulo,sao paulo,2018-07-11,2018-06-27 17:18:42,06/26/2018 14:58:00,2018-06-25 15:58:17,delivered,2018-06-25 15:36:18,sao paulo,SP,2.0,,0,-14.0
sao paulo,SP,200,24,7,14,2.0,papelaria,5,,88.72,2,credit_card,1,7.78,49.9,sao paulo,sao paulo,2017-09-27,2017-09-16 16:12:24,09/13/2017 18:22:19,2017-09-11 08:10:08,delivered,2017-09-11 07:54:38,balneario camboriu,SC,5.0,,0,-11.0
claudio,MG,698,46,10,14,1.0,esporte_lazer,5,,46.85,2,credit_card,1,7.39,14.0,sao paulo,sao paulo,2018-04-26,2018-04-20 23:12:11,04/19/2018 14:32:30,2018-04-15 19:55:20,delivered,2018-04-15 19:42:06,rio de janeiro,RJ,5.0,,0,-6.0
ribeirao preto,SP,350,17,4,12,6.0,telefonia,5,,68.54,1,boleto,1,14.1,29.0,sao paulo,sao paulo,2018-02-15,2018-01-23 18:22:46,01/15/2018 22:55:00,2018-01-13 08:29:22,delivered,2018-01-13 08:19:23,sao paulo,SP,10.0,,0,-23.0
niteroi,RJ,1000,24,5,17,3.0,livros_interesse_geral,4,,32.62,1,boleto,1,43.06,99.0,são paulo,são paulo,2018-05-02,2018-04-16 23:35:26,04/07/2018 00:49:39,2018-04-04 08:50:15,delivered,2018-04-04 08:39:50,vargem grande,MA,12.0,,0,-16.0
osvaldo cruz,SP,783,21,13,28,1.0,informatica_acessorios,5,,340.08,8,credit_card,1,30.35,499.0,sao paulo,sao paulo,2017-10-20,2017-10-09 18:32:42,10/04/2017 08:03:59,2017-09-27 03:35:03,delivered,2017-09-26 12:32:39,rio brilhante,MS,13.0,,0,-11.0
carapicuiba,SP,600,20,20,20,2.0,perfumaria,5,,82.06,1,boleto,1,12.79,39.85,sao paulo,sao paulo,2018-04-02,2018-03-22 10:18:36,03/02/2018 22:18:35,2018-03-02 02:10:55,delivered,2018-02-28 17:00:28,eugenopolis,MG,21.0,,1,-11.0
osasco,SP,11650,55,30,30,1.0,brinquedos,5,,40.95,1,credit_card,1,14.06,149.0,sao paulo,sao paulo,2017-05-15,2017-04-28 14:37:16,04/24/2017 11:04:27,2017-04-22 19:41:06,delivered,2017-04-22 19:26:47,belem,PA,5.0,,0,-17.0
sao goncalo,RJ,400,16,2,11,1.0,construcao_ferramentas_ferramentas,3,,67.01,3,credit_card,1,12.46,179.98,sao paulo,sao paulo,2017-09-25,2017-09-21 21:16:17,09/14/2017 21:20:03,2017-09-13 13:45:43,delivered,2017-09-13 09:18:50,sao jose do rio preto,SP,8.0,,0,-4.0
jaciara,MT,3050,40,10,40,1.0,brinquedos,5,,20.0,1,voucher,5,14.9,219.99,sao paulo,sao paulo,2018-02-02,2018-01-20 17:56:44,01/18/2018 23:43:46,2018-01-18 09:38:30,delivered,2018-01-18 09:30:54,paulinia,SP,2.0,,0,-13.0
balenario camboriu,SC,100,16,3,11,1.0,telefonia,3,,76.9,1,voucher,2,8.16,129.0,são paulo,são paulo,2017-04-10,2017-04-03 13:37:42,03/30/2017 13:22:17,2017-03-14 16:25:43,delivered,2017-03-14 16:25:43,sao paulo,SP,19.0,,0,-7.0
sao paulo,SP,16500,40,25,26,1.0,ferramentas_jardim,4,,40.27,4,credit_card,1,15.71,137.0,sao paulo,sao paulo,2018-01-19,2018-01-09 15:44:20,12/22/2017 20:41:54,2017-12-21 02:11:52,delivered,2017-12-20 12:30:40,jundiai,SP,20.0,,0,-10.0
timbo,SC,750,34,14,24,2.0,utilidades_domesticas,4,,242.1,8,credit_card,1,10.96,37.0,sao paulo,sao paulo,2018-01-04,2017-12-11 18:52:10,12/05/2017 16:09:06,2017-12-04 18:30:29,delivered,2017-12-04 17:24:57,sao paulo,SP,7.0,,0,-24.0
ribeirao preto,SP,250,36,4,20,1.0,fashion_underwear_e_moda_praia,5,Super produto ,207.24,1,boleto,1,14.83,154.0,sao paulo,sao paulo,2018-08-23,2018-08-14 18:16:42,08/06/2018 13:40:00,2018-08-03 22:35:17,delivered,2018-08-03 22:23:06,santo andre,SP,10.0,,0,-9.0
sao paulo,SP,2300,84,14,20,3.0,malas_acessorios,1,,215.56,2,credit_card,1,82.86,253.52,sao paulo,sao paulo,2018-04-20,2018-04-08 16:22:04,04/04/2018 01:13:40,2018-04-03 05:48:50,delivered,2018-03-29 14:29:44,sao jose dos campos,SP,10.0,,4,-12.0
jacutinga,RS,1350,33,12,26,1.0,eletronicos,4,,39.92,1,credit_card,1,7.39,49.9,sao paulo,sao paulo,2017-06-12,2017-05-30 09:12:44,05/22/2017 15:50:30,2017-05-18 21:10:16,delivered,2017-05-18 20:59:24,rio de janeiro,RJ,11.0,,0,-13.0
fortaleza,CE,530,17,20,20,3.0,utilidades_domesticas,5,,156.09,8,credit_card,1,13.95,148.9,sao paulo,sao paulo,2017-07-18,2017-06-26 13:49:52,06/16/2017 15:37:52,2017-06-16 00:35:26,delivered,2017-06-16 00:22:49,campinas,SP,10.0,,0,-22.0
guarulhos,SP,1300,20,20,20,1.0,automotivo,5,,131.5,2,credit_card,1,18.69,64.9,sao paulo,sao paulo,2017-08-07,2017-07-17 17:23:48,07/07/2017 21:03:12,2017-07-07 02:50:37,delivered,2017-07-05 09:16:49,belo horizonte,MG,12.0,,1,-21.0
guarulhos,SP,4000,57,14,36,5.0,fashion_calcados,1,falta de produto e quebra,137.73,1,boleto,1,16.0,179.0,sao paulo,sao paulo,2018-08-17,2018-08-06 17:20:53,08/02/2018 13:33:00,2018-07-27 13:04:20,delivered,2018-07-27 12:45:51,apucarana,PR,10.0,,0,-11.0
ferraz de  vasconcelos,SP,8150,20,20,20,4.0,esporte_lazer,5,super recomendo,31.75,1,credit_card,1,15.1,27.9,sao paulo,sao paulo,2017-08-03,2017-07-17 20:39:33,07/11/2017 14:36:51,2017-07-08 14:25:09,delivered,2017-07-08 14:12:08,recife,PE,9.0,,0,-17.0
mirandopolis,SP,2200,16,2,11,1.0,construcao_ferramentas_construcao,4,,348.77,8,credit_card,1,16.11,39.0,sao paulo,sao paulo,2018-04-02,2018-03-20 16:13:27,03/19/2018 15:03:06,2018-03-15 17:15:42,delivered,2018-03-15 16:59:11,osasco,SP,4.0,,0,-13.0
joinville,SC,1150,20,25,20,1.0,beleza_saude,4,,12.22,1,credit_card,1,14.1,7.0,sao paulo,sao paulo,2017-07-14,2017-07-04 10:51:55,06/26/2017 18:41:35,2017-06-25 19:45:10,delivered,2017-06-25 19:30:09,valinhos,SP,8.0,,0,-10.0
belo horizonte,MG,200,16,2,11,4.0,relogios_presentes,4,,139.87,4,credit_card,1,10.7,269.0,sao paulo,sao paulo,2018-03-13,2018-03-09 13:46:21,03/07/2018 01:38:40,2018-02-28 21:48:27,delivered,2018-02-28 21:27:43,santo andre,SP,8.0,,0,-4.0
bauru,SP,400,16,20,16,3.0,moveis_decoracao,5,,257.1,12,credit_card,1,17.95,99.9,sao paulo,sao paulo,2018-05-15,2018-04-24 20:38:55,04/17/2018 20:54:27,2018-04-16 22:10:15,delivered,2018-04-16 21:07:16,manaus,AM,7.0,,0,-21.0
jacarei,SP,600,29,12,23,4.0,moveis_decoracao,3,,269.46,3,credit_card,1,15.24,69.9,sao paulo,sao paulo,2018-06-06,2018-06-07 13:58:42,05/18/2018 15:26:00,2018-05-16 08:36:57,delivered,2018-05-15 19:55:51,cidreira,RS,22.0,,0,1.0
itu,SP,300,35,7,12,,,1,não recebi ainda,40.0,1,credit_card,1,23.13,89.9,sao paulo,sao paulo,2018-08-09,2018-07-24 20:16:30,07/16/2018 09:53:00,2018-07-13 16:04:02,delivered,2018-07-13 15:45:51,rio de janeiro,RJ,11.0,,0,-16.0
laranjeiras do sul,SP,1200,16,10,16,1.0,cama_mesa_banho,5,,350.09,10,credit_card,1,19.03,165.0,sao paulo,sao paulo,2017-08-21,2017-08-05 12:14:47,08/03/2017 16:17:38,2017-08-03 03:04:48,delivered,2017-08-01 18:52:12,santiago,RS,3.0,,1,-16.0
sao paulo,SP,10664,61,63,35,5.0,cool_stuff,5,,134.55,6,credit_card,2,11.73,57.99,sao paulo,sao paulo,2018-07-31,2018-07-25 23:58:19,07/24/2018 12:57:00,2018-07-26 23:31:53,delivered,2018-07-21 12:49:32,sao paulo,SP,4.0,,5,-6.0
videira,SC,1800,50,12,36,2.0,utilidades_domesticas,5,,112.73,3,credit_card,1,10.63,259.0,sao paulo,sao paulo,2017-03-28,2017-03-16 08:24:47,03/10/2017 16:23:51,2017-03-09 22:17:49,delivered,2017-03-09 22:17:49,sao sepe,RS,6.0,,0,-12.0
florianopolis,SC,500,16,2,11,3.0,esporte_lazer,3,recomendo,72.05,1,boleto,1,7.65,55.0,são paulo,são paulo,2018-02-01,2018-01-04 21:23:53,12/12/2017 17:17:24,2017-12-09 17:37:27,delivered,2017-12-09 17:27:58,alta floresta,MT,26.0,,0,-28.0
itapecerica da serra,SP,258,19,12,19,1.0,papelaria,5,,0.67,1,credit_card,1,16.69,133.0,sao paulo,sao paulo,2018-08-10,2018-08-07 13:59:38,08/03/2018 10:30:00,2018-08-02 10:45:12,delivered,2018-08-01 10:48:19,guarulhos,SP,6.0,,0,-3.0
mamanguape,PB,1400,16,44,37,1.0,papelaria,5,,77.77,2,credit_card,1,18.23,35.9,sao paulo,sao paulo,2018-05-03,2018-04-16 20:58:47,04/11/2018 22:46:53,2018-04-11 05:50:45,delivered,2018-04-09 13:56:45,jaboatao dos guararapes,PE,7.0,,1,-17.0
sao paulo,SP,400,35,7,35,1.0,brinquedos,5,,26.68,2,credit_card,1,18.23,14.89,sao paulo,sao paulo,2018-02-26,2018-02-19 15:07:08,02/14/2018 23:09:27,2018-02-10 19:35:32,delivered,2018-02-10 19:27:28,sao paulo,SP,8.0,,0,-7.0
ponte nova,MG,1300,30,10,30,5.0,climatizacao,4,,371.42,1,credit_card,1,13.0,99.0,sao paulo,sao paulo,2017-06-16,2017-05-15 12:00:17,04/27/2017 11:51:58,2017-04-27 11:22:56,delivered,2017-04-27 11:08:59,ibatiba,ES,18.0,,0,-32.0
goioere,SP,1000,30,10,25,2.0,cama_mesa_banho,5,,225.71,6,credit_card,1,9.44,90.0,sao paulo,sao paulo,2017-12-27,2017-12-13 18:03:38,12/11/2017 23:10:16,2017-12-08 02:54:25,delivered,2017-12-06 15:26:09,hortolandia,SP,7.0,,1,-14.0
pederneiras,SP,1300,30,10,18,3.0,pet_shop,3,Nota3,103.79,3,credit_card,1,27.39,43.49,sao paulo,sao paulo,2017-12-26,2017-12-08 20:56:54,12/01/2017 20:13:00,2017-12-01 10:31:12,delivered,2017-11-30 22:37:50,sao paulo,SP,7.0,,0,-18.0
itapevi,SP,3305,38,36,19,2.0,brinquedos,5,,65.0,1,boleto,1,36.85,109.99,sao paulo,sao paulo,2017-06-28,2017-06-16 14:04:09,06/08/2017 16:18:32,2017-06-07 19:42:11,delivered,2017-06-05 13:24:46,cotia,SP,11.0,,2,-12.0
goiania,GO,6000,75,15,50,2.0,bebes,5,,69.8,1,voucher,2,15.23,9.99,sao paulo,sao paulo,2017-10-04,2017-09-22 16:43:37,09/13/2017 22:39:49,2017-09-12 16:45:08,delivered,2017-09-12 16:32:09,macae,RJ,10.0,,0,-12.0
sao paulo,SP,300,35,5,25,4.0,informatica_acessorios,3,,20.09,1,voucher,2,15.23,9.99,sao paulo,sao paulo,2018-07-31,2018-07-24 19:26:42,07/23/2018 12:24:00,2018-07-23 12:31:53,delivered,2018-07-22 22:30:05,saudades,SC,1.0,,0,-7.0
rio de janeiro,RJ,250,20,2,15,1.0,cama_mesa_banho,5,,125.41,1,credit_card,1,34.15,28.5,são paulo,são paulo,2018-07-11,2018-06-08 18:58:53,06/04/2018 15:11:00,2018-06-03 18:49:57,delivered,2018-06-03 18:24:33,rio de janeiro,RJ,5.0,,0,-33.0
sao paulo,SP,400,18,11,11,2.0,perfumaria,3,Suspense,95.99,1,boleto,1,8.74,199.0,sao paulo,sao paulo,2018-06-08,2018-06-06 14:06:48,05/24/2018 16:13:00,2018-05-23 16:56:50,delivered,2018-05-23 16:37:35,macapa,AP,13.0,,0,-2.0
sao paulo,SP,250,16,10,30,1.0,eletronicos,5,,25.33,2,credit_card,1,21.44,135.9,sao paulo,sao paulo,2018-03-13,2018-02-23 20:59:12,02/06/2018 18:49:02,2018-02-03 11:10:37,delivered,2018-02-03 10:51:17,salto de pirapora,SP,20.0,,0,-18.0
caxias do sul,RS,1250,29,19,22,2.0,brinquedos,3,,52.57,1,credit_card,1,37.09,249.0,sao paulo,sao paulo,2018-06-04,2018-06-01 23:27:31,05/23/2018 12:24:00,2018-05-17 08:59:32,delivered,2018-05-17 08:33:19,taboao da serra,SP,15.0,,0,-3.0
sao bernardo do campo,SP,950,40,6,40,2.0,fashion_roupa_masculina,5,,145.58,2,credit_card,1,15.56,49.99,são paulo,são paulo,2018-08-30,2018-08-20 23:38:44,08/13/2018 10:37:00,2018-08-10 13:55:18,delivered,2018-08-10 13:42:06,bom jesus,GO,10.0,,0,-10.0
campina grande,PB,2000,30,34,17,6.0,pet_shop,5,,49.7,3,credit_card,1,7.53,38.0,são paulo,são paulo,2018-05-11,2018-04-26 20:11:48,04/20/2018 22:38:37,2018-04-18 20:32:54,delivered,2018-04-18 20:13:31,caxias do sul,RS,7.0,,0,-15.0
estancia velha,RS,13575,71,81,44,7.0,bebes,1,,47.43,1,credit_card,1,11.62,85.0,sao paulo,sao paulo,2017-10-27,2017-10-13 21:13:13,09/30/2017 15:55:11,2017-09-27 14:56:18,delivered,2017-09-27 14:43:47,uberlandia,MG,16.0,,0,-14.0
resende,RJ,667,17,16,16,1.0,beleza_saude,3,,168.57,2,credit_card,1,25.66,117.3,são paulo,são paulo,2018-03-06,2018-02-18 14:28:47,02/07/2018 23:34:48,2018-02-06 17:32:25,delivered,2018-02-05 17:27:54,santa cruz do rio pardo,SP,12.0,,1,-16.0
jaragua do sul,SC,267,17,11,12,2.0,relogios_presentes,5,,133.81,1,credit_card,1,18.57,99.9,sao paulo,sao paulo,2017-12-06,2017-11-29 00:44:50,11/20/2017 12:49:03,2017-11-17 14:25:26,delivered,2017-11-16 14:32:06,diadema,SP,12.0,,0,-7.0
sao paulo,SP,1750,45,20,40,2.0,cama_mesa_banho,5,Entrega antes do previsto,1.23,1,voucher,2,14.35,99.9,sao paulo,sao paulo,2018-02-26,2018-02-14 18:04:45,02/05/2018 17:12:14,2018-02-01 13:35:14,delivered,2018-01-31 13:21:44,santa ines,BA,14.0,,1,-12.0
sao paulo,SP,150,16,12,11,1.0,beleza_saude,1,,123.82,1,boleto,1,7.87,18.0,sao paulo,sao paulo,2018-02-07,2018-01-22 21:18:33,01/15/2018 17:24:13,2018-01-12 02:38:34,delivered,2018-01-11 16:51:17,rio de janeiro,RJ,11.0,,0,-16.0
rio de janeiro,RJ,10550,65,7,45,1.0,brinquedos,1,,283.66,3,credit_card,1,7.39,11.53,sao paulo,sao paulo,2017-06-26,2017-06-12 17:45:34,06/05/2017 09:12:22,2017-06-04 10:22:32,delivered,2017-06-04 10:05:59,serrinha,BA,8.0,,0,-14.0
sao paulo,SP,1725,100,35,16,1.0,utilidades_domesticas,1,,89.88,1,credit_card,1,39.41,269.99,sao paulo,sao paulo,2018-04-19,2018-04-13 20:03:50,04/04/2018 00:08:23,2018-03-29 16:35:38,delivered,2018-03-29 16:17:53,votorantim,SP,15.0,,0,-6.0
sao paulo,SP,700,45,10,31,1.0,malas_acessorios,5,,32.38,1,boleto,1,14.8,89.99,sao paulo,sao paulo,2017-08-08,2017-07-27 18:41:46,07/20/2017 20:19:38,2017-07-17 22:10:20,delivered,2017-07-17 21:55:56,hortolandia,SP,9.0,,0,-12.0
florianopolis,SC,400,34,16,16,1.0,esporte_lazer,5,Recomendo,43.08,1,credit_card,1,42.76,19.9,sao paulo,sao paulo,2018-05-28,2018-05-17 22:05:03,05/11/2018 10:44:00,2018-05-10 11:36:29,delivered,2018-05-09 14:32:09,itatiaia,RJ,8.0,,0,-11.0
sorocaba,SP,300,30,10,20,3.0,papelaria,5,,254.58,1,credit_card,1,13.47,166.9,sao paulo,sao paulo,2018-08-15,2018-08-15 15:02:09,08/10/2018 17:10:00,2018-08-08 21:25:20,delivered,2018-08-08 21:11:25,duque de caxias,RJ,6.0,,0,0.0
sao paulo,SP,5850,60,25,25,1.0,casa_construcao,3,,48.91,1,voucher,2,12.44,133.74,sao paulo,sao paulo,2018-05-09,2018-05-03 21:54:44,04/25/2018 08:54:00,2018-04-19 02:51:01,delivered,2018-04-17 11:25:39,varre-sai,RJ,16.0,,1,-6.0
ribeirao preto,SP,267,17,11,13,1.0,relogios_presentes,5,Top,48.22,4,credit_card,1,7.86,86.8,sao paulo,sao paulo,2017-05-11,2017-05-02 15:45:27,04/24/2017 19:08:53,2017-04-22 14:01:13,delivered,2017-04-22 13:48:18,rio de janeiro,RJ,10.0,,0,-9.0
sorocaba,SP,1500,39,12,25,2.0,cama_mesa_banho,4,,67.58,6,credit_card,1,8.59,62.0,sao paulo,sao paulo,2018-01-04,2017-12-18 16:53:32,12/13/2017 15:12:16,2017-12-11 21:55:32,delivered,2017-12-11 21:43:24,caxias do sul,RS,6.0,,0,-17.0
maua,SP,400,24,16,14,1.0,cool_stuff,5,,311.18,10,credit_card,1,10.68,158.0,sao paulo,sao paulo,2018-05-23,2018-05-16 20:37:03,05/07/2018 14:14:00,2018-05-04 10:51:52,delivered,2018-05-04 10:29:14,rio de janeiro,RJ,12.0,,0,-7.0
bauru,SP,1300,31,32,31,1.0,esporte_lazer,4,,154.14,4,credit_card,1,31.16,308.0,sao paulo,sao paulo,2017-12-13,,11/22/2017 17:28:34,2017-11-18 19:50:31,shipped,2017-11-17 19:53:21,vila velha,ES,,,0,
bauru,SP,400,16,10,14,1.0,utilidades_domesticas,5,,333.68,2,credit_card,1,47.4,129.0,sao paulo,sao paulo,2018-01-24,2017-12-27 13:47:01,12/18/2017 16:36:55,2017-12-17 20:50:00,delivered,2017-12-17 19:40:26,campinas,SP,9.0,,0,-28.0
belo horizonte,MG,150,25,2,19,1.0,artes,3,,404.88,1,boleto,1,21.49,143.54,sao paulo,sao paulo,2018-01-19,2018-01-03 22:54:29,12/23/2017 13:12:55,2017-12-22 04:51:23,delivered,2017-12-21 04:59:55,mangaratiba,RJ,13.0,,0,-16.0
salto,SP,650,25,13,14,1.0,beleza_saude,4,,44.77,1,boleto,1,18.23,39.99,sao paulo,sao paulo,2018-03-22,2018-03-05 20:53:02,03/01/2018 20:39:44,2018-02-27 10:15:33,delivered,2018-02-27 10:05:56,atibaia,SP,6.0,,0,-17.0
goiania,GO,706,32,8,38,1.0,consoles_games,5,,1302.42,1,voucher,1,18.23,39.99,sao paulo,sao paulo,2018-04-24,2018-03-29 13:49:10,03/21/2018 21:05:29,2018-03-18 21:10:32,delivered,2018-03-18 20:59:28,sao paulo,SP,10.0,,0,-26.0
caratinga,MG,300,25,10,25,1.0,fashion_bolsas_e_acessorios,4,,645.8,10,credit_card,1,12.92,49.9,sao paulo,sao paulo,2017-02-13,2017-01-17 15:52:28,01/11/2017 16:25:57,2017-01-07 03:45:40,delivered,2017-01-05 13:34:35,salvador,BA,12.0,,1,-27.0
auriflama/sp,SP,4850,75,5,50,1.0,cama_mesa_banho,5,,186.39,1,credit_card,1,23.34,119.9,sao paulo,sao paulo,2017-12-19,2017-12-18 20:24:54,12/08/2017 23:28:26,2017-11-28 03:48:24,delivered,2017-11-24 16:56:46,maceio,AL,24.0,,3,-1.0
rio de janeiro,RJ,825,20,24,15,1.0,automotivo,5,,208.41,10,credit_card,1,15.1,16.9,sao paulo,sao paulo,2018-01-19,2018-01-03 21:12:08,12/26/2017 19:49:01,2017-12-24 17:48:13,delivered,2017-12-24 17:34:12,porto alegre,RS,10.0,,0,-16.0
franca,SP,600,46,3,15,1.0,informatica_acessorios,1,,76.39,1,debit_card,1,15.1,29.99,sao paulo,sao paulo,2018-04-11,2018-04-05 19:34:29,04/02/2018 23:24:37,2018-03-29 15:29:55,delivered,2018-03-29 15:08:14,rio de janeiro,RJ,7.0,,0,-6.0
cafelandia,SP,700,23,9,11,2.0,esporte_lazer,5,,67.42,2,credit_card,1,34.15,30.99,sao paulo,sao paulo,2017-12-26,2017-12-12 22:32:47,12/02/2017 14:24:58,2017-11-29 19:16:55,delivered,2017-11-29 17:43:34,birigui,SP,13.0,,0,-14.0
sao paulo,SP,300,40,10,27,1.0,moveis_decoracao,1,,232.05,4,credit_card,1,15.34,84.99,sao paulo,sao paulo,2018-05-03,2018-04-13 23:45:22,04/05/2018 23:22:09,2018-04-05 02:27:56,delivered,2018-04-03 13:47:14,franca,SP,10.0,,1,-20.0
ribeirao preto,SP,1270,17,14,17,2.0,utilidades_domesticas,1,,69.33,1,boleto,1,45.12,149.0,sao paulo,sao paulo,2017-05-10,2017-05-03 11:43:59,04/24/2017 09:53:33,2017-04-20 16:30:11,delivered,2017-04-20 16:18:26,petropolis,RJ,12.0,,0,-7.0
sao ludgero,SC,450,20,2,11,1.0,construcao_ferramentas_ferramentas,5,,641.2,3,credit_card,1,8.82,48.9,sao paulo,sao paulo,2018-02-21,2018-02-08 18:38:55,01/29/2018 20:37:16,2018-01-27 02:45:33,delivered,2018-01-25 23:13:41,niteroi,RJ,13.0,,1,-13.0
uba,MG,2200,16,2,11,,,5,produto show,41.86,1,boleto,1,8.86,159.49,sao paulo,sao paulo,2018-05-16,2018-05-09 15:15:10,05/08/2018 16:46:00,2018-05-08 14:55:47,delivered,2018-05-08 14:38:14,porto alegre,RS,1.0,,0,-7.0
sao bernardo do campo,SP,150,18,8,13,1.0,eletrodomesticos,1,,50.0,1,voucher,1,41.53,249.9,sao paulo,sao paulo,2018-07-12,2018-06-26 17:08:45,06/21/2018 14:12:00,2018-06-18 12:37:24,delivered,2018-06-16 19:05:54,sao pedro,SP,9.0,,1,-16.0
sao paulo / sao paulo,SP,200,16,3,11,1.0,ferramentas_jardim,5,,106.96,1,credit_card,1,7.75,24.89,sao paulo,sao paulo,2017-07-25,2017-07-11 20:22:31,07/03/2017 11:42:08,2017-07-02 21:03:55,delivered,2017-07-02 20:47:24,jaguariaiva,PR,8.0,,0,-14.0
ibitinga,SP,10893,33,88,44,1.0,moveis_cozinha_area_de_servico_jantar_e_jardim,5,,2288.31,10,credit_card,1,7.78,53.99,sao paulo,sao paulo,2018-02-19,2018-01-30 14:36:52,01/24/2018 16:47:22,2018-01-24 00:16:30,delivered,2018-01-23 23:59:03,rio de janeiro,RJ,6.0,,0,-20.0
maringa,PR,1800,25,7,20,1.0,utilidades_domesticas,1,,69.9,1,boleto,1,7.39,15.99,sao paulo,sao paulo,2018-02-06,2018-01-22 23:23:25,01/17/2018 17:26:14,2018-01-17 03:34:29,delivered,2018-01-16 22:34:16,franco da rocha,SP,6.0,,0,-15.0
sao jose do rio preto,SP,1220,20,33,22,2.0,brinquedos,5,super recoendo,88.08,1,boleto,1,11.85,24.5,sao paulo,sao paulo,2018-03-08,2018-02-28 21:09:14,02/26/2018 21:04:32,2018-02-23 07:08:17,delivered,2018-02-22 15:04:08,sao paulo,SP,6.0,,0,-8.0
campinas,SP,360,30,19,22,6.0,beleza_saude,5,,117.39,4,credit_card,1,22.99,179.0,sao paulo,sao paulo,2018-04-27,2018-04-19 18:03:46,04/04/2018 20:04:05,2018-03-30 23:26:57,delivered,2018-03-30 23:11:40,brasilia,DF,19.0,,0,-8.0
rio de janeiro,RJ,175,22,11,15,1.0,eletronicos,5,,194.91,1,debit_card,1,21.43,37.9,sao paulo,sao paulo,2017-03-16,2017-03-01 14:09:10,02/16/2017 14:42:05,2017-02-12 19:02:52,delivered,2017-02-12 18:48:56,cacapava,SP,16.0,,0,-15.0
porto ferreira,SP,1900,50,13,70,1.0,pet_shop,5,,68.89,1,debit_card,1,22.56,89.9,são paulo,são paulo,2018-03-05,2018-04-23 15:49:34,02/02/2018 00:24:34,2018-02-01 08:10:31,delivered,2018-02-01 07:47:34,jundiai,SP,81.0,,0,49.0
tres coroas,RS,250,20,20,20,5.0,esporte_lazer,3,Erraram na caixa acústica,151.51,2,credit_card,1,22.56,89.9,sao paulo,sao paulo,2018-07-12,2018-06-15 14:28:27,06/08/2018 13:20:00,2018-06-06 14:35:26,delivered,2018-06-06 14:21:47,salvador,BA,9.0,,0,-27.0
santo andre,SP,6950,85,11,50,3.0,bebes,5,,54.85,1,credit_card,1,22.56,89.9,sao paulo,sao paulo,2017-12-12,2017-11-27 20:41:48,11/21/2017 18:18:35,2017-11-17 13:35:40,delivered,2017-11-17 13:12:47,pindamonhangaba,SP,10.0,,0,-15.0
blumenau,SC,1100,55,5,40,1.0,utilidades_domesticas,4,,103.68,1,credit_card,1,29.08,88.34,sao paulo,sao paulo,2018-02-21,2018-02-05 19:38:56,02/01/2018 18:13:16,2018-01-30 17:57:55,delivered,2018-01-30 17:36:43,irati,PR,6.0,,0,-16.0
santo andre,SP,300,17,7,24,5.0,bebes,5,,225.63,1,debit_card,1,18.5,177.9,sao paulo,sao paulo,2018-03-21,2018-03-13 18:56:39,03/08/2018 19:58:35,2018-03-07 12:29:55,delivered,2018-03-07 12:08:37,ribeira,SP,6.0,,0,-8.0
santo andre,SP,16500,58,28,58,1.0,moveis_escritorio,5,Ótima compra,39.6,1,boleto,1,14.1,32.99,sao paulo,sao paulo,2018-02-08,2018-01-17 15:44:12,01/10/2018 22:48:10,2018-01-10 10:31:35,delivered,2018-01-10 09:04:09,ipatinga,MG,7.0,,0,-22.0
sao paulo,SP,300,16,23,19,1.0,malas_acessorios,5,,159.18,10,credit_card,1,0.0,69.9,sao paulo,sao paulo,2017-03-17,2017-02-20 18:14:01,02/15/2017 12:37:51,2017-02-10 02:55:28,delivered,2017-02-08 18:00:36,sao paulo,SP,12.0,,1,-25.0
sao paulo,SP,1836,61,6,24,1.0,eletronicos,1,,234.43,1,credit_card,1,12.27,109.9,sao paulo,sao paulo,2018-07-24,2018-07-04 21:48:36,07/02/2018 13:39:00,2018-06-30 22:10:13,delivered,2018-06-30 21:57:55,barbacena,MG,3.0,,0,-20.0
sao paulo,SP,175,18,22,16,1.0,beleza_saude,5,,44.83,1,boleto,1,22.3,52.99,sao paulo,sao paulo,2018-08-17,2018-08-16 19:18:51,08/10/2018 13:40:00,2018-08-08 11:05:15,delivered,2018-08-08 10:49:59,limoeiro,PE,8.0,,0,-1.0
blumenau,SC,675,22,24,21,1.0,brinquedos,2,,205.44,4,credit_card,1,14.51,110.9,sao paulo,sao paulo,2017-10-30,2017-10-09 18:32:38,10/06/2017 17:16:05,2017-10-05 06:21:20,delivered,2017-10-05 05:23:47,espigao do oeste,RO,4.0,,0,-21.0
mogi das cruzes,SP,200,26,5,20,4.0,esporte_lazer,2,,13.55,1,credit_card,1,12.48,35.9,sao paulo,sao paulo,2018-05-11,2018-04-27 23:17:26,04/17/2018 13:16:29,2018-04-10 15:11:08,delivered,2018-04-10 14:58:16,belford roxo,RJ,17.0,,0,-14.0
santos,SP,1200,30,20,30,1.0,industria_comercio_e_negocios,2,,221.96,1,credit_card,1,7.53,39.0,sao paulo,sao paulo,2018-02-22,2018-02-19 13:28:50,02/09/2018 21:41:54,2018-02-08 19:32:18,delivered,2018-02-08 18:56:45,sao jose dos campos,SP,10.0,,0,-3.0
osasco,SP,200,39,2,30,2.0,informatica_acessorios,5,,52.38,1,credit_card,1,7.46,27.9,sao paulo,sao paulo,2018-07-27,2018-07-23 18:09:27,07/17/2018 10:32:00,2018-07-12 20:35:10,delivered,2018-07-12 20:24:07,brasilia,DF,10.0,,0,-4.0
jaci,SP,16100,63,61,24,2.0,moveis_escritorio,5,,131.47,9,credit_card,1,65.34,579.0,sao paulo,sao paulo,2017-12-14,2017-12-17 10:47:53,11/30/2017 18:18:50,2017-11-24 16:19:01,delivered,2017-11-24 14:15:53,coronel fabriciano,MG,22.0,,0,3.0
claudio,MG,117,19,4,12,1.0,telefonia,5,,38.06,2,credit_card,1,23.57,99.9,sao paulo,sao paulo,2017-12-05,,,2017-11-16 15:26:57,unavailable,2017-11-16 15:09:28,diadema,SP,,,0,
goiania,GO,455,36,18,27,1.0,telefonia_fixa,1,,35.0,1,voucher,2,19.32,37.0,sao paulo,sao paulo,2017-09-27,2017-09-12 20:59:50,09/04/2017 19:22:51,2017-08-31 18:05:09,delivered,2017-08-31 17:46:40,brasilia,DF,12.0,,0,-15.0
laranjal paulista,SP,550,16,10,16,1.0,cama_mesa_banho,5,,143.65,3,credit_card,1,30.66,116.6,sao paulo,sao paulo,2018-05-30,2018-05-22 20:37:31,05/16/2018 15:47:00,2018-05-16 03:14:50,delivered,2018-05-15 09:10:20,brasilia,DF,7.0,,0,-8.0
sorocaba,SP,750,22,12,33,4.0,fashion_calcados,5,,86.73,3,credit_card,1,19.25,49.0,sao paulo,sao paulo,2018-02-06,2018-02-06 15:49:01,01/24/2018 00:34:56,2018-01-22 19:36:30,delivered,2018-01-22 19:22:26,itanhaem,SP,14.0,,0,0.0
sao paulo,SP,586,18,11,13,2.0,cool_stuff,5,,118.35,5,credit_card,1,9.26,27.9,sao paulo,sao paulo,2018-07-13,2018-06-28 16:41:38,06/18/2018 12:23:00,2018-06-16 00:23:09,delivered,2018-06-16 00:01:56,goiania,GO,12.0,,0,-15.0
americana,SP,540,16,27,16,6.0,construcao_ferramentas_iluminacao,5,,341.58,1,credit_card,1,25.73,65.0,sao paulo,sao paulo,2018-08-02,2018-08-01 23:57:28,07/31/2018 11:13:00,2018-07-31 03:50:25,delivered,2018-07-28 18:21:00,bebedouro,SP,4.0,,2,-1.0
sao paulo,SP,3700,30,20,20,1.0,esporte_lazer,5,,105.42,2,credit_card,1,11.85,39.9,sao paulo,sao paulo,2017-12-18,2017-12-12 20:22:51,12/04/2017 21:37:41,2017-11-28 21:17:25,delivered,2017-11-28 21:07:26,americana,SP,13.0,,0,-6.0
sao paulo,SP,3150,30,17,30,4.0,utilidades_domesticas,5,,68.16,4,credit_card,1,17.87,105.0,sao paulo,sao paulo,2018-03-23,2018-03-05 22:04:37,02/21/2018 18:49:53,2018-02-11 14:25:28,delivered,2018-02-11 14:13:54,salvador,BA,22.0,,0,-18.0
rio de janeiro,RJ,2100,53,27,40,1.0,cama_mesa_banho,4,,357.97,10,credit_card,1,23.33,25.79,sao paulo,sao paulo,2018-04-16,2018-04-06 01:23:24,04/05/2018 00:32:57,2018-03-20 03:48:59,delivered,2018-03-17 15:21:11,uba,MG,19.0,,2,-10.0
sertanopolis,SP,314,20,19,18,3.0,construcao_ferramentas_seguranca,4,,2.99,1,voucher,3,23.33,25.79,sao paulo,sao paulo,2018-06-28,2018-06-05 18:19:32,06/04/2018 15:05:00,2018-06-03 12:10:28,delivered,2018-06-03 11:52:11,arapongas,PR,2.0,,0,-23.0
ibitinga,SP,550,23,15,23,1.0,cama_mesa_banho,1,Horrível,92.57,1,boleto,1,13.68,146.01,sao paulo,sao paulo,2018-05-24,2018-05-17 16:56:33,05/11/2018 13:49:00,2018-05-07 22:11:35,delivered,2018-05-07 21:49:08,vinhedo,SP,9.0,,0,-7.0
apucarana,PR,13825,70,35,49,1.0,automotivo,5,,68.35,2,credit_card,1,26.61,189.9,são paulo,são paulo,2018-04-05,2018-03-29 23:31:48,03/13/2018 19:18:29,2018-03-10 14:50:28,delivered,2018-03-09 14:58:05,itajai,SC,20.0,,0,-7.0
sao jose do rio preto,SP,850,40,6,50,1.0,cama_mesa_banho,5,,197.23,13,credit_card,1,26.26,139.65,sao paulo,sao paulo,2018-04-03,2018-03-22 22:12:59,03/01/2018 20:07:45,2018-02-27 16:15:38,delivered,2018-02-27 15:53:44,dourados,MS,23.0,,0,-12.0
rio de janeiro,RJ,250,21,4,13,1.0,bebes,5,super recomendo,153.67,3,credit_card,1,7.68,59.9,sao paulo,sao paulo,2018-02-20,2018-02-15 15:08:38,02/07/2018 18:44:52,2018-01-24 15:08:06,delivered,2018-01-24 11:40:28,bauru,SP,22.0,,0,-5.0
maringa,PR,400,20,20,20,1.0,brinquedos,5,,46.43,3,credit_card,1,15.23,13.65,sao paulo,sao paulo,2018-07-04,2018-06-19 11:22:36,06/11/2018 14:05:00,2018-06-09 11:15:21,delivered,2018-06-09 11:02:51,pradopolis,SP,10.0,,0,-15.0
sao paulo,SP,400,16,20,15,2.0,perfumaria,5,Muito bom. ,102.03,4,credit_card,1,16.11,31.9,sao paulo,sao paulo,2017-11-27,2017-11-16 21:48:37,11/13/2017 21:32:01,2017-11-11 22:30:25,delivered,2017-11-11 22:16:49,sao paulo,SP,4.0,,0,-11.0
guarulhos,SP,200,16,2,16,1.0,consoles_games,5,,119.45,5,credit_card,1,16.6,33.99,sao paulo,sao paulo,2018-07-31,2018-07-09 16:02:28,06/28/2018 11:57:00,2018-06-28 11:31:07,delivered,2018-06-28 11:08:58,aripuana,MT,11.0,,0,-22.0
penapolis,SP,250,20,20,20,5.0,automotivo,5,,44.23,1,credit_card,1,14.59,158.9,sao paulo,sao paulo,2018-08-27,2018-08-15 00:18:53,08/02/2018 16:46:00,2018-08-01 15:31:17,delivered,2018-08-01 14:58:41,braganca paulista,SP,13.0,,0,-12.0
niteroi,RJ,1950,17,11,12,4.0,informatica_acessorios,5,,67.5,1,credit_card,1,11.85,47.4,sao paulo,sao paulo,2017-12-27,2017-12-19 14:19:22,11/27/2017 15:12:48,2017-11-24 20:56:27,delivered,2017-11-24 17:37:41,sao paulo,SP,24.0,,0,-8.0
joinville,SC,300,35,10,25,1.0,moveis_decoracao,5,,8.75,1,voucher,5,21.19,50.0,sao paulo,sao paulo,2018-03-01,2018-02-23 22:59:22,02/05/2018 15:54:50,2018-02-03 15:11:02,delivered,2018-02-03 14:56:55,guaratinga,BA,20.0,,0,-6.0
colombo,PR,1050,30,45,11,1.0,relogios_presentes,5,,44.27,2,credit_card,1,11.15,59.9,sao paulo,sao paulo,2017-05-25,2017-05-11 17:22:55,04/28/2017 14:07:00,2017-04-27 10:35:12,delivered,2017-04-27 10:24:22,sao paulo,SP,14.0,,0,-14.0
vicente de carvalho,SP,400,16,7,11,4.0,automotivo,4,,37.15,1,credit_card,1,39.66,199.0,são paulo,são paulo,2018-05-04,2018-04-23 13:47:49,04/11/2018 16:58:25,2018-04-10 16:35:12,delivered,2018-04-10 16:22:27,ponta pora,MS,12.0,,0,-11.0
mesquita,RJ,1000,56,9,22,1.0,instrumentos_musicais,5,,114.13,2,credit_card,1,39.66,199.0,sao paulo,sao paulo,2017-12-22,2017-12-11 17:38:06,12/01/2017 23:19:42,2017-11-13 10:16:29,delivered,2017-11-13 10:07:36,aracatuba,SP,28.0,,0,-11.0
londrina,PR,150,16,16,11,1.0,esporte_lazer,5,,396.97,1,credit_card,1,23.07,69.9,sao paulo,sao paulo,2018-08-14,2018-08-02 00:42:53,07/25/2018 13:19:00,2018-07-25 02:55:14,delivered,2018-07-23 10:21:28,volta redonda,RJ,9.0,,1,-12.0
sao pauo,SP,700,16,16,16,1.0,beleza_saude,1,,185.85,10,credit_card,1,15.1,50.21,são paulo,são paulo,2018-04-13,2018-04-05 20:09:27,04/04/2018 19:12:15,2018-04-04 03:29:36,delivered,2018-04-03 20:44:15,maringa,PR,1.0,,0,-8.0
florianopolis,SC,450,17,7,17,3.0,consoles_games,5,,62.11,3,credit_card,1,16.6,39.9,sao paulo,sao paulo,2018-01-31,2018-01-17 22:08:50,01/15/2018 23:19:13,2018-01-12 19:37:22,delivered,2018-01-12 19:27:08,guarulhos,SP,5.0,,0,-14.0
belo horizonte,MG,2000,30,12,16,1.0,beleza_saude,1,,25.23,2,credit_card,1,14.1,24.99,são paulo,são paulo,2017-08-11,2017-08-08 15:07:39,07/26/2017 00:58:24,2017-07-24 17:30:29,delivered,2017-07-24 17:19:00,sao paulo,SP,14.0,,0,-3.0
sao paulo,SP,21400,20,20,20,4.0,construcao_ferramentas_construcao,5,,153.22,5,credit_card,1,19.01,130.0,sao paulo,sao paulo,2018-03-28,2018-03-16 13:58:58,03/08/2018 20:12:34,2018-03-08 00:49:38,delivered,2018-03-07 23:46:19,sao paulo,SP,8.0,,0,-12.0
cascavel,PR,300,16,7,11,,,4,,145.01,1,debit_card,1,7.88,89.99,sao paulo,sao paulo,2018-07-16,2018-06-11 21:38:34,06/06/2018 14:59:00,2018-06-05 19:15:24,delivered,2018-06-05 11:36:11,araraquara,SP,6.0,,0,-35.0
fazenda rio grande,PR,188,20,16,15,1.0,informatica_acessorios,3,,70.89,1,boleto,1,15.69,69.0,sao paulo,sao paulo,2018-03-20,2018-03-14 16:52:13,02/19/2018 23:53:13,2018-02-17 03:35:43,delivered,2018-02-15 23:27:21,matipo,MG,26.0,,1,-6.0
sao paulo,SP,300,16,30,20,1.0,moveis_decoracao,1,,114.34,6,credit_card,1,15.8,165.5,sao paulo,sao paulo,2017-07-19,2017-07-10 17:36:56,06/29/2017 15:41:19,2017-06-29 00:23:33,delivered,2017-06-29 00:10:49,niteroi,RJ,11.0,,0,-9.0
taboao da serra,SP,13600,26,60,40,2.0,fashion_bolsas_e_acessorios,5,,31.38,2,credit_card,1,52.69,175.91,sao paulo,sao paulo,2018-02-22,2018-02-20 19:27:20,01/29/2018 20:17:05,2018-01-20 09:09:35,delivered,2018-01-19 21:07:32,barbacena,MG,31.0,,0,-2.0
sao paulo,SP,800,25,25,25,3.0,moveis_decoracao,5,otimo,256.5,5,credit_card,1,15.8,165.5,sao paulo,sao paulo,2018-04-17,2018-04-09 19:26:42,04/02/2018 16:46:48,2018-03-29 12:48:47,delivered,2018-03-29 12:00:11,porto alegre,RS,11.0,,0,-8.0
rio de janeiro,RJ,300,18,8,14,,,4,,341.4,1,boleto,1,15.8,165.5,sao paulo,sao paulo,2018-08-03,,07/04/2018 15:20:00,2018-06-28 13:11:09,shipped,2018-06-28 12:52:15,santo antonio da patrulha,RS,,,0,
curitiba,PR,1400,65,12,12,2.0,moveis_decoracao,4,,143.99,1,credit_card,1,13.81,98.81,sao paulo,sao paulo,2018-04-06,2018-03-29 19:22:10,03/20/2018 23:42:44,2018-03-16 20:31:55,delivered,2018-03-15 20:23:45,sao paulo,SP,13.0,,1,-8.0
sao paulo,SP,650,13,11,12,1.0,relogios_presentes,5,,84.88,1,voucher,1,7.8,78.0,sao paulo,sao paulo,2018-04-09,2018-03-29 18:28:40,03/29/2018 01:04:03,2018-03-27 22:30:13,delivered,2018-03-27 22:14:59,porto alegre,RS,1.0,,0,-11.0
sao jose dos campos,SP,600,26,17,17,1.0,construcao_ferramentas_construcao,3,,232.27,8,credit_card,1,12.48,21.8,são paulo,são paulo,2018-08-23,2018-08-14 00:28:41,08/06/2018 13:43:00,2018-08-04 05:05:18,delivered,2018-08-03 13:32:54,barra mansa,RJ,10.0,,0,-9.0
guarulhos,SP,3000,69,11,11,2.0,moveis_decoracao,1,,194.0,5,credit_card,1,18.93,118.9,sao paulo,sao paulo,2017-03-02,2017-01-27 18:12:13,01/24/2017 07:47:47,2017-01-21 17:22:49,delivered,2017-01-21 17:08:01,fortaleza,CE,6.0,,0,-34.0
sao paulo,SP,950,46,10,33,1.0,malas_acessorios,1,,260.57,1,credit_card,1,20.18,119.8,sao paulo,sao paulo,2017-10-23,2017-10-03 18:35:37,09/28/2017 19:33:54,2017-09-26 11:24:44,delivered,2017-09-26 11:08:38,diamantina,MG,7.0,,0,-20.0
toledo,PR,17400,42,35,42,2.0,moveis_decoracao,1,,49.59,1,credit_card,1,7.39,45.0,sao paulo,sao paulo,2018-03-23,,03/05/2018 16:10:13,2018-02-28 10:40:35,shipped,2018-02-28 08:57:03,belo horizonte,MG,,,0,
curitiba,PR,300,16,2,11,2.0,fashion_roupa_masculina,5,,196.55,3,credit_card,1,20.39,449.0,são paulo,são paulo,2017-10-04,2017-09-22 16:48:51,09/14/2017 19:27:47,2017-09-13 15:25:15,delivered,2017-09-13 15:07:45,brasilia,DF,9.0,,0,-12.0
sao jose do rio preto,SP,700,20,20,20,2.0,informatica_acessorios,5,,245.94,1,boleto,1,16.61,139.85,sao paulo,sao paulo,2018-09-05,2018-08-25 00:46:26,08/15/2018 06:23:00,2018-08-09 20:50:14,delivered,2018-08-09 20:36:13,maringa,PR,15.0,,0,-11.0
sao paulo,SP,625,21,16,17,2.0,pet_shop,4,,72.42,1,voucher,2,16.61,139.85,sao paulo,sao paulo,2018-01-02,2017-12-11 18:52:39,12/07/2017 20:21:06,2017-12-07 10:31:35,delivered,2017-12-07 09:40:04,salvador,BA,4.0,,0,-22.0
bauru,SP,3250,32,14,22,3.0,ferramentas_jardim,5,,217.15,2,credit_card,1,12.48,18.9,sao paulo,sao paulo,2018-07-18,2018-06-22 22:41:09,05/30/2018 13:39:00,2018-05-30 03:24:11,delivered,2018-05-30 02:41:28,sao paulo,SP,23.0,,0,-26.0
santos,SP,1500,22,12,33,2.0,fashion_calcados,4,,152.28,4,credit_card,1,16.79,29.9,sao paulo,sao paulo,2017-07-10,2017-06-29 16:45:36,06/27/2017 14:56:54,2017-06-27 11:04:48,delivered,2017-06-27 10:45:08,macae,RJ,2.0,,0,-11.0
marechal candido rondon,SP,250,32,3,23,1.0,cama_mesa_banho,3,,72.34,3,credit_card,1,15.1,39.9,sao paulo,sao paulo,2018-01-03,2018-01-09 18:04:58,12/12/2017 17:43:21,2017-12-12 03:50:30,delivered,2017-12-08 04:45:26,sao paulo,SP,32.0,,3,6.0
curitiba,PR,425,31,6,12,1.0,ferramentas_jardim,4,,128.95,5,credit_card,1,13.07,59.0,sao paulo,sao paulo,2018-04-03,2018-03-26 21:07:18,03/12/2018 18:42:16,2018-03-09 17:00:39,delivered,2018-03-09 15:09:28,mairinque,SP,17.0,,0,-8.0
mogi das cruzes,SP,150,20,8,13,1.0,climatizacao,5,,56.85,1,credit_card,1,67.69,199.0,sao paulo,sao paulo,2017-10-04,2017-09-19 21:47:09,09/14/2017 20:57:27,2017-09-11 12:05:28,delivered,2017-09-11 11:50:32,belo horizonte,MG,8.0,,0,-15.0
porto alegre,RS,350,68,8,13,3.0,moveis_decoracao,5,10,20.29,1,credit_card,1,7.39,32.0,sao paulo,sao paulo,2018-07-12,2018-06-19 17:57:35,06/12/2018 15:31:00,2018-06-12 10:21:08,delivered,2018-06-12 09:52:46,capitao leonidas marques,PR,7.0,,0,-23.0
sao jose dos campos,SP,300,29,7,16,12.0,fashion_calcados,5,,171.75,1,boleto,1,18.35,110.0,sao paulo,sao paulo,2018-08-08,2018-07-11 22:52:20,07/03/2018 13:58:00,2018-07-03 01:30:35,delivered,2018-07-03 01:17:32,rio de janeiro,RJ,8.0,,0,-28.0
osasco,SP,100,19,3,11,12.0,telefonia,5,,85.82,1,credit_card,1,14.65,79.9,sao paulo,sao paulo,2017-06-23,2017-06-12 16:48:13,06/01/2017 16:27:24,2017-05-24 15:35:20,delivered,2017-05-23 15:28:58,sao sebastiao do paraiso,MG,20.0,,1,-11.0
jundiai,SP,550,16,21,18,3.0,automotivo,3,,56.05,1,boleto,1,14.1,24.99,sao paulo,sao paulo,2017-12-22,2017-12-11 21:44:51,11/30/2017 22:32:54,2017-11-29 19:31:02,delivered,2017-11-29 18:27:30,rio de janeiro,RJ,12.0,,0,-11.0
mandirituba,PR,250,16,27,15,1.0,automotivo,1,,26.09,1,boleto,1,13.91,79.0,sao paulo,sao paulo,2018-01-30,2018-01-20 14:28:43,01/16/2018 20:15:54,2018-01-14 18:59:30,delivered,2018-01-14 18:49:14,petropolis,RJ,5.0,,0,-10.0
sao paulo,SP,1000,26,40,20,1.0,automotivo,5,,41.17,1,credit_card,1,17.67,59.9,são paulo,são paulo,2017-09-13,2017-08-29 21:36:55,08/24/2017 16:25:25,2017-08-23 17:33:57,delivered,2017-08-23 15:40:22,sao paulo,SP,6.0,,0,-15.0
suzano,SP,14850,35,102,35,3.0,utilidades_domesticas,1,,37.25,1,boleto,1,15.1,19.9,sao paulo,sao paulo,2017-09-28,2017-09-18 18:48:54,09/13/2017 18:26:58,2017-09-12 04:50:37,delivered,2017-09-10 22:32:14,sao paulo,SP,7.0,,1,-10.0
vespasiano,MG,850,42,25,15,3.0,bebes,4,,135.13,5,credit_card,1,15.2,158.0,são paulo,são paulo,2018-08-27,2018-08-23 21:03:46,08/22/2018 15:18:00,2018-08-21 17:08:38,delivered,2018-08-21 16:45:44,sao paulo,SP,2.0,,0,-4.0
curitiba,PR,1850,28,14,19,4.0,consoles_games,5,,477.45,5,credit_card,1,25.13,1050.61,são paulo,são paulo,2018-07-03,2018-06-12 20:48:48,06/06/2018 16:10:00,2018-05-27 18:14:14,delivered,2018-05-27 17:59:00,piracicaba,SP,16.0,,0,-21.0
rio de janeiro,RJ,300,16,2,11,1.0,fashion_bolsas_e_acessorios,5,,440.12,2,credit_card,1,18.0,106.9,sao paulo,sao paulo,2017-06-09,2017-06-16 16:52:02,06/05/2017 13:58:19,2017-05-23 03:50:25,delivered,2017-05-20 02:48:00,belford roxo,RJ,27.0,,3,7.0
blumenau,SC,200,19,4,11,1.0,telefonia,4,recomendo,67.7,1,credit_card,1,25.12,362.45,sao paulo,sao paulo,2016-12-09,,,2016-10-06 15:51:05,processing,2016-10-05 22:44:13,brasilia,DF,,,0,
sao paulo,SP,150,22,3,15,1.0,beleza_saude,4,,168.51,1,boleto,1,11.74,44.55,sao paulo,sao paulo,2017-08-17,2017-08-07 20:41:57,07/28/2017 19:58:39,2017-07-28 11:35:14,delivered,2017-07-28 11:25:16,goiania,GO,10.0,,0,-10.0
santa rosa,RS,900,16,16,16,1.0,esporte_lazer,4,,31.86,1,boleto,1,15.1,14.99,sao paulo,sao paulo,2018-01-05,2018-01-04 16:57:16,12/08/2017 21:41:59,2017-12-06 02:50:38,delivered,2017-12-05 10:34:52,rosario do sul,RS,30.0,,0,-1.0
sao jose do rio preto,SP,1900,44,19,19,1.0,ferramentas_jardim,5,Muito bom ,40.87,1,boleto,1,15.1,14.99,sao paulo,sao paulo,2018-03-20,2018-03-10 00:05:13,03/08/2018 23:25:25,2018-03-07 15:55:42,delivered,2018-03-07 15:37:22,itaguai,RJ,2.0,,0,-10.0
sao joaquim da barra,SP,1450,45,10,15,1.0,cama_mesa_banho,5,,109.59,10,credit_card,1,15.1,14.99,são paulo,são paulo,2018-08-24,2018-08-22 19:29:04,08/21/2018 13:09:00,2018-08-20 17:50:28,delivered,2018-08-20 17:38:55,sao paulo,SP,2.0,,0,-2.0
sao paulo,SP,1100,29,3,21,1.0,livros_tecnicos,5,,206.87,3,credit_card,1,15.1,14.99,sao paulo,sao paulo,2018-03-06,2018-02-22 17:14:00,02/09/2018 22:53:10,2018-02-09 14:15:48,delivered,2018-02-09 13:48:17,guaruja,SP,13.0,,0,-12.0
curitiba,PR,200,16,11,11,5.0,esporte_lazer,1,,134.38,1,credit_card,1,18.13,125.9,sao paulo,sao paulo,2018-08-16,2018-08-10 22:12:19,08/06/2018 08:31:00,2018-08-03 14:35:14,delivered,2018-08-02 14:41:02,paraopeba,MG,8.0,,0,-6.0
santo antonio de posse,SP,12600,20,10,20,1.0,esporte_lazer,4,,56.06,1,credit_card,1,26.84,99.9,sao paulo,sao paulo,2018-02-05,2018-01-27 14:27:59,01/03/2018 17:34:42,2018-01-02 19:32:22,delivered,2018-01-02 19:20:35,santo andre,SP,24.0,,0,-9.0
sao paulo,SP,1450,25,25,16,1.0,beleza_saude,1,Lamenetável...,264.08,3,credit_card,1,40.37,149.0,sao paulo,sao paulo,2018-05-18,2018-05-03 13:03:03,04/25/2018 13:34:00,2018-04-19 08:15:16,delivered,2018-04-18 15:40:36,campinas,SP,14.0,,0,-15.0
uruguaiana,RS,800,42,25,15,3.0,cool_stuff,5,,240.77,10,credit_card,1,14.1,19.9,sao paulo,sao paulo,2018-04-13,,03/20/2018 21:08:28,2018-03-17 15:48:40,shipped,2018-03-17 15:32:31,sao paulo,SP,,,0,
curitiba,PR,1300,22,14,14,1.0,perfumaria,5,,91.72,2,credit_card,1,9.17,59.9,sao paulo,sao paulo,2018-02-14,2018-01-23 17:41:57,01/05/2018 21:33:18,2018-01-05 11:15:29,delivered,2018-01-05 11:04:11,rio de janeiro,RJ,18.0,,0,-22.0
cotia,SP,150,22,3,15,1.0,beleza_saude,5,,49.01,4,credit_card,1,14.68,320.0,sao paulo,sao paulo,2018-06-04,2018-05-21 20:32:38,05/15/2018 16:22:00,2018-05-15 04:35:02,delivered,2018-05-14 11:04:55,belo horizonte,MG,7.0,,0,-14.0
limeira,SP,200,20,20,20,1.0,eletronicos,2,Qualidade ruim!,107.87,1,boleto,1,14.59,59.9,sao paulo,sao paulo,2017-12-20,2017-12-08 17:02:43,12/01/2017 16:52:08,2017-11-26 13:14:18,delivered,2017-11-26 12:50:56,guarapuava,PR,12.0,,0,-12.0
campanha,MG,11450,23,43,35,3.0,ferramentas_jardim,3,,62.01,3,credit_card,1,15.11,29.99,sao paulo,sao paulo,2018-07-26,2018-07-07 17:37:38,07/05/2018 15:51:00,2018-06-26 11:18:28,delivered,2018-06-26 10:58:48,crisolita,MG,11.0,,0,-19.0
ibitinga,SP,2200,20,20,20,2.0,moveis_decoracao,3,,36.69,1,credit_card,1,21.17,69.0,sao paulo,sao paulo,2018-01-03,2017-12-18 22:29:05,12/05/2017 00:23:05,2017-12-01 20:50:55,delivered,2017-12-01 20:39:26,pirai,RJ,17.0,,0,-16.0
sao paulo,SP,13200,66,19,67,2.0,eletrodomesticos_2,5,,35.0,3,credit_card,1,18.69,56.0,sao paulo,sao paulo,2017-06-28,2017-06-09 08:26:30,05/29/2017 09:37:28,2017-05-26 18:45:10,delivered,2017-05-26 18:35:51,maceio,AL,13.0,,0,-19.0
piracanjuba,GO,200,16,2,11,3.0,fashion_bolsas_e_acessorios,5,,256.37,8,credit_card,1,19.0,160.0,sao paulo,sao paulo,2017-09-04,2017-08-18 21:09:45,08/10/2017 16:18:52,2017-08-09 22:03:51,delivered,2017-08-09 21:43:53,linhares,ES,8.0,,0,-17.0
sao paulo,SP,150,19,11,11,1.0,consoles_games,3,Insatisfeito,47.84,1,credit_card,1,22.34,57.95,sao paulo,sao paulo,2018-08-20,2018-08-15 00:27:44,08/13/2018 19:05:00,2018-08-09 23:05:11,delivered,2018-08-09 22:52:27,agudos,SP,5.0,,0,-5.0
caxias do sul,RS,3350,30,30,30,3.0,instrumentos_musicais,5,,125.87,5,credit_card,1,20.18,64.9,são paulo,são paulo,2018-04-12,2018-04-04 19:47:44,04/03/2018 18:25:51,2018-04-02 17:55:24,delivered,2018-04-01 18:27:01,sao paulo,SP,3.0,,0,-8.0
belo horizonte,MG,2200,42,11,36,1.0,cama_mesa_banho,5,,42.39,1,credit_card,1,20.18,64.9,sao paulo,sao paulo,2017-05-25,2017-05-09 09:03:57,04/27/2017 05:53:19,2017-04-21 05:22:15,delivered,2017-04-19 13:45:55,sao paulo,SP,19.0,,1,-16.0
concordia,SC,30000,50,50,30,2.0,moveis_escritorio,5,,117.53,5,credit_card,1,23.52,849.0,sao paulo,sao paulo,2017-09-13,2017-08-25 17:45:17,08/18/2017 19:57:56,2017-08-17 18:05:30,delivered,2017-08-17 17:03:31,rio de janeiro,RJ,8.0,,0,-19.0
sao paulo,SP,500,30,8,35,2.0,bebes,5,mega recomendo,43.28,1,credit_card,1,11.85,20.99,sao paulo,sao paulo,2018-09-21,2018-08-27 22:53:39,08/22/2018 13:47:00,2018-08-16 10:50:16,delivered,2018-08-16 10:39:48,sao joao de meriti,RJ,11.0,,0,-25.0
sao paulo,SP,1800,45,10,34,1.0,cama_mesa_banho,3,,144.54,4,credit_card,1,14.52,19.45,sao paulo,sao paulo,2018-07-26,2018-07-10 22:12:13,07/03/2018 10:48:00,2018-07-02 20:50:21,delivered,2018-07-01 20:54:21,sao paulo,SP,9.0,,0,-16.0
goiania,GO,200,22,14,14,,,5,EXCELENTE PRODUTO,126.48,1,boleto,1,34.22,59.9,sao paulo,sao paulo,2018-03-19,2018-03-28 22:04:44,02/23/2018 23:19:09,2018-02-22 21:28:02,delivered,2018-02-22 20:53:14,rio de janeiro,RJ,34.0,,0,9.0
santa rita do sapucai,MG,1300,70,11,11,1.0,artigos_de_festas,5,,125.29,4,credit_card,1,34.22,59.9,sao paulo,sao paulo,2018-09-12,2018-08-31 01:13:33,08/25/2018 09:02:00,2018-08-24 19:15:11,delivered,2018-08-24 19:01:02,navegantes,SC,6.0,,0,-12.0
curitiba,PR,150,16,9,11,2.0,fashion_bolsas_e_acessorios,3,,229.74,2,credit_card,1,15.33,64.9,sao paulo,sao paulo,2018-08-28,2018-08-20 22:57:43,08/15/2018 13:54:00,2018-08-13 10:10:18,delivered,2018-08-11 20:58:44,pirassununga,SP,9.0,,1,-8.0
osasco,SP,700,19,48,35,1.0,malas_acessorios,5,,124.6,1,credit_card,1,9.26,128.9,sao paulo,sao paulo,2018-03-28,2018-03-07 18:31:53,02/28/2018 19:59:33,2018-02-25 14:28:09,delivered,2018-02-25 14:13:44,sao bernardo do campo,SP,10.0,,0,-21.0
curitiba,PR,2900,40,55,30,5.0,malas_acessorios,1,,143.86,1,boleto,1,13.77,189.9,sao paulo,sao paulo,2018-07-23,2018-07-13 20:56:37,07/12/2018 16:19:00,2018-07-11 17:35:21,delivered,2018-07-11 17:22:56,faxinal dos guedes,SC,2.0,,0,-10.0
curitiba,PR,200,16,9,11,4.0,fashion_bolsas_e_acessorios,5,,56.89,1,voucher,1,97.56,250.0,sao paulo,sao paulo,2018-08-14,2018-08-06 17:36:34,08/02/2018 12:35:00,2018-07-31 17:30:58,delivered,2018-07-31 16:16:19,guarulhos,SP,6.0,,0,-8.0
barretos,SP,300,16,18,16,1.0,beleza_saude,4,,46.78,1,boleto,1,35.98,94.9,sao paulo,sao paulo,2017-11-08,2017-10-25 20:21:43,10/16/2017 22:14:11,2017-10-11 17:46:20,delivered,2017-10-11 17:31:49,brasilia,DF,14.0,,0,-14.0
indaiatuba,SP,200,23,7,15,2.0,papelaria,5,,3.98,1,voucher,8,20.8,27.9,sao paulo,sao paulo,2018-05-29,2018-05-21 15:38:36,05/10/2018 14:28:00,2018-05-09 17:36:11,delivered,2018-05-09 17:11:41,brasilia,DF,11.0,,0,-8.0
nilopolis,RJ,700,49,4,50,1.0,cama_mesa_banho,5,,72.66,3,credit_card,1,20.8,27.9,sao paulo,sao paulo,2017-12-21,2017-12-12 00:35:02,12/01/2017 00:16:56,2017-11-25 16:34:24,delivered,2017-11-25 16:23:49,criciuma,SC,16.0,,0,-9.0
maua,SP,200,17,13,16,4.0,telefonia,3,,50.1,1,boleto,1,29.3,349.9,sao paulo,sao paulo,2018-08-08,2018-07-30 16:56:35,07/25/2018 07:24:00,2018-07-24 13:24:34,delivered,2018-07-24 12:45:26,nova venecia,ES,6.0,,0,-9.0
pompeia,SP,7800,105,10,40,4.0,climatizacao,5,,85.79,1,boleto,1,33.23,110.99,sao paulo,sao paulo,2017-05-19,2017-05-19 15:55:47,05/09/2017 08:22:23,2017-05-08 13:05:31,delivered,2017-05-08 12:22:44,passo fundo,RS,11.0,,0,0.0
barro alto,BA,550,16,4,11,2.0,papelaria,5,,63.7,1,boleto,1,12.84,190.83,sao paulo,sao paulo,2018-04-25,2018-04-09 23:52:06,04/03/2018 14:58:57,2018-03-29 22:55:21,delivered,2018-03-29 22:46:19,sao paulo,SP,11.0,,0,-16.0
mogi guacu,SP,200,16,2,11,4.0,relogios_presentes,5,,1586.47,10,credit_card,1,35.07,99.5,sao paulo,sao paulo,2018-05-24,2018-05-20 18:19:35,04/25/2018 00:52:03,2018-04-24 17:34:43,delivered,2018-04-22 14:26:17,uberlandia,MG,28.0,,2,-4.0
são paulo,SP,1000,30,7,24,2.0,cama_mesa_banho,5,,433.07,3,credit_card,1,14.82,104.0,sao paulo,sao paulo,2018-08-14,2018-07-30 18:05:46,07/25/2018 06:36:00,2018-07-23 11:32:12,delivered,2018-07-22 06:24:50,carapicuiba,SP,8.0,,1,-15.0
sao paulo,SP,1000,26,8,33,1.0,papelaria,2,,642.02,10,credit_card,1,15.3,79.0,sao paulo,sao paulo,2018-08-30,2018-08-21 14:06:44,08/16/2018 09:02:00,2018-08-14 18:23:55,delivered,2018-08-14 17:48:09,rio de janeiro,RJ,6.0,,0,-9.0
praia grande,SP,1450,60,5,30,4.0,construcao_ferramentas_iluminacao,4,,263.95,4,credit_card,1,24.56,61.99,são paulo,são paulo,2018-01-17,2018-01-12 10:46:56,12/21/2017 16:59:06,2017-12-21 02:11:17,delivered,2017-12-19 13:02:13,ibia,MG,23.0,,1,-5.0
franca,SP,5850,45,55,16,1.0,moveis_escritorio,5,,134.99,1,boleto,1,17.69,419.9,sao paulo,sao paulo,2017-11-07,2017-10-28 13:03:21,10/26/2017 20:42:31,2017-10-26 03:09:00,delivered,2017-10-25 13:32:46,aparecida de goiania,GO,2.0,,0,-10.0
rio de janeiro,SP,8300,45,25,45,2.0,bebes,1,,57.89,1,credit_card,1,23.17,299.0,sao paulo,sao paulo,2017-09-01,2017-08-14 15:07:37,08/04/2017 17:29:54,2017-08-01 15:15:19,delivered,2017-07-31 19:05:32,sao paulo,SP,13.0,,0,-18.0
luiz alves,SC,1800,28,12,18,1.0,esporte_lazer,5,,383.99,1,credit_card,1,19.33,175.0,são paulo,são paulo,2018-07-27,2018-07-16 13:11:06,07/11/2018 11:51:00,2018-07-10 08:45:18,delivered,2018-07-06 18:16:06,santos,SP,9.0,,3,-11.0
sao paulo,SP,900,26,6,13,5.0,esporte_lazer,5,,159.31,1,boleto,1,14.1,49.9,sao paulo,sao paulo,2017-11-14,2017-11-01 19:18:41,10/26/2017 19:23:36,2017-10-26 02:56:19,delivered,2017-10-24 14:23:58,manhuacu,MG,8.0,,1,-13.0
osasco,SP,415,19,19,19,1.0,esporte_lazer,5,,756.91,1,credit_card,1,11.85,44.9,sao paulo,sao paulo,2018-07-05,2018-06-22 15:48:47,06/15/2018 13:13:00,2018-06-13 02:36:32,delivered,2018-06-12 20:54:25,sumare,SP,9.0,,0,-13.0
brusque,SC,103,21,6,14,1.0,telefonia,5,,156.22,7,credit_card,1,11.85,44.9,sao paulo,sao paulo,2017-11-29,2017-11-16 16:52:00,11/10/2017 21:58:38,2017-11-09 21:31:38,delivered,2017-11-09 21:08:01,altamira,PA,6.0,,0,-13.0
criciuma,SC,500,20,8,14,2.0,automotivo,5,,132.95,10,credit_card,1,15.37,38.95,sao paulo,sao paulo,2017-04-03,2017-03-02 09:23:07,02/23/2017 09:10:22,2017-02-23 08:15:17,delivered,2017-02-23 08:03:00,goiania,GO,7.0,,0,-32.0
sao paulo,SP,600,16,6,11,1.0,papelaria,4,,48.27,1,boleto,1,16.0,159.77,sao paulo,sao paulo,2017-07-11,2017-06-26 15:58:13,06/19/2017 12:49:33,2017-06-17 13:25:13,delivered,2017-06-17 13:16:44,rio de janeiro,RJ,9.0,,0,-15.0
santana de parnaiba,SP,4750,18,22,30,5.0,informatica_acessorios,5,,107.35,5,credit_card,1,19.03,132.9,sao paulo,sao paulo,2017-06-29,2017-06-12 13:28:32,06/05/2017 15:52:05,2017-05-29 13:05:34,delivered,2017-05-29 12:35:44,sao jose,SC,14.0,,0,-17.0
osasco,SP,263,18,15,16,1.0,relogios_presentes,5,,110.2,10,credit_card,1,21.85,36.85,sao paulo,sao paulo,2018-07-05,2018-06-04 17:16:36,05/29/2018 10:09:00,2018-05-25 08:14:40,delivered,2018-05-24 12:16:48,sao paulo,SP,11.0,,0,-31.0
joinville,SC,50,16,2,11,1.0,bebes,4,,368.92,8,credit_card,1,21.88,124.99,sao paulo,sao paulo,2018-06-28,2018-06-05 20:32:10,06/04/2018 14:56:00,2018-06-03 21:30:06,delivered,2018-06-03 21:08:31,aperibe,RJ,1.0,,0,-23.0
sao paulo,SP,200,16,22,11,1.0,perfumaria,5,,106.85,1,boleto,1,13.33,94.99,sao paulo,sao paulo,2018-06-28,,06/12/2018 14:09:00,2018-06-12 04:35:37,shipped,2018-06-08 20:06:48,sao vicente,SP,,,3,
guarulhos,SP,360,36,6,26,1.0,cama_mesa_banho,5,,281.5,8,credit_card,1,16.11,32.99,sao paulo,sao paulo,2018-06-14,2018-05-23 20:31:55,05/16/2018 13:25:00,2018-05-16 03:15:21,delivered,2018-05-14 17:56:57,aracatuba,SP,9.0,,1,-22.0
belo horizonte,MG,150,16,7,12,1.0,cool_stuff,5,,54.25,2,credit_card,1,17.07,89.9,são paulo,são paulo,2018-02-22,2018-02-17 09:32:39,01/30/2018 21:18:31,2018-01-29 13:57:11,delivered,2018-01-29 13:38:02,cuiaba,MT,18.0,,0,-5.0
limeira,SP,1100,32,5,30,4.0,esporte_lazer,5,,121.78,5,credit_card,1,14.96,173.0,sao paulo,sao paulo,2017-12-15,2017-12-03 15:36:44,11/30/2017 23:38:27,2017-11-24 01:49:32,delivered,2017-11-24 01:34:00,canoas,RS,9.0,,0,-12.0
catanduva,SP,2250,22,15,20,6.0,fashion_bolsas_e_acessorios,5,,102.26,2,credit_card,1,16.11,44.9,sao paulo,sao paulo,2016-12-07,2016-10-16 14:36:00,10/10/2016 02:46:24,2016-10-06 02:46:24,delivered,2016-10-05 07:31:49,contagem,MG,11.0,,0,-52.0
blumenau,SC,1475,68,9,35,5.0,automotivo,5,,90.62,1,boleto,1,13.26,85.0,sao paulo,sao paulo,2018-03-28,2018-03-18 16:21:49,03/09/2018 17:01:11,2018-03-08 17:40:32,delivered,2018-03-07 16:27:30,belo horizonte,MG,10.0,,1,-10.0
belo horizonte,MG,1600,100,7,11,1.0,esporte_lazer,1,,75.69,1,boleto,1,13.37,49.9,sao paulo,sao paulo,2017-04-25,2017-04-06 10:35:15,03/24/2017 15:42:43,2017-03-22 17:25:28,delivered,2017-03-22 17:25:28,sao paulo,SP,14.0,,0,-19.0
jales,SP,1650,25,30,20,1.0,beleza_saude,1,,42.86,1,debit_card,1,21.18,54.99,sao paulo,sao paulo,2017-11-17,2017-11-14 18:05:15,11/10/2017 14:06:42,2017-11-07 03:31:21,delivered,2017-11-06 18:20:00,belo horizonte,MG,7.0,,0,-3.0
rio de janeiro,RJ,650,35,10,15,3.0,brinquedos,1,,35.7,1,credit_card,1,22.97,66.99,sao paulo,sao paulo,2017-06-16,2017-06-08 07:53:42,05/30/2017 12:43:50,2017-05-20 11:35:41,delivered,2017-05-19 18:13:54,cubatao,SP,19.0,,0,-8.0
londrina,PR,900,21,34,34,1.0,utilidades_domesticas,3,,444.25,10,credit_card,1,14.8,69.99,sao paulo,sao paulo,2018-01-05,2017-12-23 16:21:44,12/19/2017 21:04:31,2017-12-16 13:58:23,delivered,2017-12-16 13:51:18,maringa,PR,7.0,,0,-13.0
atibaia,SP,75,19,3,11,4.0,telefonia,5,,69.16,1,credit_card,1,19.98,268.9,sao paulo,sao paulo,2018-06-04,2018-04-23 14:44:35,04/19/2018 00:51:53,2018-04-18 13:31:41,delivered,2018-04-18 13:13:47,sao paulo,SP,5.0,,0,-42.0
rio branco,AC,600,19,7,14,4.0,ferramentas_jardim,5,,30.0,1,voucher,2,16.35,84.99,sao paulo,sao paulo,2018-04-24,2018-04-24 16:10:44,04/04/2018 17:44:32,2018-03-31 10:07:45,delivered,2018-03-29 20:53:48,campo limpo paulista,SP,25.0,,1,0.0
londrina,PR,400,35,6,15,3.0,moveis_decoracao,5,,65.71,2,credit_card,1,9.34,34.99,são paulo,são paulo,2018-07-24,2018-07-09 18:21:32,06/25/2018 13:48:00,2018-06-23 19:39:10,delivered,2018-06-23 19:24:21,cambe,PR,15.0,,0,-15.0
barra mansa,RJ,553,18,9,15,2.0,utilidades_domesticas,5,,29.29,1,credit_card,1,9.34,34.99,sao paulo,sao paulo,2018-08-22,2018-08-14 18:11:36,08/13/2018 15:33:00,2018-08-06 09:44:23,delivered,2018-08-06 09:12:33,itaquaquecetuba,SP,8.0,,0,-8.0
sao paulo,SP,900,18,25,16,1.0,livros_interesse_geral,5,,37.74,1,credit_card,1,9.34,34.99,sao paulo,sao paulo,2017-07-05,2017-06-12 17:38:13,06/07/2017 12:37:32,2017-06-02 14:42:50,delivered,2017-06-02 14:00:19,sao caetano do sul,SP,10.0,,0,-23.0
sao paulo,SP,250,25,25,25,2.0,utilidades_domesticas,5,,30.0,1,voucher,2,9.34,34.99,sao paulo,sao paulo,2017-11-29,2017-11-20 18:36:52,11/08/2017 17:55:40,2017-11-06 23:31:52,delivered,2017-11-06 16:24:03,sao jose dos campos,SP,14.0,,0,-9.0
sao paulo,SP,14900,58,28,58,1.0,moveis_escritorio,5,,145.9,2,credit_card,1,23.35,77.9,sao paulo,sao paulo,2018-07-26,2018-07-06 16:37:36,06/28/2018 14:57:00,2018-06-28 02:15:51,delivered,2018-06-27 11:10:11,sao paulo,SP,9.0,,0,-20.0
franca,SP,1100,16,10,16,1.0,cama_mesa_banho,4,Recomendo,79.88,1,credit_card,1,9.27,38.4,são paulo,são paulo,2017-05-18,2017-05-08 11:10:26,04/17/2017 14:52:32,2017-04-14 22:15:13,delivered,2017-04-14 22:06:32,sao paulo,SP,23.0,,0,-10.0
maringa,PR,2050,30,22,18,2.0,moveis_decoracao,4,,108.0,5,credit_card,1,17.22,69.0,sao paulo,sao paulo,2018-04-27,2018-04-09 21:53:23,03/26/2018 22:58:37,2018-03-26 11:15:38,delivered,2018-03-26 11:02:31,montes claros,MG,14.0,,0,-18.0
ribeirao pires,SP,850,69,11,11,1.0,moveis_decoracao,5,,348.74,6,credit_card,1,21.43,134.9,sao paulo,sao paulo,2018-01-04,2017-12-19 01:15:07,12/11/2017 19:48:52,2017-12-04 19:04:48,delivered,2017-12-04 18:26:12,salvador,BA,14.0,,0,-16.0
sao paulo,SP,350,16,10,16,1.0,cama_mesa_banho,3,nao entrega do produto,88.78,6,credit_card,1,15.11,39.5,sao paulo,sao paulo,2018-07-11,2018-06-22 17:46:42,06/14/2018 13:47:00,2018-06-13 23:18:38,delivered,2018-06-13 22:54:20,belo horizonte,MG,8.0,,0,-19.0
sao paulo,SP,1400,20,20,30,3.0,ferramentas_jardim,5,,953.71,4,credit_card,1,23.65,71.0,sao paulo,sao paulo,2018-02-20,2018-02-03 15:05:56,02/03/2018 01:18:26,2018-02-02 16:00:16,delivered,2018-02-02 15:26:38,niteroi,RJ,0.0,,0,-17.0
sao paulo,SP,200,20,20,20,4.0,informatica_acessorios,4,,125.77,6,credit_card,1,60.81,225.0,sao paulo,sao paulo,2017-09-01,2017-08-21 21:00:03,08/14/2017 20:53:50,2017-08-12 02:45:50,delivered,2017-08-10 19:47:29,rio de janeiro,RJ,11.0,,1,-11.0
sao carlos,SP,617,17,14,17,2.0,informatica_acessorios,4,,64.05,3,credit_card,1,32.07,189.0,sao paulo,sao paulo,2018-08-14,,,2018-08-07 04:10:26,canceled,2018-08-04 14:29:27,guarulhos,SP,,,2,
sao paulo,SP,2600,16,41,41,1.0,utilidades_domesticas,1,,127.69,1,boleto,1,32.79,199.0,sao paulo,sao paulo,2017-09-25,2017-09-17 15:31:51,09/11/2017 22:07:42,2017-09-07 02:44:03,delivered,2017-09-05 18:24:22,sao paulo,SP,11.0,,1,-8.0
sao jose do rio preto,SP,200,20,9,14,1.0,bebidas,5,,62.42,1,credit_card,1,19.44,35.0,sao paulo,sao paulo,2018-01-05,2017-12-14 19:42:26,12/11/2017 18:15:09,2017-12-07 20:51:19,delivered,2017-12-07 20:38:37,sao goncalo do rio abaixo,MG,6.0,,0,-22.0
curitiba,PR,2000,49,16,39,1.0,cama_mesa_banho,5,,55.69,5,credit_card,1,19.44,35.0,sao paulo,sao paulo,2017-12-07,2017-11-24 20:32:37,11/22/2017 14:47:28,2017-11-22 02:58:38,delivered,2017-11-19 16:12:34,rolandia,PR,5.0,,2,-13.0
marilia,SP,266,20,8,18,2.0,beleza_saude,5,,146.13,7,credit_card,1,19.44,35.0,sao paulo,sao paulo,2018-01-12,2017-12-26 23:15:01,12/19/2017 14:14:30,2017-12-09 01:30:50,delivered,2017-12-08 23:41:49,tres coracoes,MG,17.0,,0,-17.0
sao paulo,SP,200,19,4,11,1.0,telefonia,5,,349.99,5,credit_card,1,14.52,49.9,sao paulo,sao paulo,2017-05-18,2017-05-23 13:12:27,05/11/2017 16:25:53,2017-05-10 14:15:14,delivered,2017-05-10 14:03:27,cacapava do sul,RS,12.0,,0,5.0
ribeirao pires,SP,300,68,7,13,1.0,bebes,5,,91.28,1,credit_card,1,35.67,45.0,sao paulo,sao paulo,2017-12-22,2017-12-10 17:53:31,12/01/2017 21:09:12,2017-11-30 13:56:28,delivered,2017-11-30 13:34:43,sao paulo,SP,10.0,,0,-12.0
ribeirao preto,SP,300,16,16,16,1.0,pet_shop,4,recomendo,108.64,1,boleto,1,18.38,39.97,sao paulo,sao paulo,2018-03-29,2018-03-29 17:32:05,03/27/2018 14:04:29,2018-03-19 22:08:28,delivered,2018-03-19 21:50:14,sao paulo,SP,9.0,,0,0.0
bahia,BA,200,16,2,20,1.0,relogios_presentes,5,,158.98,2,credit_card,1,18.38,39.97,sao paulo,sao paulo,2018-03-23,2018-03-22 23:44:33,03/06/2018 17:14:59,2018-03-04 16:10:35,delivered,2018-03-04 15:58:09,sao paulo,SP,18.0,,0,-1.0
porto alegre,RS,1300,20,16,20,1.0,eletroportateis,5,,20.75,1,credit_card,1,18.38,39.97,sao paulo,sao paulo,2018-07-23,2018-07-11 14:18:51,07/09/2018 13:22:00,2018-07-02 14:10:56,delivered,2018-07-02 13:58:59,ribeirao preto,SP,9.0,,0,-12.0
londrina,PR,482,18,11,16,4.0,esporte_lazer,3,,72.9,1,boleto,1,14.77,149.0,sao paulo,sao paulo,2017-05-04,2017-05-08 10:52:06,04/08/2017 01:37:04,2017-04-06 13:55:17,delivered,2017-04-06 13:44:08,sao goncalo,RJ,31.0,,0,4.0
cascavel,PR,550,16,10,16,1.0,cama_mesa_banho,1,,543.83,3,credit_card,1,9.34,51.6,sao paulo,sao paulo,2018-08-30,2018-08-22 17:09:01,08/14/2018 15:54:00,2018-08-12 12:24:22,delivered,2018-08-12 12:04:03,sao joao nepomuceno,MG,10.0,,0,-8.0
taubate,SP,270,16,16,15,1.0,beleza_saude,5,,67.12,2,credit_card,1,19.72,146.9,sao paulo,sao paulo,2017-08-04,2017-07-26 20:32:17,07/20/2017 17:42:22,2017-07-16 10:15:15,delivered,2017-07-16 10:04:36,cotia,SP,10.0,,0,-9.0
cascavael,PR,300,17,4,12,6.0,telefonia,5,,139.07,6,credit_card,1,9.71,79.9,sao paulo,sao paulo,2018-08-16,2018-08-07 14:17:49,07/31/2018 14:51:00,2018-07-30 18:31:17,delivered,2018-07-28 20:07:49,niteroi,RJ,9.0,,1,-9.0
sao paulo,SP,2150,40,25,30,3.0,market_place,4,,126.68,1,boleto,1,18.26,22.5,sao paulo,sao paulo,2017-11-06,2017-10-27 20:48:58,10/19/2017 22:14:05,2017-10-18 16:56:50,delivered,2017-10-18 16:44:45,canoas,RS,9.0,,0,-10.0
monteiro lobato,SP,3300,35,20,20,1.0,automotivo,5,,41.42,1,credit_card,1,16.79,11.9,sao paulo,sao paulo,2017-09-18,2017-09-06 20:56:55,09/01/2017 19:58:00,2017-08-28 22:55:20,delivered,2017-08-28 22:47:13,rio de janeiro,RJ,8.0,,0,-12.0
curitiba,PR,200,16,16,16,1.0,perfumaria,4,,203.16,1,boleto,1,16.79,11.9,sao paulo,sao paulo,2018-01-17,2018-01-10 14:26:57,12/26/2017 21:09:19,2017-12-21 20:30:28,delivered,2017-12-21 20:11:07,goiania,GO,19.0,,0,-7.0
viana,ES,200,21,9,13,1.0,esporte_lazer,5,Captador Presys Blend,540.02,8,credit_card,1,10.96,19.99,sao paulo,sao paulo,2017-12-14,2017-12-04 20:33:19,12/01/2017 19:32:51,2017-11-29 13:37:08,delivered,2017-11-27 13:33:35,leme,SP,7.0,,2,-10.0
guarulhos,SP,514,18,12,15,1.0,perfumaria,5,,368.6,1,boleto,1,16.11,7.9,sao paulo,sao paulo,2018-08-06,2018-07-28 00:05:39,07/24/2018 14:03:00,2018-07-27 23:31:09,delivered,2018-07-22 13:04:47,araras,SP,5.0,,5,-9.0
sao jose,SC,3100,38,28,28,2.0,casa_construcao,3,,107.78,4,credit_card,1,18.4,85.71,sao paulo,sao paulo,2018-06-12,2018-05-14 19:05:08,05/10/2018 18:29:00,2018-05-08 20:32:08,delivered,2018-05-08 19:48:01,jundiai,SP,5.0,,0,-29.0
paraiba do sul,RJ,1200,27,18,23,1.0,utilidades_domesticas,1,,387.27,10,credit_card,1,20.84,29.5,sao paulo,sao paulo,2017-12-18,2017-12-08 17:29:17,11/20/2017 14:59:10,2017-11-18 11:47:19,delivered,2017-11-18 11:30:58,cortes,PE,20.0,,0,-10.0
mococa,SP,250,16,10,16,2.0,esporte_lazer,5,,107.23,10,credit_card,1,17.6,18.25,sao paulo,sao paulo,2017-05-31,2017-05-16 09:42:08,05/11/2017 10:09:25,2017-05-11 09:25:21,delivered,2017-05-11 09:13:17,ipatinga,MG,5.0,,0,-15.0
sao roque,SP,7400,45,29,53,2.0,brinquedos,1,,101.25,2,credit_card,1,8.02,142.0,sao paulo,sao paulo,2018-01-26,2018-01-10 18:10:04,01/03/2018 20:10:20,2017-12-27 19:29:30,delivered,2017-12-27 19:19:44,sao paulo,SP,13.0,,0,-16.0
passos,MG,7600,55,15,55,1.0,la_cuisine,5,,26.09,1,credit_card,1,26.1,179.99,sao paulo,sao paulo,2018-01-23,2018-01-11 13:51:51,01/10/2018 18:19:02,2018-01-09 11:29:43,delivered,2018-01-09 11:19:49,ribeirao preto,SP,2.0,,0,-12.0
ibitinga,SP,875,40,26,20,1.0,esporte_lazer,5,,244.35,1,boleto,1,26.1,179.99,sao paulo,sao paulo,2018-07-25,2018-06-28 18:22:32,06/25/2018 11:40:00,2018-06-23 18:35:22,delivered,2018-06-23 18:07:30,brusque,SC,5.0,,0,-27.0
francisco beltrao,PR,700,35,7,27,3.0,moveis_decoracao,3,,117.85,10,credit_card,1,15.25,154.9,sao paulo,sao paulo,2018-07-30,2018-07-11 15:08:35,07/06/2018 10:18:00,2018-07-05 16:40:52,delivered,2018-07-03 19:34:23,fortaleza,CE,7.0,,1,-19.0
sao paulo,SP,900,17,10,15,2.0,moveis_escritorio,1,,171.32,3,credit_card,1,10.29,299.0,sao paulo,sao paulo,2017-07-10,2017-06-22 17:44:53,06/09/2017 08:35:18,2017-06-08 21:30:18,delivered,2017-06-08 21:18:45,montenegro,RS,13.0,,0,-18.0
tocantins,SP,700,49,12,27,6.0,esporte_lazer,5,,202.44,10,credit_card,1,18.14,126.99,sao paulo,sao paulo,2017-11-03,2017-10-25 17:07:07,10/18/2017 21:12:08,2017-10-17 18:35:10,delivered,2017-10-17 18:22:05,itaberai,GO,7.0,,0,-9.0
uruacu,GO,1100,16,10,16,2.0,cama_mesa_banho,4,,73.03,1,boleto,1,8.72,49.89,são paulo,são paulo,2017-10-02,2017-09-15 22:36:27,09/08/2017 19:52:05,2017-09-08 13:50:16,delivered,2017-09-08 13:37:07,pindamonhangaba,SP,7.0,,0,-17.0
maringa,PR,1150,28,10,25,7.0,cool_stuff,1,Produto pirata!,264.67,4,credit_card,1,11.85,8.0,sao paulo,sao paulo,2017-08-14,2017-07-21 17:15:29,07/17/2017 20:17:43,2017-07-17 09:43:06,delivered,2017-07-17 09:29:02,brasilia,DF,4.0,,0,-24.0
goiania,GO,900,25,10,25,1.0,cool_stuff,4,,68.7,1,credit_card,1,10.9,84.0,sao paulo,sao paulo,2018-05-29,2018-05-11 22:08:57,05/08/2018 14:12:00,2018-05-07 21:14:16,delivered,2018-05-07 20:57:42,santa rosa de viterbo,SP,4.0,,0,-18.0
rio de janeiro,RJ,1400,25,25,25,,,5,,55.13,1,boleto,1,15.85,78.0,sao paulo,sao paulo,2018-08-23,2018-08-10 16:57:43,08/06/2018 08:27:00,2018-08-01 17:24:06,delivered,2018-08-01 16:54:38,agua fria de goias,GO,9.0,,0,-13.0
ribeirao preto,SP,2050,29,5,21,1.0,livros_tecnicos,5,,92.99,2,credit_card,1,35.37,229.99,sao paulo,sao paulo,2018-09-18,2018-08-28 15:58:50,08/22/2018 13:30:00,2018-08-21 10:51:49,delivered,2018-08-21 10:19:27,santos,SP,7.0,,0,-21.0
porto belo,SC,2150,28,32,11,1.0,beleza_saude,5,produto fraco ,36.0,3,credit_card,1,26.71,89.9,são paulo,são paulo,2017-05-29,,05/02/2017 15:29:33,2017-04-25 13:45:16,shipped,2017-04-25 13:35:09,marau,RS,,,0,
campinas,SP,490,30,5,25,4.0,beleza_saude,4,,17.87,1,credit_card,1,28.53,165.0,são paulo,são paulo,2018-05-24,2018-05-16 19:08:52,05/08/2018 15:15:00,2018-05-05 21:35:18,delivered,2018-05-04 21:40:39,curvelo,MG,11.0,,0,-8.0
nova iguacu,RJ,1000,30,13,30,5.0,brinquedos,4,,58.38,1,credit_card,1,20.12,199.0,sao paulo,sao paulo,2018-03-20,2018-03-18 18:26:36,03/13/2018 01:21:57,2018-03-08 16:31:43,delivered,2018-03-08 15:59:11,niteroi,RJ,10.0,,0,-2.0
sao paulo,SP,200,16,4,14,4.0,informatica_acessorios,4,,50.0,1,voucher,2,28.96,79.9,sao paulo,sao paulo,2018-07-13,2018-06-25 15:26:32,06/15/2018 16:40:00,2018-06-11 13:33:26,delivered,2018-06-11 13:00:02,juiz de fora,MG,14.0,,0,-18.0
marilia,SP,500,19,13,20,2.0,utilidades_domesticas,3,,1995.69,10,credit_card,1,9.06,122.99,sao paulo,sao paulo,2017-07-04,2017-06-19 18:06:01,06/16/2017 15:37:52,2017-06-15 03:03:40,delivered,2017-06-13 11:13:38,uberlandia,MG,6.0,,1,-15.0
icara,SC,500,16,10,16,1.0,cama_mesa_banho,5,,130.14,3,credit_card,1,15.15,139.9,sao paulo,sao paulo,2017-09-01,2017-08-17 18:23:07,08/07/2017 22:23:42,2017-08-04 22:04:53,delivered,2017-08-04 21:44:43,mogi-guacu,SP,12.0,,0,-15.0
sao paulo,SP,4300,30,10,48,,,3,,710.23,1,boleto,1,8.72,27.99,sao paulo,sao paulo,2017-11-06,2017-10-30 20:54:05,10/10/2017 20:05:41,2017-10-06 18:35:26,delivered,2017-10-06 18:22:19,niteroi,RJ,24.0,,0,-7.0
lajeado,RS,1000,20,14,13,1.0,perfumaria,3,,68.0,1,credit_card,1,34.15,22.0,sao paulo,sao paulo,2018-06-12,2018-06-01 19:41:03,05/21/2018 12:10:00,2018-05-19 12:31:36,delivered,2018-05-19 12:14:08,sao paulo,SP,13.0,,0,-11.0
sao paulo,SP,4200,78,4,47,5.0,automotivo,5,,59.51,5,credit_card,1,34.15,22.0,sao paulo,sao paulo,2017-08-29,2017-08-16 17:04:55,08/08/2017 22:27:46,2017-08-05 20:05:53,delivered,2017-08-05 19:30:41,sao paulo,SP,10.0,,0,-13.0
sao paulo,SP,350,16,11,11,1.0,perfumaria,4,,371.94,5,credit_card,1,34.15,22.0,sao paulo,sao paulo,2017-11-14,2017-11-13 17:38:40,11/03/2017 18:07:40,2017-10-31 10:10:24,delivered,2017-10-31 09:59:07,sao paulo,SP,13.0,,0,-1.0
santa rita do sapucai,MG,125,19,3,11,2.0,telefonia,5,,667.99,10,credit_card,1,34.15,22.0,sao paulo,sao paulo,2017-10-09,2017-09-19 19:54:09,09/12/2017 19:21:32,2017-09-12 04:30:15,delivered,2017-09-11 09:40:11,sao paulo,SP,8.0,,0,-20.0
campinas,SP,100,19,3,11,2.0,telefonia,5,,63.89,1,credit_card,1,14.12,42.0,sao paulo,sao paulo,2018-04-04,2018-03-18 17:17:03,03/12/2018 23:22:04,2018-03-07 17:20:24,delivered,2018-03-07 16:42:57,belo horizonte,MG,11.0,,0,-17.0
sao paulo,SP,4100,51,31,31,4.0,utilidades_domesticas,5,,49.34,4,credit_card,1,16.79,27.9,sao paulo,sao paulo,2018-02-08,2018-01-23 16:32:29,01/15/2018 23:04:22,2018-01-13 15:51:33,delivered,2018-01-13 15:43:58,osasco,SP,10.0,,0,-16.0
santo andre,SP,200,20,20,20,2.0,eletronicos,1,,147.0,1,boleto,1,20.65,279.9,sao paulo,sao paulo,2018-07-11,2018-06-24 17:41:36,06/19/2018 16:16:00,2018-06-19 00:54:46,delivered,2018-06-19 00:26:23,sao paulo,SP,5.0,,0,-17.0
brusque,SC,300,23,3,11,4.0,consoles_games,5,,354.64,1,credit_card,1,15.23,14.9,sao paulo,sao paulo,2017-12-08,,11/24/2017 19:07:43,2017-11-24 10:51:26,shipped,2017-11-24 09:23:33,guaratingueta,SP,,,0,
horizontina,RS,8400,50,28,31,7.0,utilidades_domesticas,5,,59.71,4,credit_card,1,15.48,104.0,sao paulo,sao paulo,2018-04-11,2018-05-14 12:28:56,03/19/2018 19:56:23,2018-03-16 11:49:14,delivered,2018-03-16 11:31:18,sao bernardo do campo,SP,59.0,,0,33.0
sao paulo,SP,1550,46,10,35,1.0,utilidades_domesticas,4,,408.66,8,credit_card,1,17.67,49.0,são paulo,são paulo,2017-11-01,2017-10-26 19:09:48,10/16/2017 21:07:52,2017-10-14 03:46:18,delivered,2017-10-12 23:11:44,paranagua,PR,13.0,,1,-6.0
sao paulo,SP,600,17,17,18,1.0,utilidades_domesticas,5,,51.66,5,credit_card,1,17.67,49.0,sao paulo,sao paulo,2018-08-27,2018-08-15 20:38:36,08/08/2018 15:01:00,2018-08-06 22:45:09,delivered,2018-08-06 22:25:10,lins,SP,8.0,,0,-12.0
maua,SP,200,16,2,20,1.0,fashion_bolsas_e_acessorios,3,,386.46,2,credit_card,1,14.51,59.9,sao paulo,sao paulo,2018-06-29,2018-06-21 17:48:49,06/19/2018 15:10:00,2018-06-16 18:57:30,delivered,2018-06-16 18:31:23,sao paulo,SP,4.0,,0,-8.0
sao paulo,SP,500,16,21,18,3.0,automotivo,5,,69.54,2,credit_card,1,18.65,110.0,sao paulo,sao paulo,2017-06-27,2017-05-24 12:59:33,05/11/2017 14:57:53,2017-04-29 20:22:41,delivered,2017-04-29 20:09:24,campo bom,RS,24.0,,0,-34.0
sao paulo,SP,1250,22,17,20,1.0,construcao_ferramentas_ferramentas,5,,21.94,1,credit_card,1,18.43,79.0,sao paulo,sao paulo,2018-03-22,2018-03-12 12:53:26,02/20/2018 00:09:19,2018-02-17 10:49:50,delivered,2018-02-17 10:33:27,sertaozinho,SP,23.0,,0,-10.0
santo andre,SP,667,27,19,20,1.0,informatica_acessorios,5,,52.34,1,credit_card,1,14.1,39.9,sao paulo,sao paulo,2018-08-24,2018-08-10 20:34:56,08/06/2018 15:02:00,2018-08-01 18:31:26,delivered,2018-08-01 17:57:54,sao paulo,SP,9.0,,0,-14.0
votorantim,SP,300,40,4,30,1.0,cama_mesa_banho,5,,114.25,1,credit_card,1,13.24,249.0,sao paulo,sao paulo,2018-03-28,2018-04-12 21:04:01,03/06/2018 16:49:08,2018-03-04 23:15:32,delivered,2018-03-04 22:59:50,tres lagoas,MS,38.0,,0,15.0
claudio,MG,400,18,18,12,1.0,perfumaria,5,,162.83,2,credit_card,1,79.94,379.0,sao paulo,sao paulo,2018-03-27,2018-04-12 11:36:51,03/05/2018 23:44:55,2018-02-23 02:31:22,delivered,2018-02-21 13:18:37,taboao da serra,SP,49.0,,1,16.0
campo bom,RS,450,25,25,25,3.0,esporte_lazer,5,,172.92,1,credit_card,1,13.82,33.9,sao paulo,sao paulo,2017-10-31,2017-10-23 19:23:48,10/13/2017 13:59:11,2017-10-10 23:09:18,delivered,2017-10-09 19:42:43,contagem,MG,13.0,,1,-8.0
sao paulo,SP,2800,16,2,11,1.0,automotivo,3,Nota 8,81.72,7,credit_card,1,43.49,208.1,sao paulo,sao paulo,2017-08-28,,,2017-08-01 18:32:30,invoiced,2017-08-01 18:17:41,niteroi,RJ,,,0,
sao paulo,SP,250,20,6,11,1.0,moveis_decoracao,5,,151.79,2,credit_card,1,98.13,593.36,sao paulo,sao paulo,2018-02-21,2018-03-08 11:15:57,01/29/2018 23:16:01,2018-01-26 13:52:07,delivered,2018-01-26 13:32:22,santo andre,SP,40.0,,0,15.0
monte alto,SP,250,35,5,25,1.0,moveis_decoracao,4,,243.62,4,credit_card,1,19.34,52.5,sao paulo,sao paulo,2017-03-09,2017-02-10 18:43:38,01/30/2017 09:57:31,2017-01-28 04:34:44,delivered,2017-01-27 00:34:10,sao paulo,SP,14.0,,1,-27.0
sao paulo,SP,300,24,12,12,3.0,pet_shop,5,,56.42,1,boleto,1,19.34,52.5,sao paulo,sao paulo,2017-10-04,2017-10-03 18:24:04,09/27/2017 19:08:03,2017-09-18 01:15:10,delivered,2017-09-18 01:02:11,jau,SP,15.0,,0,-1.0
ribeirao preto,SP,150,16,2,11,,,3,,45.13,4,credit_card,1,78.63,66.0,sao paulo,sao paulo,2017-05-05,2017-04-11 16:18:08,04/04/2017 14:37:51,2017-04-03 23:22:45,delivered,2017-04-03 23:09:50,curitiba,PR,7.0,,0,-24.0
fernandopolis,SP,1000,35,25,25,2.0,moveis_decoracao,3,,108.64,1,boleto,1,16.81,127.48,sao paulo,sao paulo,2018-07-11,2018-06-20 18:52:50,06/05/2018 10:15:00,2018-06-04 09:11:43,delivered,2018-06-04 08:33:09,montenegro,RS,16.0,,0,-21.0
blumenau,SC,6267,36,40,36,1.0,moveis_decoracao,4,,64.51,4,credit_card,1,63.11,122.99,sao paulo,sao paulo,2017-10-02,2017-09-19 14:42:16,09/15/2017 20:59:50,2017-09-15 02:25:56,delivered,2017-09-14 18:32:52,sao jose,SC,4.0,,0,-13.0
marilia,SP,2653,53,15,36,1.0,esporte_lazer,5,,193.5,8,credit_card,1,15.44,49.0,sao paulo,sao paulo,2017-03-24,2017-03-10 13:06:28,02/20/2017 10:27:58,2017-02-17 17:50:12,delivered,2017-02-17 17:37:52,campos de julio,MT,20.0,,0,-14.0
ponta grossa,PR,3000,69,11,11,2.0,moveis_decoracao,5,,110.63,1,boleto,1,15.44,49.0,são paulo,são paulo,2018-03-02,2018-03-06 16:59:05,02/07/2018 22:38:31,2018-02-05 17:50:41,delivered,2018-02-05 17:40:34,saquarema,RJ,28.0,,0,4.0
guarulhos,SP,8500,18,29,13,1.0,automotivo,5,,200.55,5,credit_card,1,7.87,29.99,sao paulo,sao paulo,2017-03-23,2017-02-14 14:03:35,02/07/2017 08:09:23,2017-01-25 16:02:29,delivered,2017-01-25 15:47:27,sao caetano do sul,SP,19.0,,0,-37.0
belo horizonte,MG,2120,26,25,25,1.0,esporte_lazer,3,,41.71,1,credit_card,1,24.7,59.9,são paulo,são paulo,2017-06-08,2017-05-09 11:17:09,04/28/2017 14:06:45,2017-04-27 14:30:17,delivered,2017-04-27 14:17:37,artur nogueira,SP,11.0,,0,-30.0
pedreira,SP,750,30,30,30,3.0,eletroportateis,4,,54.43,1,credit_card,1,24.7,62.0,sao paulo,sao paulo,2018-07-17,2018-07-02 17:19:07,06/19/2018 14:46:00,2018-06-15 22:20:30,delivered,2018-06-15 21:45:12,uaua,BA,16.0,,0,-15.0
apucarana,PR,200,16,16,12,2.0,beleza_saude,5,,77.64,3,credit_card,1,10.13,102.0,sao paulo,sao paulo,2018-01-08,2017-12-22 17:37:06,12/07/2017 17:21:31,2017-12-07 03:12:20,delivered,2017-12-06 09:53:36,sao paulo,SP,16.0,,0,-17.0
guarulhos,SP,1650,35,20,30,1.0,cama_mesa_banho,4,,280.08,1,boleto,1,15.1,27.9,sao paulo,sao paulo,2017-02-20,2017-01-30 11:21:56,01/16/2017 09:38:03,2017-01-14 15:50:20,delivered,2017-01-14 15:42:20,jandira,SP,15.0,,0,-21.0
brusque,SC,900,26,13,21,1.0,informatica_acessorios,5,,101.34,5,credit_card,1,11.98,196.0,sao paulo,sao paulo,2018-08-20,2018-08-11 15:54:34,08/03/2018 12:01:00,2018-08-01 16:50:14,delivered,2018-08-01 16:37:54,belo horizonte,MG,9.0,,0,-9.0
poa,SP,150,32,5,16,1.0,utilidades_domesticas,5,,77.57,1,credit_card,1,22.63,389.0,são paulo,são paulo,2018-06-04,2018-05-24 00:35:33,05/22/2018 06:21:00,2018-05-20 10:58:35,delivered,2018-05-20 10:33:47,sao paulo,SP,3.0,,0,-11.0
sao paulo,SP,800,31,5,21,1.0,utilidades_domesticas,1,,60.2,4,credit_card,1,16.47,119.99,sao paulo,sao paulo,2018-07-30,2018-07-06 16:50:48,07/03/2018 10:15:00,2018-07-01 21:29:50,delivered,2018-07-01 21:12:33,sao paulo,SP,4.0,,0,-24.0
maringa,PR,700,20,20,20,3.0,cool_stuff,5,,48.1,1,boleto,1,14.1,27.99,são paulo,são paulo,2017-06-14,2017-06-02 18:03:04,05/24/2017 14:29:37,2017-05-23 04:05:23,delivered,2017-05-21 21:10:35,valinhos,SP,11.0,,1,-12.0
curitiba,PR,700,20,20,20,1.0,bebidas,5,,76.02,1,boleto,1,14.7,54.99,sao paulo,sao paulo,2018-04-03,2018-04-02 22:17:31,03/14/2018 23:42:30,2018-03-14 12:00:25,delivered,2018-03-14 11:22:37,concordia,SC,19.0,,0,-1.0
sao jose do rio preto,SP,10400,100,23,27,6.0,bebes,1,,84.56,2,credit_card,1,16.06,88.9,sao paulo,sao paulo,2017-12-01,2017-11-14 01:32:39,11/08/2017 19:35:35,2017-11-02 02:16:10,delivered,2017-10-31 21:47:13,nova friburgo,RJ,13.0,,1,-17.0
divinopolis,MG,5850,40,9,105,1.0,instrumentos_musicais,5,,20.0,1,voucher,2,21.2,899.0,são paulo,são paulo,2017-11-01,2017-10-18 20:27:31,10/05/2017 20:24:51,2017-10-04 18:28:17,delivered,2017-10-04 17:56:28,sorocaba,SP,14.0,,0,-14.0
santa barbara d´oeste,SP,75,17,12,17,1.0,cama_mesa_banho,5,,48.16,4,credit_card,1,17.28,120.0,sao paulo,sao paulo,2018-02-01,2018-01-23 21:45:13,01/18/2018 22:17:37,2018-01-17 10:10:03,delivered,2018-01-17 09:55:37,rio de janeiro,RJ,6.0,,0,-9.0
canoas,RS,1000,27,10,20,2.0,papelaria,5,,265.41,1,debit_card,1,16.72,279.99,sao paulo,sao paulo,2018-07-30,2018-07-26 00:26:49,07/23/2018 08:58:00,2018-07-20 12:03:54,delivered,2018-07-20 11:46:49,ponte nova,MG,5.0,,0,-4.0
itu,SP,1475,32,28,28,4.0,automotivo,5,,127.53,5,credit_card,1,15.16,59.0,são paulo,são paulo,2018-01-09,2017-12-27 17:42:05,12/18/2017 22:29:20,2017-12-14 10:14:22,delivered,2017-12-14 09:06:34,araquari,SC,13.0,,0,-13.0
joinville,SC,750,36,18,36,4.0,fashion_bolsas_e_acessorios,5,Tudo certo!,128.73,2,credit_card,1,53.83,243.37,são paulo,são paulo,2018-07-19,2018-06-25 13:11:20,06/20/2018 14:15:00,2018-06-19 13:57:28,delivered,2018-06-19 13:22:15,sao jose dos campos,SP,5.0,,0,-24.0
mombuca,SP,3600,36,8,15,10.0,papelaria,5,,37.37,3,credit_card,1,16.5,249.48,sao paulo,sao paulo,2018-04-23,2018-04-12 17:12:13,04/04/2018 23:42:34,2018-04-02 13:10:21,delivered,2018-04-02 13:01:06,muriae,MG,10.0,,0,-11.0
sao bernardo do campo,SP,2200,28,28,38,3.0,moveis_decoracao,5,,150.15,5,credit_card,1,19.32,35.0,sao paulo,sao paulo,2018-07-23,2018-07-07 14:41:18,07/05/2018 14:50:00,2018-07-05 16:33:06,delivered,2018-07-04 16:49:21,sao paulo,SP,2.0,,0,-16.0
santana de parnaiba,SP,150,20,13,15,1.0,eletrodomesticos,5,,36.16,2,credit_card,1,19.32,35.0,sao paulo,sao paulo,2017-05-10,2017-05-09 12:49:59,04/18/2017 14:51:38,2017-04-13 17:42:10,delivered,2017-04-13 17:26:06,barueri,SP,25.0,,0,-1.0
curitiba,PR,1750,30,20,30,1.0,casa_construcao,5,,198.0,4,credit_card,1,0.0,99.9,sao paulo,sao paulo,2018-08-06,2018-07-27 18:55:57,07/26/2018 14:46:00,2018-07-29 23:30:52,delivered,2018-07-24 11:32:11,santo andre,SP,3.0,,5,-10.0
londrina,PR,1300,44,8,30,4.0,esporte_lazer,4,,112.4,5,credit_card,1,8.29,14.99,são paulo,são paulo,2017-07-31,2017-07-17 19:02:35,07/06/2017 13:55:38,2017-07-05 17:42:57,delivered,2017-07-05 11:55:58,navegantes,SC,12.0,,0,-14.0
franca,SP,7750,33,25,33,2.0,moveis_sala,4,,35.4,1,credit_card,1,16.53,109.73,sao paulo,sao paulo,2018-05-15,2018-05-09 19:50:37,05/03/2018 12:27:00,2018-05-01 03:15:02,delivered,2018-04-30 20:24:33,nova lima,MG,8.0,,0,-6.0
sete lagoas,MG,3100,32,26,21,1.0,utilidades_domesticas,4,,189.98,6,credit_card,1,14.1,9.0,sao paulo,sao paulo,2017-06-05,2017-05-10 11:34:12,05/04/2017 13:08:12,2017-05-03 14:42:38,delivered,2017-05-03 14:31:43,inhumas,GO,6.0,,0,-26.0
campo do meio,MG,1600,55,37,30,4.0,malas_acessorios,5,,228.6,2,credit_card,1,19.25,239.0,sao paulo,sao paulo,2018-06-19,2018-06-01 14:46:48,05/28/2018 15:02:00,2018-05-25 22:32:39,delivered,2018-05-25 22:10:13,italva,RJ,6.0,,0,-18.0
toledo,PR,350,19,13,13,2.0,relogios_presentes,2,,314.21,8,credit_card,1,16.11,13.99,sao paulo,sao paulo,2017-11-06,2017-10-24 20:17:44,10/17/2017 15:42:42,2017-10-12 13:49:22,delivered,2017-10-12 13:33:22,sao paulo,SP,12.0,,0,-13.0
mogi das cruzes,SP,888,18,17,18,1.0,beleza_saude,5,,22.29,1,credit_card,1,16.79,29.99,sao paulo,sao paulo,2017-04-12,2017-03-27 14:12:27,03/17/2017 15:12:16,2017-03-13 11:36:11,delivered,2017-03-13 11:36:11,tres rios,RJ,14.0,,0,-16.0
jundiai,SP,150,16,4,14,3.0,informatica_acessorios,5,,257.3,8,credit_card,1,27.41,189.99,sao paulo,sao paulo,2017-12-12,2017-12-21 14:22:54,11/22/2017 19:48:47,2017-11-21 09:50:30,delivered,2017-11-20 16:21:04,belford roxo,RJ,30.0,,0,9.0
marilia,SP,1025,25,23,25,1.0,utilidades_domesticas,5,,162.99,6,credit_card,1,15.83,55.0,sao paulo,sao paulo,2018-01-02,2017-12-14 00:37:09,11/28/2017 21:09:47,2017-11-26 15:56:24,delivered,2017-11-26 15:47:51,santa maria,RS,17.0,,0,-19.0
fortaleza,CE,250,20,9,12,2.0,utilidades_domesticas,5,,51.03,1,boleto,1,15.29,58.99,sao paulo,sao paulo,2018-07-12,2018-06-12 16:32:33,06/05/2018 05:40:00,2018-06-01 15:52:33,delivered,2018-06-01 15:34:15,itagiba,BA,11.0,,0,-30.0
sao paulo,SP,450,45,15,35,4.0,cama_mesa_banho,4,recomendo,190.09,12,credit_card,1,17.18,99.9,sao paulo,sao paulo,2018-01-23,2017-12-30 01:39:04,12/26/2017 13:33:39,2017-12-23 15:58:25,delivered,2017-12-23 15:50:03,florianopolis,SC,6.0,,0,-24.0
cordeiropolis,SP,1000,16,12,13,1.0,beleza_saude,4,,374.24,7,credit_card,1,5.31,25.99,sao paulo,sao paulo,2017-12-26,2017-12-14 15:08:57,12/06/2017 23:17:44,2017-12-01 11:32:19,delivered,2017-12-01 07:15:07,sao paulo,SP,13.0,,0,-12.0
uberlandia,MG,400,16,9,12,1.0,utilidades_domesticas,5,Ótimo ,53.15,5,credit_card,1,9.57,25.99,sao paulo,sao paulo,2017-12-20,2017-12-11 22:47:16,12/04/2017 21:43:16,2017-12-03 20:31:44,delivered,2017-12-03 20:22:53,paracatu,MG,8.0,,0,-9.0
anapolis,GO,150,21,7,14,3.0,telefonia,2,,88.2,2,credit_card,1,18.56,107.9,sao paulo,sao paulo,2017-10-31,2017-10-09 23:02:53,10/04/2017 17:48:24,2017-10-04 11:49:17,delivered,2017-10-04 11:31:15,rio de janeiro,RJ,5.0,,0,-22.0
ribeirao preto,SP,400,16,4,16,3.0,informatica_acessorios,5,,25.9,1,voucher,2,33.93,53.9,sao paulo,sao paulo,2018-08-31,2018-08-27 23:05:55,08/23/2018 11:39:00,2018-08-21 20:50:15,delivered,2018-08-21 20:36:22,curitiba,PR,6.0,,0,-4.0
sao jose do rio preto,SP,9500,56,30,28,1.0,construcao_ferramentas_jardim,2,,46.81,1,credit_card,1,33.93,53.9,são paulo,são paulo,2017-11-27,2017-12-01 18:06:48,11/06/2017 20:28:43,2017-11-02 15:10:35,delivered,2017-11-02 14:51:11,rio de janeiro,RJ,29.0,,0,4.0
sao paulo,SP,300,34,5,27,1.0,cool_stuff,1,,131.47,1,boleto,1,12.48,49.9,sao paulo,sao paulo,2017-07-17,2017-06-30 15:27:34,06/26/2017 08:03:03,2017-06-23 11:35:14,delivered,2017-06-23 11:23:50,xaxim,SC,7.0,,0,-17.0
porto alegre,RS,150,22,7,16,1.0,perfumaria,1,,258.71,3,credit_card,1,17.06,185.81,sao paulo,sao paulo,2018-05-29,2018-05-21 23:56:39,05/17/2018 14:56:00,2018-05-11 03:50:29,delivered,2018-05-10 16:04:42,rio de janeiro,RJ,11.0,,0,-8.0
rio de janeiro,RJ,550,30,5,25,1.0,cama_mesa_banho,1,,84.23,1,credit_card,1,17.26,501.9,sao paulo,sao paulo,2017-03-14,2017-03-01 11:37:25,02/16/2017 12:48:03,2017-02-14 04:03:44,delivered,2017-02-13 09:35:10,santo andre,SP,16.0,,0,-13.0
sao paulo,SP,1100,37,12,30,3.0,automotivo,4,,156.73,10,credit_card,1,16.94,97.9,sao paulo,sao paulo,2017-09-29,2017-09-19 20:12:37,09/14/2017 19:52:15,2017-09-13 20:44:14,delivered,2017-09-13 20:30:02,laranjeiras do sul,PR,5.0,,0,-10.0
sao paulo,SP,300,19,12,13,1.0,beleza_saude,1,,69.9,1,boleto,1,18.83,76.0,sao paulo,sao paulo,2018-04-27,2018-04-13 19:04:19,04/12/2018 18:49:47,2018-04-11 15:12:22,delivered,2018-04-11 14:59:05,sao paulo,SP,2.0,,0,-14.0
sao paulo,SP,21450,70,34,50,,,5,,48.13,1,boleto,1,18.0,15.32,sao paulo,sao paulo,2017-04-10,2017-03-30 14:43:16,03/21/2017 09:17:46,2017-03-19 23:15:51,delivered,2017-03-19 23:15:51,sao paulo,SP,10.0,,0,-11.0
colombo,PR,850,18,10,14,1.0,beleza_saude,3,,187.15,6,credit_card,1,12.65,45.9,sao paulo,sao paulo,2017-11-29,2017-11-21 18:23:02,11/07/2017 19:33:45,2017-11-07 07:30:43,delivered,2017-11-03 12:56:49,itapiuna,CE,18.0,,3,-8.0
diadema,SP,500,17,22,17,2.0,relogios_presentes,5,,69.99,3,credit_card,1,12.71,45.9,sao paulo,sao paulo,2017-12-15,2017-12-11 15:28:55,12/05/2017 20:26:46,2017-11-27 19:58:22,delivered,2017-11-27 19:41:55,sao paulo,SP,13.0,,0,-4.0
piracicaba,SP,750,26,23,23,1.0,esporte_lazer,5,,25.0,1,voucher,2,12.71,45.9,sao paulo,sao paulo,2018-08-06,2018-07-24 15:08:39,07/19/2018 13:34:00,2018-07-18 16:30:32,delivered,2018-07-18 16:16:28,guarulhos,SP,5.0,,0,-13.0
rio de janeiro,RJ,150,28,13,12,6.0,beleza_saude,3,,162.1,2,credit_card,1,0.0,53.9,sao paulo,sao paulo,2018-06-04,2018-05-14 20:31:36,05/07/2018 15:00:00,2018-05-06 10:53:01,delivered,2018-05-06 10:27:56,campinas,SP,8.0,,0,-21.0
sorocaba,SP,30000,76,51,51,3.0,utilidades_domesticas,5,,57.11,1,credit_card,1,0.0,53.9,sao paulo,sao paulo,2017-12-11,2017-11-25 13:51:57,11/16/2017 20:12:13,2017-11-11 12:26:49,delivered,2017-11-11 12:10:02,recife,PE,14.0,,0,-16.0
santa barbara d oeste,SP,325,17,17,17,1.0,sinalizacao_e_seguranca,1,,154.87,1,credit_card,1,15.1,21.99,sao paulo,sao paulo,2017-03-17,2017-03-21 10:35:41,02/23/2017 07:23:34,2017-02-22 06:50:09,delivered,2017-02-20 21:31:59,ribeirao preto,SP,28.0,,1,4.0
pedreira,SP,200,16,2,11,1.0,fashion_bolsas_e_acessorios,5,,236.81,4,credit_card,1,28.99,83.9,sao paulo,sao paulo,2018-03-23,2018-03-14 18:48:51,03/08/2018 18:33:32,2018-03-07 18:10:15,delivered,2018-03-07 17:53:30,divinopolis,MG,7.0,,0,-9.0
arapongas,PR,200,19,3,12,3.0,telefonia,5,Otimo,102.53,1,credit_card,1,8.88,49.99,sao paulo,sao paulo,2018-07-05,2018-06-27 12:58:33,06/26/2018 13:54:00,2018-06-26 05:37:09,delivered,2018-06-24 08:21:25,sao paulo,SP,3.0,,1,-8.0
volta redonda,SP,200,20,15,15,1.0,esporte_lazer,3,,65.1,3,credit_card,1,15.1,50.0,sao paulo,sao paulo,2018-08-30,2018-08-18 11:48:58,08/08/2018 16:18:00,2018-08-07 06:45:09,delivered,2018-08-06 18:45:01,piracicaba,SP,11.0,,0,-12.0
porto ferreira,SP,1000,16,14,30,,,1,,93.64,1,boleto,1,11.15,61.2,sao paulo,sao paulo,2017-08-28,2017-08-15 14:43:59,08/04/2017 19:42:52,2017-08-04 11:03:38,delivered,2017-08-04 10:46:33,formosa,GO,11.0,,0,-13.0
blumenau,SC,800,20,7,20,2.0,fashion_roupa_masculina,4,,64.09,1,boleto,1,15.32,81.9,sao paulo,sao paulo,2018-05-22,2018-05-09 17:08:50,05/07/2018 15:23:00,2018-05-04 11:35:10,delivered,2018-05-03 14:31:13,niteroi,RJ,6.0,,0,-13.0
taboao da serra,SP,700,20,16,17,1.0,beleza_saude,5,,279.4,5,credit_card,1,12.9,79.9,sao paulo,sao paulo,2017-12-27,2017-12-06 19:04:52,12/04/2017 22:09:21,2017-12-02 08:59:42,delivered,2017-12-02 07:55:59,florianopolis,SC,4.0,,0,-21.0
4482255,RJ,250,16,2,11,6.0,relogios_presentes,5,perfeito!!,205.43,5,credit_card,1,14.08,27.99,sao paulo,sao paulo,2018-01-24,2018-01-09 17:09:16,01/05/2018 18:32:26,2018-01-01 23:26:49,delivered,2018-01-01 23:15:14,ponte nova,MG,7.0,,0,-15.0
aracatuba,SP,1800,22,10,18,3.0,automotivo,4,Lol pet,89.57,4,credit_card,1,81.62,1820.0,sao paulo,sao paulo,2017-10-10,2017-09-25 20:56:56,09/19/2017 23:57:50,2017-09-03 15:30:14,delivered,2017-09-03 15:21:44,niteroi,RJ,22.0,,0,-15.0
curitiba,PR,300,19,13,13,1.0,relogios_presentes,5,,75.07,1,boleto,1,14.52,15.99,sao paulo,sao paulo,2018-03-07,2018-02-24 17:38:49,02/06/2018 00:42:45,2018-02-03 00:32:52,delivered,2018-02-03 00:18:09,piracicaba,SP,21.0,,0,-11.0
goiania,GO,450,29,2,17,1.0,livros_tecnicos,5,,63.23,4,credit_card,1,14.7,240.0,são paulo,são paulo,2018-07-20,2018-07-13 17:45:33,07/12/2018 15:04:00,2018-07-12 04:06:09,delivered,2018-07-11 19:25:07,rio brilhante,MS,1.0,,0,-7.0
birigui,SP,400,16,21,15,1.0,informatica_acessorios,4,bom,0.52,1,credit_card,1,38.47,89.99,sao paulo,sao paulo,2017-03-02,2017-02-17 17:06:01,02/10/2017 14:04:07,2017-02-09 02:43:09,delivered,2017-02-07 12:01:07,sao paulo,SP,10.0,,1,-13.0
sorocaba,SP,1635,23,30,17,1.0,cool_stuff,2,,231.27,10,credit_card,1,13.41,399.9,sao paulo,sao paulo,2017-04-20,2017-04-07 15:32:47,03/27/2017 08:58:04,2017-03-23 13:05:42,delivered,2017-03-23 12:21:17,sao paulo,SP,15.0,,0,-13.0
monte siao,MG,750,20,35,20,1.0,moveis_decoracao,4,,41.69,1,boleto,1,17.88,89.9,sao paulo,sao paulo,2018-08-24,2018-08-07 14:21:45,07/31/2018 13:55:00,2018-07-31 03:55:21,delivered,2018-07-30 18:25:18,sao paulo,SP,7.0,,0,-17.0
campinas,SP,500,24,20,24,1.0,beleza_saude,5,,69.41,4,credit_card,1,17.88,89.9,sao paulo,sao paulo,2018-03-09,2018-02-28 20:07:13,02/14/2018 16:39:01,2018-02-09 15:54:33,delivered,2018-02-09 15:26:21,birigui,SP,19.0,,0,-9.0
garuva,SC,350,20,20,20,3.0,consoles_games,1,,72.75,1,credit_card,1,21.35,78.0,sao paulo,sao paulo,2018-05-25,2018-05-18 16:03:07,05/07/2018 14:32:00,2018-05-04 20:30:24,delivered,2018-05-04 20:19:38,ivoti,RS,13.0,,0,-7.0
bonfinopolis de minas,MG,200,18,13,16,1.0,brinquedos,5,Excelente,24.29,2,credit_card,1,8.36,28.8,sao paulo,sao paulo,2017-12-27,2017-12-21 21:17:03,12/11/2017 22:27:23,2017-11-26 12:34:38,delivered,2017-11-26 12:15:07,salvador,BA,25.0,,0,-6.0
cosmopolis,SP,950,26,15,19,3.0,cama_mesa_banho,5,,88.49,5,credit_card,1,8.88,67.99,sao paulo,sao paulo,2018-03-07,2018-03-11 19:28:52,02/17/2018 00:14:57,2018-02-15 15:27:08,delivered,2018-02-15 15:07:11,juazeiro,BA,24.0,,0,4.0
ribeirao preto,SP,300,16,17,11,1.0,brinquedos,5,,71.66,7,credit_card,1,25.73,65.0,sao paulo,sao paulo,2017-09-13,2017-09-12 19:43:56,09/11/2017 17:26:41,2017-08-31 05:44:41,delivered,2017-08-31 05:31:43,ponta grossa,PR,12.0,,0,-1.0
catanduva,SP,452,20,11,18,2.0,beleza_saude,5,1000000,80.81,2,credit_card,1,18.21,89.99,sao paulo,sao paulo,2017-03-17,2017-02-24 10:37:39,02/20/2017 03:54:56,2017-02-11 11:05:19,delivered,2017-02-11 10:53:48,nova venecia,ES,12.0,,0,-21.0
sao paulo,SP,17650,45,50,45,2.0,brinquedos,1,,132.82,2,credit_card,1,17.98,104.99,sao paulo,sao paulo,2017-05-29,2017-05-24 13:25:09,05/19/2017 17:52:05,2017-05-10 02:42:28,delivered,2017-05-08 14:59:40,campina grande,PB,15.0,,1,-5.0
sao goncalo,RJ,1100,35,9,35,2.0,cama_mesa_banho,5,,394.07,7,credit_card,1,7.78,13.99,sao paulo,sao paulo,2018-08-31,2018-08-30 00:36:25,08/28/2018 10:34:00,2018-08-28 04:04:08,delivered,2018-08-27 13:57:36,rio de janeiro,RJ,2.0,,0,-1.0
sao paulo,SP,5250,35,15,35,5.0,utilidades_domesticas,4,,165.5,2,credit_card,1,16.79,3.49,sao paulo,sao paulo,2017-03-03,2017-02-20 17:08:04,02/08/2017 15:48:44,2017-02-06 15:55:38,delivered,2017-02-06 15:43:18,osasco,SP,14.0,,0,-11.0
sao paulo,SP,200,16,10,11,1.0,brinquedos,5,,98.47,2,credit_card,1,16.79,3.49,sao paulo,sao paulo,2018-02-14,2018-01-23 21:25:49,01/17/2018 18:51:50,2018-01-16 10:12:20,delivered,2018-01-16 10:02:20,osasco,SP,7.0,,0,-22.0
rio de janeiro,RJ,340,47,13,13,4.0,relogios_presentes,5,,49.77,2,credit_card,1,16.32,29.99,sao paulo,sao paulo,2018-05-28,2018-05-21 18:08:30,05/18/2018 13:31:00,2018-05-18 13:06:52,delivered,2018-05-18 11:26:45,votorantim,SP,3.0,,0,-7.0
pocos de caldas,MG,750,16,16,16,1.0,beleza_saude,5,Ótimo custo x benefício,180.91,8,credit_card,1,10.96,16.9,são paulo,são paulo,2018-02-14,2018-01-26 18:59:01,01/24/2018 16:28:58,2018-01-22 19:36:36,delivered,2018-01-22 19:19:21,sao paulo,SP,3.0,,0,-19.0
sao goncalo,RJ,2650,33,10,33,1.0,cama_mesa_banho,5,,40.63,4,credit_card,1,23.35,63.0,são paulo,são paulo,2017-12-27,2018-01-09 16:32:21,12/04/2017 19:18:09,2017-11-29 13:12:28,delivered,2017-11-29 13:03:33,maua,SP,41.0,,0,13.0
artur nogueira,SP,300,35,10,25,1.0,moveis_decoracao,4,,71.63,1,debit_card,1,23.35,89.0,sao paulo,sao paulo,2018-02-05,2018-01-05 20:32:44,12/28/2017 12:29:07,2017-12-27 04:08:40,delivered,2017-12-26 02:35:27,salgueiro,PE,10.0,,1,-31.0
santos,SP,13600,16,65,60,1.0,utilidades_domesticas,1,,262.94,5,credit_card,1,19.21,159.0,sao paulo,sao paulo,2017-12-29,2017-12-14 22:57:41,12/13/2017 17:19:04,2017-12-12 21:11:32,delivered,2017-12-12 20:54:42,sao jose dos campos,SP,2.0,,0,-15.0
sao paulo,SP,1250,30,10,20,6.0,construcao_ferramentas_construcao,4,,62.22,3,credit_card,1,16.95,99.99,sao paulo,sao paulo,2018-08-16,2018-08-09 21:05:48,08/06/2018 14:28:00,2018-08-04 09:45:18,delivered,2018-08-04 09:09:37,rio de janeiro,RJ,5.0,,0,-7.0
belo horizonte,MG,3950,33,14,33,2.0,cama_mesa_banho,5,,311.57,5,credit_card,1,8.72,23.89,sao paulo,sao paulo,2017-08-03,,07/04/2017 11:27:21,2017-06-26 10:32:39,shipped,2017-06-26 07:04:39,lorena,SP,,,0,
santana de parnaiba,SP,400,38,2,29,2.0,informatica_acessorios,5,,93.22,1,debit_card,1,15.1,21.99,sao paulo,sao paulo,2018-03-27,2018-03-02 21:51:59,03/01/2018 21:38:37,2018-02-24 09:47:40,delivered,2018-02-24 08:45:01,sao paulo,SP,6.0,,0,-25.0
rio de janeiro,RJ,1100,35,14,29,7.0,malas_acessorios,1,,100.21,1,boleto,1,16.07,188.0,sao paulo,sao paulo,2018-08-15,2018-08-14 18:06:37,08/07/2018 14:21:00,2018-08-05 11:15:13,delivered,2018-08-05 11:05:53,sao goncalo,RJ,9.0,,0,-1.0
joao pessoa,PB,200,16,16,16,3.0,beleza_saude,5,Bom ,125.43,4,credit_card,1,13.11,109.9,são paulo,são paulo,2017-12-15,2017-12-05 19:23:37,11/27/2017 20:12:00,2017-11-26 11:54:51,delivered,2017-11-26 11:38:04,guaruja,SP,9.0,,0,-10.0
dois corregos,SP,425,39,17,39,1.0,eletrodomesticos,2,,80.55,1,boleto,1,14.73,59.9,sao paulo,sao paulo,2018-04-16,2018-04-14 19:18:26,03/27/2018 03:14:53,2018-03-23 11:55:34,delivered,2018-03-23 11:43:13,nova iguacu,RJ,22.0,,0,-2.0
araquari,SC,22050,55,40,60,1.0,utilidades_domesticas,5,,373.44,2,credit_card,1,16.74,139.9,são paulo,são paulo,2018-06-07,2018-06-03 13:06:33,05/22/2018 17:15:00,2018-05-19 02:58:58,delivered,2018-05-17 07:17:54,sao paulo,SP,17.0,,1,-4.0
sao paulo,SP,150,35,8,11,1.0,informatica_acessorios,5,,62.31,3,credit_card,1,18.23,28.49,sao paulo,sao paulo,2018-01-18,2017-12-19 11:59:06,12/13/2017 20:16:26,2017-12-11 17:11:20,delivered,2017-12-09 17:13:50,fortaleza,CE,9.0,,1,-30.0
porto alegre,RS,800,20,8,20,1.0,utilidades_domesticas,5,,36.35,1,debit_card,1,46.67,154.91,sao paulo,sao paulo,2018-05-16,2018-05-23 17:51:15,05/04/2018 15:20:00,2018-05-02 15:58:53,delivered,2018-05-02 13:17:54,toledo,PR,21.0,,0,7.0
sao jose dos pinhais,PR,800,40,8,35,11.0,moveis_decoracao,5,,29.38,2,credit_card,1,46.67,154.91,sao paulo,sao paulo,2018-02-20,2018-02-22 23:49:20,01/26/2018 18:52:05,2018-01-25 19:53:22,delivered,2018-01-25 19:46:47,niteroi,RJ,28.0,,0,2.0
belo horizonte,SP,650,16,10,11,1.0,perfumaria,5,Produto e entrega ótimos,102.47,10,credit_card,1,11.9,99.99,sao paulo,sao paulo,2018-04-02,2018-04-05 17:12:42,03/02/2018 19:08:11,2018-03-02 02:10:25,delivered,2018-03-01 12:43:37,sao pedro da aldeia,RJ,35.0,,0,3.0
uba,MG,500,16,2,11,2.0,fashion_roupa_feminina,5,,130.0,3,credit_card,1,3.81,27.9,são paulo,são paulo,2017-12-13,2017-11-29 10:41:33,11/17/2017 22:32:24,2017-11-16 23:50:57,delivered,2017-11-16 23:40:17,curitiba,PR,12.0,,0,-14.0
"novo hamburgo, rio grande do sul, brasil",RS,198,17,9,15,4.0,cool_stuff,2,,69.13,5,credit_card,1,25.39,21.33,sao paulo,sao paulo,2018-02-02,2018-02-09 00:44:50,01/10/2018 20:24:19,2018-01-04 13:29:16,delivered,2018-01-04 13:14:34,sao bernardo do campo,SP,35.0,,0,7.0
ponta grossa,PR,9150,33,30,44,,,1,,86.24,1,credit_card,1,19.72,504.0,sao paulo,sao paulo,2018-08-17,2018-08-06 22:28:21,08/02/2018 14:20:00,2018-08-01 13:44:25,delivered,2018-08-01 13:30:12,rio de janeiro,RJ,5.0,,0,-11.0
curitiba,PR,500,22,16,16,2.0,utilidades_domesticas,5,,74.29,1,credit_card,1,14.1,25.0,sao paulo,sao paulo,2017-10-27,2017-10-21 15:01:19,10/18/2017 18:47:53,2017-10-17 17:14:35,delivered,2017-10-17 15:58:05,rio de janeiro,RJ,3.0,,0,-6.0
joinville,SC,950,27,30,27,2.0,utilidades_domesticas,4,,70.72,7,credit_card,1,23.31,54.9,sao paulo,sao paulo,2017-11-29,2017-11-23 22:58:27,11/21/2017 17:45:24,2017-11-16 16:35:33,delivered,2017-11-16 16:20:02,vianopolis,GO,7.0,,0,-6.0
floranopolis,SC,3750,42,19,25,1.0,automotivo,1,,199.0,3,credit_card,1,23.31,54.9,sao paulo,sao paulo,2018-02-09,2018-01-23 21:51:48,01/18/2018 23:42:44,2018-01-18 12:56:40,delivered,2018-01-18 12:35:45,arapiraca,AL,5.0,,0,-17.0
jaci,SP,250,16,6,20,3.0,esporte_lazer,5,,340.47,3,credit_card,1,23.31,54.9,sao paulo,sao paulo,2017-10-03,2017-09-20 19:27:41,09/12/2017 00:51:21,2017-09-09 05:04:40,delivered,2017-09-08 14:56:50,porto seguro,BA,12.0,,0,-13.0
sumare,SP,100,17,3,12,1.0,fashion_bolsas_e_acessorios,3,,48.74,4,credit_card,1,23.31,54.9,sao paulo,sao paulo,2018-08-10,2018-08-04 18:26:54,07/31/2018 17:58:00,2018-07-30 19:31:59,delivered,2018-07-29 00:48:48,volta redonda,RJ,6.0,,1,-6.0
sao jose dos pinhais,PR,800,22,7,15,7.0,papelaria,2,,28.08,2,credit_card,1,11.85,5.53,sao paulo,sao paulo,2017-05-16,2017-05-09 16:43:57,04/28/2017 17:52:55,2017-04-27 13:15:50,delivered,2017-04-25 21:33:39,sao paulo,SP,13.0,,1,-7.0
maua,SP,200,17,7,17,3.0,construcao_ferramentas_seguranca,5,,59.9,1,voucher,1,11.85,5.53,sao paulo,sao paulo,2018-06-06,2018-05-03 22:41:04,04/26/2018 14:16:00,2018-04-26 10:35:18,delivered,2018-04-26 09:49:09,sao paulo,SP,7.0,,0,-34.0
guaira,PR,7225,16,103,25,2.0,industria_comercio_e_negocios,4,,166.29,1,credit_card,1,11.85,5.53,sao paulo,sao paulo,2018-03-27,2018-04-16 16:24:45,03/02/2018 20:35:25,2018-03-01 20:49:07,delivered,2018-03-01 20:30:22,curitiba,PR,45.0,,0,20.0
sao paulo,SP,50,40,30,50,1.0,cool_stuff,1,,51.1,1,boleto,1,11.85,5.53,sao paulo,sao paulo,2018-08-22,2018-08-29 01:41:41,08/17/2018 18:55:00,2018-08-17 03:10:22,delivered,2018-08-16 09:44:23,sao goncalo,RJ,12.0,,0,7.0
sao jose dos campos,SP,425,20,9,18,3.0,beleza_saude,5,,67.83,1,credit_card,1,11.85,5.53,são paulo,são paulo,2018-02-09,2018-01-31 18:51:53,01/26/2018 12:46:01,2018-01-25 08:56:56,delivered,2018-01-25 08:43:46,osasco,SP,6.0,,0,-9.0
cachoeiro de itapemirim,ES,950,50,5,50,1.0,cama_mesa_banho,5,,164.35,3,credit_card,1,23.69,127.45,sao paulo,sao paulo,2017-09-08,2017-09-01 20:41:04,08/21/2017 13:54:56,2017-08-16 08:10:14,delivered,2017-08-16 08:00:13,sao paulo,SP,16.0,,0,-7.0
serrana,SP,550,32,11,20,5.0,brinquedos,1,,79.09,1,boleto,1,8.88,29.0,sao paulo,sao paulo,2018-06-13,2018-05-28 16:38:45,05/22/2018 12:23:00,2018-05-22 09:36:26,delivered,2018-05-21 13:16:36,nova iguacu,RJ,7.0,,0,-16.0
sao paulo,SP,14350,41,55,31,7.0,eletrodomesticos_2,4,,93.69,1,boleto,1,18.24,19.9,sao paulo,sao paulo,2018-06-04,2018-05-17 21:52:12,05/14/2018 14:54:00,2018-05-12 00:31:55,delivered,2018-05-12 00:18:28,barueri,SP,5.0,,0,-18.0
rolandia,PR,328,20,14,18,1.0,beleza_saude,5,,59.82,2,credit_card,1,23.75,135.0,sao paulo,sao paulo,2018-01-26,2018-01-12 23:18:59,01/05/2018 19:36:18,2018-01-04 05:16:06,delivered,2018-01-03 16:29:52,ariquemes,RO,9.0,,0,-14.0
sao paulo,SP,1950,58,15,46,1.0,cama_mesa_banho,3,,159.03,3,credit_card,1,15.72,119.9,sao paulo,sao paulo,2017-09-13,2017-09-06 14:43:50,09/05/2017 21:35:05,2017-09-02 02:45:40,delivered,2017-08-31 09:31:20,presidente getulio,SC,6.0,,1,-7.0
rio de janeiro,RJ,700,16,40,11,1.0,beleza_saude,5,,92.57,9,credit_card,1,12.69,30.0,sao paulo,sao paulo,2017-08-14,2017-07-25 21:54:23,07/14/2017 20:43:44,2017-07-12 19:03:33,delivered,2017-07-12 18:45:24,brasilia,DF,13.0,,0,-20.0
sao paulo,SP,1250,22,11,20,1.0,eletrodomesticos,1,,42.77,4,credit_card,1,12.69,30.0,sao paulo,sao paulo,2018-06-29,2018-06-16 10:12:15,06/15/2018 14:17:00,2018-06-14 18:58:12,delivered,2018-06-14 18:37:58,belo horizonte,MG,1.0,,0,-13.0
sao paulo,SP,400,20,5,20,2.0,construcao_ferramentas_construcao,5,PRODUTO OK,453.74,8,credit_card,1,14.1,14.4,sao paulo,sao paulo,2018-04-04,2018-04-11 12:53:50,03/13/2018 21:24:28,2018-03-09 19:08:26,delivered,2018-03-08 19:06:05,rio de janeiro,RJ,33.0,,1,7.0
congonhas,MG,2320,63,33,17,3.0,esporte_lazer,5,Excelente,234.08,3,credit_card,1,14.31,79.99,são paulo,são paulo,2017-06-12,2017-05-15 19:27:34,05/11/2017 13:44:39,2017-05-09 16:35:23,delivered,2017-05-08 16:31:38,florianopolis,SC,7.0,,1,-28.0
sao jose do rio preto,SP,2700,16,30,25,1.0,ferramentas_jardim,5,,67.62,2,credit_card,1,18.34,129.9,sao paulo,sao paulo,2017-12-08,2017-11-27 21:59:13,11/17/2017 19:12:26,2017-11-17 04:06:21,delivered,2017-11-16 13:18:14,rio negro,PR,11.0,,0,-11.0
sao paulo,SP,455,21,15,17,1.0,perfumaria,5,,19.33,1,credit_card,1,7.78,37.99,sao paulo,sao paulo,2017-07-19,2017-07-10 13:48:36,07/06/2017 14:05:35,2017-06-29 23:23:28,delivered,2017-06-29 23:08:50,contagem,MG,10.0,,0,-9.0
atibaia,SP,150,16,6,20,3.0,fashion_bolsas_e_acessorios,4,,143.18,3,credit_card,1,15.3,79.0,sao paulo,sao paulo,2017-09-27,2017-09-12 20:52:38,08/31/2017 19:42:41,2017-08-26 10:35:17,delivered,2017-08-26 10:26:53,caxias do sul,RS,17.0,,0,-15.0
itapecerica da serra,SP,2200,45,25,35,1.0,cama_mesa_banho,5,,112.83,4,credit_card,1,20.51,219.9,são paulo,são paulo,2018-02-19,2018-01-24 20:18:57,01/15/2018 21:33:17,2018-01-15 00:29:16,delivered,2018-01-15 00:14:21,porto alegre,RS,9.0,,0,-26.0
sao  jose dos pinhais,PR,1400,37,23,35,2.0,cama_mesa_banho,5,,85.92,1,boleto,1,12.69,19.9,sao paulo,sao paulo,2018-06-21,2018-06-09 20:03:11,06/07/2018 13:02:00,2018-06-06 02:53:58,delivered,2018-06-05 19:53:27,fortaleza,CE,4.0,,0,-12.0
sorocaba,SP,450,45,15,35,2.0,casa_conforto,2,,102.05,4,credit_card,1,20.09,169.0,sao paulo,sao paulo,2017-03-23,2017-03-14 07:24:12,03/08/2017 17:24:42,2017-03-07 04:05:14,delivered,2017-03-04 09:55:08,rio de janeiro,RJ,9.0,,2,-9.0
boituva,SP,835,40,9,33,1.0,cama_mesa_banho,5,,134.12,3,credit_card,1,16.71,147.9,sao paulo,sao paulo,2017-07-18,2017-07-10 19:07:41,07/07/2017 13:11:21,2017-07-05 17:36:19,delivered,2017-07-04 23:29:52,santa maria,RS,5.0,,0,-8.0
piracicaba,SP,1250,36,16,24,2.0,cool_stuff,5,,112.13,1,credit_card,1,14.14,211.05,sao paulo,sao paulo,2017-06-12,2017-06-01 16:15:31,05/22/2017 12:47:36,2017-05-19 14:25:24,delivered,2017-05-19 14:12:50,rio de janeiro,RJ,13.0,,0,-11.0
sao paulo,SP,550,26,17,17,1.0,informatica_acessorios,5,,70.75,1,credit_card,1,37.54,610.0,sao paulo,sao paulo,2018-05-15,2018-05-04 21:18:36,05/02/2018 15:20:00,2018-04-25 22:10:25,delivered,2018-04-24 22:18:53,sao paulo,SP,9.0,,0,-11.0
franca,SP,3850,20,30,30,1.0,cama_mesa_banho,5,,77.6,7,credit_card,1,38.45,129.0,sao paulo,sao paulo,2017-10-16,2017-10-03 21:13:43,09/20/2017 13:35:16,2017-09-15 02:24:49,delivered,2017-09-13 17:53:28,jau,SP,20.0,,1,-13.0
garopaba,SC,7000,22,52,27,6.0,cool_stuff,5,,197.04,1,credit_card,1,7.78,16.0,são paulo,são paulo,2017-12-08,2017-11-30 22:04:00,11/21/2017 15:47:41,2017-11-20 11:56:31,delivered,2017-11-20 11:44:11,recife,PE,10.0,,0,-8.0
porto alegre,RS,1250,19,17,22,1.0,cama_mesa_banho,4,5,93.18,1,credit_card,1,53.11,189.0,sao paulo,sao paulo,2018-04-25,,04/05/2018 19:16:46,2018-04-04 00:48:50,shipped,2018-04-04 00:33:47,rio de janeiro,RJ,,,0,
tupa,SP,850,48,16,25,3.0,relogios_presentes,5,,44.72,1,boleto,1,18.23,12.99,são paulo,são paulo,2018-02-14,2018-02-01 00:08:55,01/23/2018 17:21:22,2018-01-19 18:20:43,delivered,2018-01-19 18:07:37,ribeirao pires,SP,12.0,,0,-13.0
sao paulo,SP,900,30,10,20,1.0,ferramentas_jardim,5,,26.38,1,credit_card,1,11.97,109.9,sao paulo,sao paulo,2018-06-07,2018-05-24 00:31:18,05/07/2018 15:09:00,2018-05-07 16:52:39,delivered,2018-05-07 01:09:09,sao jose da coroa grande,PE,16.0,,0,-14.0
sao paulo,SP,400,16,5,11,11.0,fashion_underwear_e_moda_praia,3,,149.14,1,debit_card,1,15.3,29.0,são paulo,são paulo,2018-02-16,,,2018-01-31 14:23:50,unavailable,2018-01-31 11:31:37,rio de janeiro,RJ,,,0,
porto ferreira,SP,400,20,11,19,1.0,relogios_presentes,5,,106.32,4,credit_card,1,8.37,159.9,sao paulo,sao paulo,2018-07-11,2018-06-13 18:22:44,06/12/2018 14:23:00,2018-05-31 10:30:46,delivered,2018-05-31 10:16:12,agua doce do norte,ES,13.0,,0,-28.0
sao paulo,SP,1100,24,16,15,2.0,esporte_lazer,5,,246.96,8,credit_card,1,9.26,59.9,sao paulo,sao paulo,2017-08-25,2017-08-04 21:04:49,08/02/2017 20:52:09,2017-07-31 21:15:09,delivered,2017-07-31 20:47:50,sao bernardo do campo,SP,4.0,,0,-21.0
mairipora,SP,850,24,13,18,6.0,ferramentas_jardim,5,,22.29,1,credit_card,1,26.54,292.9,sao paulo,sao paulo,2018-07-05,2018-06-15 19:14:38,06/08/2018 11:18:00,2018-06-01 17:53:11,delivered,2018-05-31 17:47:23,anapolis,GO,15.0,,1,-20.0
sao paulo,SP,400,18,11,15,6.0,relogios_presentes,5,,57.48,3,credit_card,1,94.98,143.0,sao paulo,sao paulo,2018-07-27,2018-07-23 17:48:39,07/18/2018 07:50:00,2018-07-12 22:25:13,delivered,2018-07-12 22:14:06,guararapes,SP,10.0,,0,-4.0
campinas,SP,675,22,9,16,1.0,audio,5,,105.28,4,credit_card,1,94.98,143.0,sao paulo,sao paulo,2018-01-09,2017-12-20 19:05:03,12/13/2017 22:07:57,2017-12-12 03:49:32,delivered,2017-12-07 15:40:14,petropolis,RJ,13.0,,4,-20.0
guaimbe,SP,175,19,12,13,2.0,beleza_saude,5,,203.54,8,credit_card,1,9.09,52.9,sao paulo,sao paulo,2018-01-16,2017-12-27 20:41:46,12/13/2017 17:13:08,2017-12-10 23:49:19,delivered,2017-12-10 23:35:48,sao paulo,SP,16.0,,0,-20.0
parai,RS,1350,18,17,16,1.0,alimentos_bebidas,5,,330.4,2,credit_card,1,25.54,99.9,sao paulo,sao paulo,2017-08-15,2017-07-28 18:15:51,07/26/2017 10:32:31,2017-07-24 16:25:13,delivered,2017-07-24 16:14:28,suzano,SP,4.0,,0,-18.0
osvaldo cruz,SP,588,20,17,15,5.0,informatica_acessorios,5,,108.68,1,boleto,1,34.15,49.0,sao paulo,sao paulo,2017-08-22,2017-08-07 20:32:51,07/31/2017 17:27:38,2017-07-27 23:45:05,delivered,2017-07-27 23:29:11,farroupilha,RS,10.0,,0,-15.0
sao bernardo do campo,SP,450,20,10,20,1.0,utilidades_domesticas,5,,415.93,1,boleto,1,24.9,99.9,são paulo,são paulo,2018-05-08,2018-04-23 15:32:11,04/20/2018 18:32:52,2018-04-19 20:51:20,delivered,2018-04-19 19:34:08,maua,SP,3.0,,0,-15.0
pocos de caldas,MG,1500,68,9,33,5.0,automotivo,5,,314.21,10,credit_card,1,15.1,32.5,sao paulo,sao paulo,2017-12-26,2017-12-22 17:17:53,12/04/2017 22:53:02,2017-11-29 02:18:46,delivered,2017-11-28 08:02:38,rio de janeiro,RJ,24.0,,0,-4.0
aperibe,RJ,1550,35,30,40,2.0,esporte_lazer,3,,206.08,1,credit_card,1,7.78,15.0,sao paulo,sao paulo,2018-08-03,2018-07-23 17:54:34,07/12/2018 06:46:00,2018-06-28 10:50:22,delivered,2018-06-28 10:28:34,cacapava,SP,25.0,,0,-11.0
divinopolis,MG,683,31,16,16,1.0,beleza_saude,4,4,27.7,1,credit_card,1,16.36,230.0,sao paulo,sao paulo,2017-11-10,2017-10-27 21:44:26,10/26/2017 20:41:31,2017-10-16 18:45:47,delivered,2017-10-16 18:26:48,almenara,MG,11.0,,0,-14.0
sao paulo,SP,2500,35,9,25,1.0,moveis_decoracao,1,,19.48,1,boleto,1,9.76,79.99,sao paulo,sao paulo,2018-03-01,2018-02-05 19:53:12,01/25/2018 22:16:03,2018-01-23 10:29:22,delivered,2018-01-23 10:15:38,rio das ostras,RJ,13.0,,0,-24.0
tupa,SP,500,30,6,23,2.0,bebes,5,,121.09,2,credit_card,1,7.78,29.99,sao paulo,sao paulo,2018-08-28,2018-08-27 14:11:55,08/21/2018 19:01:00,2018-08-20 16:50:16,delivered,2018-08-19 11:28:11,gravatai,RS,8.0,,1,-1.0
curitiba,PR,300,20,34,44,2.0,esporte_lazer,1,,206.76,1,credit_card,1,15.14,219.99,são paulo,são paulo,2018-06-20,2018-05-30 15:48:56,05/28/2018 14:09:00,2018-05-27 23:49:24,delivered,2018-05-26 23:52:17,recife,PE,3.0,,0,-21.0
sorocaba,SP,350,16,16,15,1.0,beleza_saude,5,,142.21,1,credit_card,1,7.78,59.99,sao paulo,sao paulo,2017-10-17,2017-09-27 16:32:39,09/22/2017 20:12:59,2017-09-21 22:50:07,delivered,2017-09-21 22:33:55,brumado,BA,5.0,,0,-20.0
jaguaruna,SC,250,16,12,11,1.0,cool_stuff,4,,73.34,1,boleto,1,7.87,120.0,sao paulo,sao paulo,2018-06-12,2018-05-16 17:19:18,05/07/2018 13:37:00,2018-05-05 00:13:52,delivered,2018-05-04 00:12:31,sao paulo,SP,12.0,,1,-27.0
arapongas,PR,2900,40,10,35,1.0,moveis_decoracao,4,,72.62,1,credit_card,1,23.55,139.0,são paulo,são paulo,2018-01-24,2018-01-09 00:45:19,12/20/2017 23:28:11,2017-12-20 14:31:37,delivered,2017-12-20 14:00:18,belo horizonte,MG,19.0,,0,-15.0
nova iguacu,RJ,200,16,2,11,2.0,informatica_acessorios,3,,86.24,1,credit_card,1,8.3,149.9,sao paulo,sao paulo,2018-06-01,2018-05-18 22:46:45,05/14/2018 11:49:00,2018-05-13 23:11:49,delivered,2018-05-13 22:50:32,sao paulo,SP,4.0,,0,-14.0
sao paulo,SP,383,16,12,13,3.0,telefonia,1,,230.1,1,boleto,1,22.68,139.0,sao paulo,sao paulo,2018-03-15,2018-02-27 18:28:43,02/19/2018 23:31:19,2018-02-16 09:35:28,delivered,2018-02-16 09:17:44,rio de janeiro,RJ,11.0,,0,-16.0
vila velha,SP,200,16,16,16,5.0,consoles_games,3,,206.14,1,boleto,1,12.09,99.99,sao paulo,sao paulo,2018-01-12,2018-01-02 19:43:30,12/13/2017 20:41:52,2017-12-12 03:36:30,delivered,2017-12-10 16:46:22,campos dos goytacazes,RJ,23.0,,1,-10.0
araraquara,SP,1300,30,16,16,1.0,informatica_acessorios,5,,212.73,1,boleto,1,22.58,299.0,são paulo,são paulo,2017-12-28,2017-12-13 12:57:23,12/12/2017 22:37:03,2017-12-12 00:05:01,delivered,2017-12-11 23:18:07,marilia,SP,1.0,,0,-15.0
santo andre,SP,4300,16,15,11,1.0,bebidas,5,,94.82,1,credit_card,1,22.58,299.0,sao paulo,sao paulo,2017-03-29,2017-03-15 16:15:42,03/10/2017 13:44:54,2017-03-10 11:45:28,delivered,2017-03-10 11:45:28,itabira,MG,5.0,,0,-14.0
joinville,SC,150,16,7,12,2.0,beleza_saude,5,,126.44,1,boleto,1,17.65,129.99,sao paulo,sao paulo,2017-11-22,2017-11-13 22:33:12,11/06/2017 11:08:52,2017-10-28 21:46:29,delivered,2017-10-28 21:26:26,sorocaba,SP,16.0,,0,-9.0
campinas,SP,400,17,8,17,1.0,moveis_decoracao,5,,140.08,1,voucher,2,36.96,379.0,sao paulo,sao paulo,2018-03-14,2018-03-05 20:29:54,02/23/2018 20:23:26,2018-02-22 15:27:34,delivered,2018-02-22 14:54:45,rio de janeiro,RJ,11.0,,0,-9.0
rio de janeiro,RJ,1400,25,10,25,1.0,cama_mesa_banho,4,Recomendo a todos. ,68.87,1,credit_card,1,11.85,49.0,sao paulo,sao paulo,2017-08-04,2017-08-01 21:10:36,07/12/2017 20:47:52,2017-07-05 06:44:25,delivered,2017-07-03 16:42:42,sao paulo,SP,29.0,,1,-3.0
guarulhos,SP,450,20,15,15,6.0,automotivo,4,,87.58,2,credit_card,1,16.67,129.9,são paulo,são paulo,2018-02-22,,01/29/2018 22:33:25,2018-01-26 21:58:39,canceled,2018-01-26 21:34:08,claudia,MT,,,0,
juiz de fora,MG,154,17,10,13,1.0,esporte_lazer,4,,305.19,10,credit_card,1,34.15,36.9,sao paulo,sao paulo,2018-05-17,2018-05-04 22:19:10,04/26/2018 07:49:00,2018-04-25 04:11:10,delivered,2018-04-24 10:29:25,florianopolis,SC,10.0,,0,-13.0
rio de janeiro,RJ,470,21,23,21,1.0,utilidades_domesticas,5,,161.88,5,credit_card,1,17.19,45.0,são paulo,são paulo,2018-09-04,2018-08-24 14:58:37,08/16/2018 13:27:00,2018-08-16 14:05:13,delivered,2018-08-16 13:50:48,rio de janeiro,RJ,8.0,,0,-11.0
fronteira,MG,5500,33,22,33,,,4,,88.08,1,debit_card,1,7.78,45.0,sao paulo,sao paulo,2017-09-28,2017-09-19 16:58:58,08/29/2017 16:09:26,2017-08-28 20:44:52,delivered,2017-08-28 20:27:54,guarulhos,SP,21.0,,0,-9.0
novo horizonte,SP,650,16,10,16,1.0,eletroportateis,3,,92.5,3,credit_card,1,7.78,29.99,são paulo,são paulo,2018-07-19,2018-07-03 04:42:39,06/28/2018 14:37:00,2018-06-27 16:29:31,delivered,2018-06-27 16:11:38,sao caetano do sul,SP,5.0,,0,-16.0
pilar do sul,SP,100,18,11,14,2.0,informatica_acessorios,5,Super recomendado,43.0,1,credit_card,1,18.52,84.9,sao paulo,sao paulo,2017-11-06,2017-10-23 20:54:05,10/18/2017 19:44:58,2017-10-17 17:46:49,delivered,2017-10-17 17:02:32,belo horizonte,MG,6.0,,0,-14.0
itajobi,SP,1600,40,20,20,1.0,cama_mesa_banho,1,,116.36,2,credit_card,1,20.02,75.0,sao paulo,sao paulo,2018-02-07,2018-01-22 15:25:33,01/08/2018 23:27:21,2018-01-06 21:49:26,delivered,2018-01-06 21:37:54,rio de janeiro,RJ,15.0,,0,-16.0
maringa,PR,400,16,30,20,1.0,moveis_decoracao,3,,64.48,1,boleto,1,18.23,19.0,sao paulo,sao paulo,2018-03-09,2018-03-05 19:08:17,02/20/2018 21:27:02,2018-02-15 12:15:32,delivered,2018-02-15 11:58:49,sao paulo,SP,18.0,,0,-4.0
sao paulo,SP,2350,33,7,37,1.0,cama_mesa_banho,5,,37.69,1,boleto,1,7.78,34.99,sao paulo,sao paulo,2017-11-14,2017-10-31 20:22:51,10/27/2017 19:05:34,2017-10-26 20:46:38,delivered,2017-10-26 20:30:28,para de minas,MG,4.0,,0,-14.0
cariacica / es,ES,975,31,12,21,1.0,utilidades_domesticas,2,,150.52,2,credit_card,1,21.26,59.9,sao paulo,sao paulo,2018-03-15,2018-03-09 20:13:22,03/07/2018 00:32:30,2018-03-06 03:55:59,delivered,2018-03-03 17:11:33,niteroi,RJ,6.0,,2,-6.0
prados,MG,1800,30,6,20,1.0,moveis_decoracao,5,,314.3,6,credit_card,1,17.85,85.9,sao paulo,sao paulo,2018-07-23,2018-06-30 13:50:47,06/27/2018 09:06:00,2018-06-26 05:12:58,delivered,2018-06-23 19:29:12,miguelopolis,SP,6.0,,2,-23.0
florianopolis,SC,1150,32,5,30,2.0,cama_mesa_banho,1,,396.35,8,credit_card,1,19.42,64.9,sao paulo,sao paulo,2017-11-10,2017-10-27 21:23:49,10/23/2017 18:50:12,2017-10-22 14:49:15,delivered,2017-10-22 14:25:40,terra roxa,SP,5.0,,0,-14.0
sao carlos,SP,1250,19,17,22,1.0,cama_mesa_banho,5,,98.33,1,debit_card,2,24.11,219.0,sao paulo,sao paulo,2017-10-19,2017-10-18 19:32:17,09/27/2017 21:16:18,2017-09-20 11:50:10,delivered,2017-09-20 11:35:09,paulinia,SP,28.0,,0,-1.0
santos,SP,1300,42,12,20,2.0,beleza_saude,1,,120.92,1,credit_card,1,25.81,138.0,sao paulo,sao paulo,2018-08-20,2018-08-07 19:32:24,08/01/2018 16:07:00,2018-07-31 20:55:33,delivered,2018-07-31 20:47:41,araguari,MG,6.0,,0,-13.0
itaquaquecetuba,SP,1300,30,20,30,,,5,,76.17,1,credit_card,1,15.1,30.9,sao paulo,sao paulo,2018-04-02,2018-04-17 17:37:54,03/12/2018 17:08:26,2018-03-11 00:00:30,delivered,2018-03-10 23:24:50,contagem,MG,37.0,,0,15.0
mucambo,CE,1200,20,20,20,,,5,Super recomendo,104.43,1,credit_card,1,16.79,31.9,sao paulo,sao paulo,2018-08-01,2018-07-25 14:08:33,07/23/2018 14:41:00,2018-07-20 12:43:35,delivered,2018-07-20 12:25:03,rio de janeiro,RJ,5.0,,0,-7.0
colombo,PR,1800,45,14,35,1.0,moveis_decoracao,4,,105.94,1,credit_card,1,10.7,71.0,sao paulo,sao paulo,2017-10-30,2017-10-10 21:27:50,10/05/2017 20:47:31,2017-10-04 23:35:24,delivered,2017-10-04 23:23:34,cacapava,SP,5.0,,0,-20.0
rio claro,SP,509,17,13,13,1.0,ferramentas_jardim,5,,110.04,3,credit_card,1,26.75,101.0,sao paulo,sao paulo,2018-02-14,2018-02-02 19:24:24,01/24/2018 23:56:52,2018-01-22 13:53:51,delivered,2018-01-21 16:46:04,lages,SC,12.0,,0,-12.0
ibitinga,SP,100,16,15,16,1.0,automotivo,5,Excelente Loja,730.95,1,boleto,1,7.78,45.9,sao paulo,sao paulo,2018-08-20,2018-08-06 16:12:24,08/02/2018 10:38:00,2018-08-01 21:45:18,delivered,2018-07-31 21:51:41,brasilia,DF,5.0,,0,-14.0
bento goncalves,RS,8809,52,52,17,1.0,esporte_lazer,5,,128.77,4,credit_card,1,16.11,35.0,sao paulo,sao paulo,2017-03-30,2017-03-28 13:20:16,03/16/2017 12:42:03,2017-03-06 21:25:18,delivered,2017-03-06 21:15:37,rio de janeiro,RJ,21.0,,0,-2.0
sao paulo,SP,14900,48,30,48,6.0,construcao_ferramentas_construcao,4,,82.1,8,credit_card,1,16.11,35.0,sao paulo,sao paulo,2017-07-28,2017-07-13 20:27:55,07/10/2017 19:11:54,2017-07-08 17:45:18,delivered,2017-07-08 17:35:03,embu das artes,SP,5.0,,0,-15.0
taubate,SP,1050,100,7,15,2.0,moveis_decoracao,5,,53.39,1,boleto,1,15.17,59.9,sao paulo,sao paulo,2017-06-01,2017-05-23 22:13:35,05/16/2017 08:54:10,2017-05-11 21:45:17,delivered,2017-05-11 21:36:10,saquarema,RJ,12.0,,0,-9.0
curitiba,PR,950,29,10,25,1.0,cama_mesa_banho,5,,61.79,3,credit_card,1,9.34,59.9,são paulo,são paulo,2018-02-14,2018-01-29 21:49:43,01/23/2018 17:30:14,2018-01-22 15:38:22,delivered,2018-01-22 15:24:44,rio de janeiro,RJ,7.0,,0,-16.0
maringa,PR,500,19,17,25,2.0,cool_stuff,5,,86.83,1,boleto,1,7.39,49.8,sao paulo,sao paulo,2018-03-28,2018-03-21 20:32:39,03/14/2018 18:28:34,2018-03-10 21:40:32,delivered,2018-03-10 20:39:19,limeira,SP,10.0,,0,-7.0
londrina,PR,100,18,6,14,6.0,telefonia,3,,45.3,1,credit_card,1,7.39,49.8,sao paulo,sao paulo,2018-08-15,2018-08-10 19:12:18,08/09/2018 14:27:00,2018-08-09 03:45:13,delivered,2018-08-07 14:12:05,canoas,RS,3.0,,1,-5.0
sao paulo,SP,12400,35,35,50,5.0,cool_stuff,5,,25.5,1,credit_card,1,7.39,7.5,são paulo,são paulo,2018-01-16,2017-12-29 13:17:54,12/28/2017 18:28:16,2017-12-27 20:35:30,delivered,2017-12-27 20:24:42,sao paulo,SP,1.0,,0,-18.0
montes claros,MG,700,45,10,31,1.0,papelaria,4,,103.79,1,voucher,2,7.39,7.5,sao paulo,sao paulo,2017-05-08,2017-04-20 17:38:07,04/18/2017 07:27:45,2017-04-16 01:05:16,delivered,2017-04-15 23:53:50,sao jose do rio preto,SP,4.0,,0,-18.0
curitiba,PR,253,18,11,13,2.0,relogios_presentes,4,,114.28,6,credit_card,1,15.33,89.9,sao paulo,sao paulo,2018-05-09,2018-04-25 18:11:42,04/19/2018 02:22:27,2018-04-17 05:50:27,delivered,2018-04-15 22:11:11,taubate,SP,9.0,,1,-14.0
sao paulo,SP,1413,40,16,31,1.0,beleza_saude,4,,57.78,2,credit_card,1,15.34,76.9,sao paulo,sao paulo,2017-10-09,2017-09-24 11:29:16,09/12/2017 20:52:55,2017-09-11 15:50:47,delivered,2017-09-11 15:39:11,fortaleza,CE,12.0,,0,-15.0
sao bernardo do campo,SP,1150,27,15,16,4.0,moveis_cozinha_area_de_servico_jantar_e_jardim,3,,124.15,1,credit_card,1,15.28,24.99,sao paulo,sao paulo,2017-03-28,2017-03-11 08:32:59,03/02/2017 20:34:25,2017-02-25 14:50:18,delivered,2017-02-25 14:34:40,santa fe do sul,SP,13.0,,0,-17.0
praia grande,SP,18667,88,28,67,3.0,bebes,1,,64.1,3,credit_card,1,17.4,69.9,são paulo,são paulo,2018-06-13,2018-06-09 00:14:23,05/21/2018 13:45:00,2018-05-19 02:59:02,delivered,2018-05-17 16:34:49,caieiras,SP,22.0,,1,-4.0
guarulhos,SP,65,17,12,17,1.0,construcao_ferramentas_jardim,5,Super satisfeita. ,179.92,10,credit_card,1,34.15,29.99,sao paulo,sao paulo,2017-10-09,2017-10-22 14:16:51,09/22/2017 20:45:53,2017-09-16 09:35:12,delivered,2017-09-16 09:20:26,sao paulo,SP,36.0,,0,13.0
canoas,RS,700,36,12,30,4.0,pet_shop,5,,40.01,1,boleto,1,16.39,234.9,sao paulo,sao paulo,2018-04-04,2018-03-23 14:34:43,03/06/2018 22:33:27,2018-02-28 09:56:35,delivered,2018-02-27 08:31:17,itaguai,RJ,24.0,,1,-12.0
curitiba,PR,1075,34,31,34,3.0,ferramentas_jardim,1,,104.27,5,credit_card,1,25.96,159.9,são paulo,são paulo,2017-04-24,2017-04-04 17:18:03,03/27/2017 15:40:01,2017-03-25 02:32:36,delivered,2017-03-24 15:50:46,carangola,MG,11.0,,0,-20.0
vicosa,MG,4050,30,53,30,4.0,pet_shop,5,,307.96,8,credit_card,1,17.6,49.9,sao paulo,sao paulo,2018-07-17,2018-06-26 19:14:58,06/18/2018 12:04:00,2018-06-15 20:41:15,delivered,2018-06-15 20:16:34,chapada do norte,MG,10.0,,0,-21.0
campinas,SP,200,16,6,11,1.0,artigos_de_festas,1,,31.29,2,credit_card,1,9.09,24.9,sao paulo,sao paulo,2017-06-23,2017-06-19 20:13:30,06/08/2017 14:03:15,2017-06-02 20:05:12,delivered,2017-05-31 20:57:49,campinas,SP,18.0,,1,-4.0
sao paulo,SP,1200,16,22,11,1.0,cama_mesa_banho,5,,38.13,1,credit_card,1,9.09,24.9,sao paulo,sao paulo,2018-07-30,2018-07-27 16:18:46,07/18/2018 14:09:00,2018-07-13 19:45:10,delivered,2018-07-13 19:38:58,loanda,PR,13.0,,0,-3.0
sao paulo,SP,500,25,15,20,1.0,pet_shop,4,,52.01,1,voucher,1,11.74,162.0,sao paulo,sao paulo,2018-05-09,2018-05-02 20:24:30,04/30/2018 19:02:00,2018-04-30 11:35:38,delivered,2018-04-30 11:18:47,franca,SP,2.0,,0,-7.0
rio de janeiro,RJ,8817,43,24,47,2.0,construcao_ferramentas_construcao,1,,35.05,1,credit_card,1,18.41,43.9,sao paulo,sao paulo,2017-03-27,2017-03-16 13:35:37,03/13/2017 09:42:13,2017-03-08 19:55:23,delivered,2017-03-08 19:55:23,passa tres,RJ,7.0,,0,-11.0
curitiba,PR,100,24,11,16,2.0,musica,2,,186.49,8,credit_card,1,23.25,189.0,sao paulo,sao paulo,2018-05-22,2018-05-14 16:39:50,05/10/2018 19:16:00,2018-05-08 04:54:49,delivered,2018-05-06 19:45:32,aracoiaba da serra,SP,7.0,,1,-8.0
porto velho,RO,2050,42,25,15,1.0,cool_stuff,5,,99.95,4,credit_card,1,15.1,14.9,sao paulo,sao paulo,2017-05-25,2017-05-15 12:47:31,05/05/2017 15:08:33,2017-05-03 14:45:23,delivered,2017-05-02 16:35:06,nova iguacu,RJ,12.0,,0,-10.0
salvador,BA,13600,58,28,58,1.0,moveis_escritorio,5,,215.62,4,credit_card,1,15.15,56.99,sao paulo,sao paulo,2018-03-13,2018-03-10 00:12:46,02/19/2018 23:41:53,2018-02-17 16:50:36,delivered,2018-02-17 16:39:44,porto alegre,RS,20.0,,0,-3.0
sao jose do rio pardo,SP,250,17,4,12,3.0,telefonia,1,,206.2,3,credit_card,1,16.16,75.0,sao paulo,sao paulo,2018-06-05,2018-06-05 15:38:50,05/17/2018 11:11:00,2018-05-16 14:55:29,delivered,2018-05-16 13:47:51,cachoeiro de itapemirim,ES,20.0,,0,0.0
contagem,MG,24050,80,30,60,4.0,eletronicos,5,,55.06,1,boleto,1,8.27,39.49,sao paulo,sao paulo,2017-07-10,2017-06-26 16:21:57,06/20/2017 15:47:27,2017-06-19 18:10:19,delivered,2017-06-19 18:00:01,itaborai,RJ,6.0,,0,-14.0
pato branco,PR,300,27,11,15,3.0,beleza_saude,4,,21.04,1,credit_card,1,8.27,39.49,sao paulo,sao paulo,2017-12-12,2017-11-30 13:08:44,11/27/2017 16:36:45,2017-11-26 11:31:40,delivered,2017-11-26 11:20:27,juiz de fora,MG,4.0,,0,-12.0
sao joao del rei,MG,667,20,17,18,3.0,relogios_presentes,5,,26.45,1,credit_card,1,15.11,44.9,sao paulo,sao paulo,2018-02-16,2018-04-04 17:12:36,01/19/2018 22:41:38,2018-01-19 01:21:52,delivered,2018-01-19 00:48:30,limeira,SP,75.0,,0,47.0
ribeirao preto,SP,7100,29,8,29,1.0,construcao_ferramentas_construcao,5,,127.53,1,credit_card,1,18.31,29.9,sao paulo,sao paulo,2017-12-07,2017-11-28 22:18:26,11/23/2017 22:32:01,2017-11-23 14:49:06,delivered,2017-11-23 14:31:36,aperibe,RJ,5.0,,0,-9.0
presidente prudente,SP,600,23,25,20,1.0,brinquedos,5,,223.14,10,credit_card,1,9.94,55.9,sao paulo,sao paulo,2018-05-09,2018-04-24 14:31:22,04/17/2018 23:46:48,2018-04-16 14:35:18,delivered,2018-04-16 14:21:02,vitoria,ES,8.0,,0,-15.0
mogi das cruzes,SP,1450,38,31,24,2.0,beleza_saude,1,,56.41,2,credit_card,1,43.4,66.0,sao paulo,sao paulo,2018-06-08,2018-05-26 00:08:34,05/09/2018 15:48:00,2018-05-05 09:39:09,delivered,2018-05-05 09:22:24,rio de janeiro,RJ,20.0,,0,-13.0
paracambi,RJ,6250,53,23,28,1.0,utilidades_domesticas,5,Super recomendo,566.63,1,boleto,1,9.09,139.9,sao paulo,sao paulo,2018-03-26,2018-03-15 22:05:41,03/07/2018 19:42:25,2018-03-06 15:00:24,delivered,2018-03-06 14:21:57,sao paulo,SP,9.0,,0,-11.0
itu,SP,400,20,30,11,3.0,telefonia_fixa,5,,39.41,2,credit_card,1,29.07,139.9,sao paulo,sao paulo,2017-07-12,2017-07-03 16:05:05,06/21/2017 08:11:54,2017-06-21 02:26:00,delivered,2017-06-20 13:08:17,sao bento do sul,SC,13.0,,0,-9.0
serra negra,SP,283,18,12,13,1.0,relogios_presentes,1,,148.64,6,credit_card,1,18.28,56.8,sao paulo,sao paulo,2017-08-15,2017-08-14 14:25:40,08/07/2017 19:39:55,2017-08-03 03:06:30,delivered,2017-08-02 15:36:19,nova iguacu,RJ,11.0,,0,-1.0
sao jose do rio preto,SP,850,16,14,11,1.0,perfumaria,5,,64.0,4,credit_card,1,17.1,190.9,sao paulo,sao paulo,2018-05-15,2018-05-03 19:58:28,04/30/2018 13:41:00,2018-04-28 22:15:14,delivered,2018-04-28 22:02:50,indaiatuba,SP,4.0,,0,-12.0
sao caetano do sul,SP,1200,40,10,37,1.0,cama_mesa_banho,4,,151.09,3,credit_card,1,25.65,89.0,sao paulo,sao paulo,2017-11-09,2017-10-27 21:12:51,10/16/2017 22:06:43,2017-10-12 20:36:27,delivered,2017-10-12 20:26:33,rio grande,RS,15.0,,0,-13.0
sao paulo,SP,350,44,17,30,4.0,automotivo,5,,93.91,1,boleto,1,38.46,129.9,sao paulo,sao paulo,2018-01-05,2018-01-20 01:36:58,12/12/2017 13:09:44,2017-12-11 11:58:24,delivered,2017-12-11 11:50:54,caxias do sul,RS,39.0,,0,15.0
sao paulo,SP,200,16,15,15,1.0,automotivo,5,,71.14,2,credit_card,1,27.96,139.9,sao paulo,sao paulo,2017-12-05,2017-11-29 17:58:43,11/27/2017 18:34:31,2017-11-18 19:06:16,delivered,2017-11-18 14:33:04,boituva,SP,11.0,,0,-6.0
piracicaba,SP,150,16,4,11,2.0,telefonia,5,,188.06,3,credit_card,1,20.17,132.9,são paulo,são paulo,2017-07-27,2017-07-25 19:42:50,07/06/2017 16:48:47,2017-07-05 17:41:46,delivered,2017-07-05 08:49:56,teresopolis,RJ,20.0,,0,-2.0
jaguariuna,SP,250,42,2,30,1.0,informatica_acessorios,5,,257.21,2,credit_card,1,85.59,359.98,sao paulo,sao paulo,2018-07-05,2018-06-19 18:50:58,06/11/2018 09:07:00,2018-05-23 14:37:15,delivered,2018-05-23 14:21:17,pinhalzinho,SP,27.0,,0,-16.0
sao paulo,SP,2240,76,10,14,1.0,malas_acessorios,5,Muito bom o produto ,692.94,4,credit_card,1,85.59,359.98,sao paulo,sao paulo,2018-01-11,2018-01-12 22:04:29,12/18/2017 17:16:58,2017-12-16 15:49:52,delivered,2017-12-16 15:29:46,petrolina,PE,27.0,,0,1.0
bauru,SP,213,21,2,14,1.0,livros_tecnicos,1,,181.1,8,credit_card,1,57.94,209.99,sao paulo,sao paulo,2018-05-07,2018-04-20 17:28:56,04/16/2018 16:23:53,2018-04-12 15:15:27,delivered,2018-04-12 14:37:29,sao paulo,SP,8.0,,0,-17.0
sao jose do rio preto,SP,1150,30,30,30,4.0,brinquedos,5,,202.26,1,boleto,1,15.39,154.9,sao paulo,sao paulo,2018-08-16,2018-08-03 20:38:29,07/30/2018 14:08:00,2018-07-28 18:35:13,delivered,2018-07-27 11:58:46,natal,RN,7.0,,1,-13.0
sao caetano do sul,SP,8850,16,10,16,1.0,cama_mesa_banho,5,,164.15,3,credit_card,1,12.97,44.0,sao paulo,sao paulo,2018-02-21,2018-02-05 19:17:15,01/29/2018 21:52:38,2018-01-28 12:00:34,delivered,2018-01-28 11:47:10,diadema,SP,8.0,,0,-16.0
jaragua do sul,SC,3000,69,11,11,2.0,moveis_decoracao,5,,137.13,10,credit_card,1,14.49,195.0,sao paulo,sao paulo,2017-09-25,2017-09-14 15:43:52,09/01/2017 15:37:07,2017-09-01 02:15:13,delivered,2017-08-31 07:27:54,curitiba,PR,14.0,,0,-11.0
sao paulo,SP,10900,71,25,45,3.0,utilidades_domesticas,4,,2.01,1,credit_card,1,16.94,97.9,sao paulo,sao paulo,2018-03-15,2018-03-06 23:49:06,02/27/2018 20:13:18,2018-02-27 05:31:00,delivered,2018-02-23 13:12:12,sao paulo,SP,11.0,,3,-9.0
sao paulo,SP,300,37,20,20,1.0,brinquedos,5,ótimo,272.58,1,boleto,1,35.67,49.9,sao paulo,sao paulo,2017-12-28,2017-12-14 16:32:01,12/12/2017 13:14:28,2017-12-11 07:58:24,delivered,2017-12-11 07:50:11,santo andre,SP,3.0,,0,-14.0
colombo,PR,600,17,17,17,1.0,moveis_decoracao,5,,87.36,4,credit_card,1,16.96,579.99,sao paulo,sao paulo,2018-01-16,2018-01-03 23:13:15,12/19/2017 01:35:09,2017-12-18 00:33:04,delivered,2017-12-15 23:33:32,sao paulo,SP,18.0,,2,-13.0
blumenau,SC,415,23,19,18,1.0,fashion_bolsas_e_acessorios,5,,16.54,1,voucher,5,12.76,59.99,sao paulo,sao paulo,2017-10-04,2017-09-19 18:57:33,09/18/2017 22:19:46,2017-09-17 19:05:22,delivered,2017-09-17 18:52:44,suzano,SP,2.0,,0,-15.0
juiz de fora,SP,400,30,10,20,1.0,brinquedos,5,,234.19,4,credit_card,1,21.71,399.9,sao paulo,sao paulo,2018-04-20,2018-04-07 00:21:58,04/03/2018 12:57:22,2018-03-31 12:35:11,delivered,2018-03-31 11:48:59,santa cruz do rio pardo,SP,6.0,,0,-13.0
sao paulo,SP,8150,50,20,40,3.0,cama_mesa_banho,5,10,86.37,1,boleto,1,15.1,42.9,sao paulo,sao paulo,2017-06-02,2017-05-23 07:52:33,05/16/2017 12:05:28,2017-05-16 03:22:50,delivered,2017-05-14 09:36:36,barreiras,BA,8.0,,1,-10.0
bom jardim,RJ,5250,66,15,33,4.0,moveis_decoracao,5,,33.0,1,boleto,1,58.91,320.0,sao paulo,sao paulo,2018-06-01,2018-05-18 15:56:43,05/11/2018 07:23:00,2018-05-10 18:17:57,delivered,2018-05-10 17:48:41,mogi-guacu,SP,7.0,,0,-14.0
serra redonda,PB,700,20,15,20,1.0,consoles_games,3,,10.89,1,credit_card,1,28.5,159.9,sao paulo,sao paulo,2018-07-24,2018-06-28 21:46:43,06/25/2018 13:59:00,2018-06-24 17:18:18,delivered,2018-06-24 13:38:07,sao paulo,SP,4.0,,0,-26.0
ibitinga,SP,650,34,15,15,1.0,informatica_acessorios,5,,84.14,4,credit_card,1,29.34,133.9,sao paulo,sao paulo,2018-08-08,2018-07-31 17:08:30,07/25/2018 13:35:00,2018-07-25 07:50:10,delivered,2018-07-25 07:39:35,florianopolis,SC,6.0,,0,-8.0
curitiba,PR,200,41,2,29,2.0,informatica_acessorios,2,produto incorreto,43.28,1,boleto,1,15.13,148.0,são paulo,são paulo,2018-03-15,2018-02-24 15:28:49,02/21/2018 10:07:44,2018-02-12 17:47:58,delivered,2018-02-12 17:33:54,januaria,MG,11.0,,0,-19.0
sao paulo,SP,1000,35,28,16,3.0,cool_stuff,1,,47.95,1,credit_card,1,8.72,56.99,sao paulo,sao paulo,2017-05-30,2017-05-19 16:59:52,05/08/2017 15:29:18,2017-05-06 11:30:19,delivered,2017-05-06 11:20:18,ipiabas,RJ,13.0,,0,-11.0
sao paulo,SP,1500,60,20,29,4.0,papelaria,4,,76.08,1,boleto,1,7.39,47.65,sao paulo,sao paulo,2017-09-05,,,2017-08-17 00:15:18,unavailable,2017-08-14 17:38:02,firminopolis,GO,,,2,
sao francisco do sul,SC,253,20,10,18,1.0,telefonia,1,,104.37,1,boleto,1,8.0,93.0,sao paulo,sao paulo,2017-12-22,2017-12-19 14:36:15,12/07/2017 19:37:27,2017-11-30 11:13:21,delivered,2017-11-30 11:05:02,joinville,SC,19.0,,0,-3.0
guarulhos,SP,800,29,10,25,4.0,papelaria,5,,69.61,1,credit_card,1,18.53,349.99,sao paulo,sao paulo,2017-03-13,2017-02-21 15:36:07,02/14/2017 10:21:06,2017-02-10 16:50:17,delivered,2017-02-10 16:37:55,rio de janeiro,RJ,10.0,,0,-20.0
vila velha,ES,7350,24,69,53,4.0,automotivo,3,,121.09,3,credit_card,1,7.79,75.9,sao paulo,sao paulo,2018-03-12,2018-02-28 23:53:38,02/19/2018 20:09:33,2018-02-19 01:47:38,delivered,2018-02-19 00:38:22,barueri,SP,9.0,,0,-12.0
presidente prudente,SP,4400,27,27,37,1.0,moveis_cozinha_area_de_servico_jantar_e_jardim,5,,238.65,7,credit_card,1,24.05,109.9,sao paulo,sao paulo,2018-08-30,2018-08-28 16:12:10,08/27/2018 17:58:00,2018-08-24 10:10:20,delivered,2018-08-24 09:55:31,mococa,SP,4.0,,0,-2.0
betim,MG,1200,30,16,20,1.0,brinquedos,1,,181.59,4,credit_card,1,13.72,99.99,sao paulo,sao paulo,2018-08-20,2018-08-07 20:28:32,07/23/2018 10:04:00,2018-07-20 11:46:15,delivered,2018-07-20 11:28:33,belo horizonte,MG,18.0,,0,-13.0
sao paulo,SP,1600,20,20,20,1.0,beleza_saude,2,,135.26,2,credit_card,1,19.32,35.0,sao paulo,sao paulo,2018-08-14,2018-07-31 11:02:27,07/24/2018 14:39:00,2018-07-23 14:31:04,delivered,2018-07-23 11:30:12,sao paulo,SP,7.0,,0,-14.0
sao paulo,SP,250,16,15,15,3.0,informatica_acessorios,5,otimo,51.09,3,credit_card,1,19.32,35.0,sao paulo,sao paulo,2017-12-15,2017-12-05 01:27:40,11/30/2017 12:25:45,2017-11-26 13:35:21,delivered,2017-11-26 13:24:33,rio de janeiro,RJ,8.0,,0,-10.0
sao paulo,SP,150,19,3,11,1.0,telefonia,5,,1783.44,3,credit_card,1,18.0,249.99,sao paulo,sao paulo,2017-12-01,2017-11-23 16:39:05,11/22/2017 17:08:54,2017-11-19 20:15:27,delivered,2017-11-19 20:06:12,vitoria,PR,3.0,,0,-8.0
curitiba,PR,200,16,2,11,,,4,,145.01,3,credit_card,1,15.81,152.0,sao paulo,sao paulo,2018-07-16,2018-06-18 18:24:40,06/04/2018 10:11:00,2018-06-03 10:49:57,delivered,2018-06-03 09:59:42,vitoria,ES,15.0,,0,-28.0
ribeirao pires,SP,775,35,9,15,3.0,market_place,5,,231.27,10,credit_card,1,27.51,79.9,sao paulo,sao paulo,2017-12-04,2017-11-24 18:03:13,11/16/2017 18:41:59,2017-11-13 16:56:00,delivered,2017-11-13 16:23:17,valenca,RJ,11.0,,0,-10.0
curitiba,PR,300,20,7,20,1.0,brinquedos,1,,70.03,1,boleto,1,29.23,138.0,sao paulo,sao paulo,2017-12-29,2017-12-08 00:52:11,12/04/2017 22:10:28,2017-12-01 11:31:09,delivered,2017-11-30 15:27:05,sao miguel do oeste,SC,7.0,,0,-21.0
imbituva,PR,150,20,10,20,1.0,beleza_saude,4,,1432.92,10,credit_card,1,15.11,51.0,sao paulo,sao paulo,2016-11-29,2016-10-13 15:44:27,10/10/2016 15:44:27,2016-10-06 15:44:26,delivered,2016-10-05 15:08:00,nova iguacu,RJ,8.0,,1,-47.0
guaratuba,PR,950,45,12,30,,,2,,45.24,1,voucher,1,25.62,738.9,sao paulo,sao paulo,2017-06-05,2017-05-28 12:22:32,05/24/2017 17:26:49,2017-05-23 20:35:07,delivered,2017-05-23 20:19:03,franca,SP,4.0,,0,-8.0
porto alegre,SP,4000,52,6,52,2.0,moveis_decoracao,5,,50.0,1,voucher,2,8.88,69.9,sao paulo,sao paulo,2018-07-31,2018-07-06 14:23:14,06/26/2018 09:18:00,2018-06-22 13:58:17,delivered,2018-06-22 13:43:19,salvador,BA,14.0,,0,-25.0
sao paulo,SP,500,20,6,15,1.0,esporte_lazer,5,,64.01,1,credit_card,1,24.5,579.0,sao paulo,sao paulo,2017-12-22,2018-01-20 15:26:28,11/27/2017 20:23:03,2017-11-23 22:37:27,delivered,2017-11-23 22:27:55,goiania,GO,57.0,,0,29.0
teresina,PI,100,16,6,11,1.0,esporte_lazer,5,,148.18,6,credit_card,1,24.5,579.0,sao paulo,sao paulo,2018-02-22,2018-02-01 19:18:05,01/29/2018 15:27:34,2018-01-26 18:52:02,delivered,2018-01-26 18:30:17,sao paulo,SP,6.0,,0,-21.0
sao paulo,SP,200,24,2,17,3.0,automotivo,3,,171.53,1,credit_card,1,24.5,579.0,sao paulo,sao paulo,2018-05-18,2018-05-06 16:42:23,04/25/2018 15:08:00,2018-04-24 17:43:45,delivered,2018-04-24 13:35:49,rio de janeiro,RJ,12.0,,0,-12.0
porto alegre,RS,800,68,8,13,2.0,moveis_decoracao,5,,86.15,3,credit_card,1,38.83,79.9,sao paulo,sao paulo,2018-01-17,2018-01-09 13:53:45,12/19/2017 21:27:44,2017-12-19 09:58:26,delivered,2017-12-15 21:32:23,sao bernardo do campo,SP,24.0,,3,-8.0
franca,SP,300,20,10,15,1.0,esporte_lazer,5,,22.79,1,debit_card,1,58.11,139.99,são paulo,são paulo,2018-09-05,2018-08-09 15:09:10,08/06/2018 13:27:00,2018-08-03 16:45:15,delivered,2018-08-03 16:29:05,mogi-guacu,SP,5.0,,0,-27.0
sao miguel d'oeste,SC,2000,28,8,15,1.0,esporte_lazer,4,,58.16,2,credit_card,1,57.31,149.94,são paulo,são paulo,2018-01-02,2017-12-28 21:58:42,12/04/2017 18:32:49,2017-12-01 21:55:18,delivered,2017-12-01 21:39:03,sao paulo,SP,27.0,,0,-5.0
boituva,SP,300,16,7,11,5.0,telefonia,4,,149.42,1,boleto,1,14.35,299.99,sao paulo,sao paulo,2018-07-18,2018-06-26 17:07:43,06/22/2018 12:25:00,2018-06-21 11:01:15,delivered,2018-06-21 10:46:55,indaiatuba,SP,5.0,,0,-22.0
atibaia,SP,1900,30,6,30,1.0,livros_tecnicos,4,,44.53,1,credit_card,1,8.44,168.8,sao paulo,sao paulo,2018-08-16,2018-08-04 10:31:38,08/01/2018 17:45:00,2018-07-24 11:32:16,delivered,2018-07-22 23:18:54,sao paulo,SP,12.0,,1,-12.0
sao jose dos campos,SP,783,16,8,15,2.0,musica,5,,152.82,2,credit_card,1,7.71,12.9,sao paulo,sao paulo,2017-09-25,2017-09-19 15:35:03,09/09/2017 13:23:11,2017-09-06 11:03:50,delivered,2017-09-05 10:54:17,sao paulo,SP,14.0,,1,-6.0
sao roque,SP,775,21,18,26,1.0,informatica_acessorios,1,,82.92,8,credit_card,1,13.69,199.9,sao paulo,sao paulo,2018-08-23,2018-09-01 18:14:42,08/31/2018 15:25:00,2018-08-15 03:15:15,delivered,2018-08-14 14:49:15,atibaia,SP,18.0,,0,9.0
california,PR,1400,25,35,35,1.0,utilidades_domesticas,4,,66.69,1,boleto,1,20.54,187.2,sao paulo,sao paulo,2018-08-24,2018-08-18 12:08:54,08/08/2018 14:46:00,2018-08-08 01:35:09,delivered,2018-08-08 01:23:58,montes claros,MG,10.0,,0,-6.0
sao paulo,SP,600,28,18,17,1.0,utilidades_domesticas,5,Gostei,52.75,1,boleto,1,15.1,34.99,sao paulo,sao paulo,2018-08-13,2018-08-03 14:43:03,07/19/2018 14:03:00,2018-07-18 18:55:28,delivered,2018-07-18 18:42:47,brasilia,DF,15.0,,0,-10.0
araraquara,SP,200,30,30,30,3.0,fashion_underwear_e_moda_praia,5,,105.94,5,credit_card,1,15.1,42.9,sao paulo,sao paulo,2017-02-16,2017-01-30 12:37:55,01/23/2017 11:21:46,2017-01-22 14:30:43,delivered,2017-01-22 14:09:03,ponta grossa,PR,7.0,,0,-17.0
guarulhos,SP,1000,29,19,21,2.0,utilidades_domesticas,5,,413.31,8,credit_card,1,9.36,69.99,sao paulo,sao paulo,2018-05-07,2018-04-17 19:38:22,04/09/2018 20:03:09,2018-04-08 13:30:24,delivered,2018-04-08 13:20:21,pirassununga,SP,9.0,,0,-20.0
tupa,SP,1100,25,22,21,1.0,utilidades_domesticas,4,,112.09,3,credit_card,1,9.36,69.99,sao paulo,sao paulo,2018-04-05,,03/19/2018 20:28:42,2018-03-15 16:11:07,shipped,2018-03-15 15:57:24,piracicaba,SP,,,0,
sao paulo,SP,100,29,7,16,6.0,fashion_calcados,5,Pedaleira plataforma,186.36,4,credit_card,1,15.37,39.0,são paulo,são paulo,2018-02-21,2018-02-14 21:43:34,01/31/2018 13:12:45,2018-01-29 21:32:17,delivered,2018-01-29 21:09:10,jales,SP,16.0,,0,-7.0
japira,PR,400,19,11,19,1.0,instrumentos_musicais,5,,165.22,3,credit_card,1,12.72,109.9,são paulo,são paulo,2017-07-10,2017-07-04 13:59:41,06/29/2017 13:41:57,2017-06-28 02:45:12,delivered,2017-06-27 17:58:14,sao joao de meriti,RJ,6.0,,0,-6.0
rio de janeiro,RJ,250,20,5,16,2.0,utilidades_domesticas,4,,49.02,3,credit_card,1,8.27,12.88,são paulo,são paulo,2018-05-21,2018-05-07 14:57:45,05/04/2018 14:02:00,2018-05-03 22:13:10,delivered,2018-05-02 22:17:41,recife,PE,4.0,,0,-14.0
brasilia,DF,1050,38,41,39,1.0,agro_industria_e_comercio,4,,173.68,1,debit_card,1,17.38,309.9,sao paulo,sao paulo,2018-04-27,2018-04-11 01:19:34,04/02/2018 21:28:36,2018-03-30 21:27:23,delivered,2018-03-30 20:27:16,sao paulo,SP,11.0,,0,-16.0
santo andre,SP,200,16,2,11,,,5,,205.07,2,credit_card,1,16.6,39.0,sao paulo,sao paulo,2018-04-03,2018-04-09 22:08:51,03/13/2018 23:02:56,2018-03-12 18:00:56,delivered,2018-03-12 16:54:01,sao vicente,SP,28.0,,0,6.0
foz do iguacu,PR,300,30,26,22,3.0,fashion_bolsas_e_acessorios,5,,21.04,1,credit_card,1,18.7,84.99,sao paulo,sao paulo,2018-03-07,2018-02-26 21:28:51,02/24/2018 00:24:55,2018-02-21 18:55:31,delivered,2018-02-21 18:47:50,rio formoso,PE,5.0,,0,-9.0
taubate,SP,2450,23,7,23,4.0,brinquedos,4,,132.68,2,credit_card,1,34.69,465.0,sao paulo,sao paulo,2018-07-19,2018-06-26 18:58:22,06/21/2018 09:14:00,2018-06-20 17:01:07,delivered,2018-06-20 16:44:28,belo horizonte,MG,6.0,,0,-23.0
sao bernardo do campo,SP,400,25,10,17,1.0,papelaria,5,,36.09,1,credit_card,1,8.74,139.77,são paulo,são paulo,2018-05-17,2018-05-11 01:48:54,05/09/2018 14:18:00,2018-05-07 18:09:48,delivered,2018-05-07 15:38:06,rio de janeiro,RJ,3.0,,0,-6.0
limeira,SP,2200,34,8,22,1.0,moveis_decoracao,5,,66.44,1,boleto,1,13.03,84.9,sao paulo,sao paulo,2017-10-05,2017-09-26 16:48:01,09/01/2017 21:22:28,2017-09-01 02:30:13,delivered,2017-08-31 11:38:18,sao paulo,SP,26.0,,0,-9.0
sumare,SP,500,20,12,15,1.0,perfumaria,3,PRODUTO COM DEFEITO,161.62,1,boleto,1,13.03,84.9,sao paulo,sao paulo,2017-08-02,2017-06-29 11:06:37,06/19/2017 11:15:51,2017-06-16 23:30:10,delivered,2017-06-16 23:17:41,rio de janeiro,RJ,12.0,,0,-34.0
sao paulo,SP,1700,34,10,34,2.0,cama_mesa_banho,5,Regular ,27.75,1,credit_card,1,19.74,109.99,sao paulo,sao paulo,2017-05-31,2017-05-19 12:57:35,05/08/2017 11:44:57,2017-05-07 14:05:12,delivered,2017-05-07 13:53:39,brasilia,DF,11.0,,0,-12.0
itaquaquecetuba,SP,325,25,10,13,1.0,beleza_saude,5,,91.28,1,credit_card,1,44.97,150.0,sao paulo,sao paulo,2018-08-03,2018-08-14 04:04:40,07/18/2018 13:08:00,2018-07-17 21:35:17,delivered,2018-07-17 21:25:29,angra dos reis,RJ,27.0,,0,11.0
nova friburgo,RJ,150,18,7,14,1.0,esporte_lazer,5,,81.93,1,voucher,2,16.17,49.99,sao paulo,sao paulo,2018-08-09,2018-08-06 13:28:35,08/03/2018 11:51:00,2018-08-02 13:15:22,delivered,2018-08-02 12:25:18,vitoria,ES,4.0,,0,-3.0
rio de janeiro,RJ,200,22,3,11,2.0,perfumaria,3,,167.92,2,credit_card,1,10.68,59.0,são paulo,são paulo,2017-03-24,2017-03-21 11:43:57,03/02/2017 16:34:26,2017-02-26 17:45:14,delivered,2017-02-26 17:33:51,brasilia,DF,22.0,,0,-3.0
sao paulo,SP,6250,55,14,44,4.0,construcao_ferramentas_construcao,5,,61.36,1,credit_card,1,17.66,59.0,sao paulo,sao paulo,2017-11-16,2017-11-03 20:23:02,10/25/2017 17:07:36,2017-10-24 09:28:10,delivered,2017-10-24 09:13:05,sao paulo,SP,10.0,,0,-13.0
sao paulo,SP,950,40,6,35,2.0,fashion_roupa_masculina,5,,60.0,2,credit_card,1,21.19,99.9,são paulo,são paulo,2018-05-10,2018-04-25 13:33:24,04/10/2018 22:41:36,2018-04-09 23:10:27,delivered,2018-04-09 22:02:30,alfredo chaves,ES,15.0,,0,-15.0
belo horizonte,MG,200,32,8,26,2.0,automotivo,4,,39.01,3,credit_card,1,15.41,79.9,sao paulo,sao paulo,2018-06-11,2018-05-28 17:24:48,05/25/2018 14:53:00,2018-05-24 18:54:28,delivered,2018-05-24 18:32:11,vitoria,ES,3.0,,0,-14.0
itau de minas,MG,6200,35,15,25,1.0,cama_mesa_banho,4,,39.78,3,credit_card,1,24.86,104.9,sao paulo,sao paulo,2018-06-08,2018-06-07 15:58:37,05/17/2018 13:07:00,2018-05-16 12:39:38,delivered,2018-05-16 12:22:12,rio de janeiro,RJ,22.0,,0,-1.0
sao paulo,SP,1650,33,44,19,1.0,cool_stuff,4,Bom,64.23,2,credit_card,1,18.28,68.9,sao paulo,sao paulo,2017-11-29,2017-11-17 13:49:40,11/16/2017 20:56:53,2017-11-16 14:08:23,delivered,2017-11-16 13:54:08,sao paulo,SP,0.0,,0,-12.0
juiz de fora,MG,200,22,14,14,,,3,,186.92,4,credit_card,1,15.52,110.0,sao paulo,sao paulo,2017-06-30,2017-06-13 16:48:22,06/05/2017 14:45:29,2017-06-05 08:55:16,delivered,2017-06-05 08:45:30,sao jose dos campos,SP,8.0,,0,-17.0
florianopolis,SC,3350,20,21,20,1.0,alimentos,3,,43.29,2,credit_card,1,22.98,25.89,sao paulo,sao paulo,2018-02-06,,,2018-01-09 07:26:08,unavailable,2018-01-08 19:39:03,itapetinga,BA,,,0,
sao paulo,SP,150,16,16,15,1.0,perfumaria,5,,59.13,1,credit_card,1,15.1,39.9,sao paulo,sao paulo,2018-02-07,2018-02-06 22:33:04,01/15/2018 16:58:55,2018-01-12 02:35:45,delivered,2018-01-11 12:20:07,sao paulo,SP,26.0,,0,-1.0
birigui,SP,2900,83,82,12,1.0,pet_shop,1,,33.51,3,credit_card,1,11.87,52.9,sao paulo,sao paulo,2018-05-22,2018-04-27 11:58:45,04/17/2018 18:48:53,2018-04-13 13:15:45,delivered,2018-04-13 12:10:45,gurupi,TO,13.0,,0,-25.0
oliveira,MG,1550,23,17,18,1.0,artigos_de_festas,5,Entrega antes do prazo.,33.1,1,debit_card,1,12.79,29.99,sao paulo,sao paulo,2018-05-04,2018-04-26 15:03:49,04/10/2018 22:48:53,2018-04-06 19:30:14,delivered,2018-04-06 19:17:22,belo horizonte,MG,19.0,,0,-8.0
sabara,MG,5750,30,19,31,1.0,automotivo,5,,148.06,1,voucher,1,12.69,46.55,sao paulo,sao paulo,2017-12-20,,,2017-11-24 23:15:15,processing,2017-11-24 20:09:33,cambe,PR,,,0,
pedrinhas paulista,SP,200,18,9,13,1.0,automotivo,1,,189.56,2,credit_card,1,21.66,629.9,sao paulo,sao paulo,2018-07-18,2018-07-05 15:18:47,06/28/2018 14:08:00,2018-06-27 12:08:25,delivered,2018-06-27 11:57:05,jaboatao dos guararapes,PE,8.0,,0,-13.0
sao bernardo do campo,SP,350,25,10,20,3.0,automotivo,5,,105.38,5,credit_card,1,41.92,120.9,sao paulo,sao paulo,2017-11-10,2017-10-26 18:30:45,10/19/2017 19:25:50,2017-10-18 16:07:43,delivered,2017-10-18 15:53:45,sao paulo,SP,8.0,,0,-15.0
belo horizonte,MG,100,16,5,16,1.0,papelaria,1,,69.06,1,boleto,1,25.61,109.9,são paulo,são paulo,2017-12-21,2017-11-29 22:48:59,11/17/2017 19:06:55,2017-11-16 17:16:09,delivered,2017-11-16 17:01:14,nucleo residencial pilar,BA,13.0,,0,-22.0
sao paulo,SP,700,16,30,20,1.0,malas_acessorios,3,,85.24,1,voucher,1,14.52,44.6,sao paulo,sao paulo,2018-04-10,2018-04-06 02:02:43,03/22/2018 20:02:51,2018-03-21 15:48:35,delivered,2018-03-21 15:30:57,santos,SP,15.0,,0,-4.0
votuporanga,SP,233,18,16,14,1.0,beleza_saude,1,,179.46,5,credit_card,1,33.59,192.97,sao paulo,sao paulo,2017-06-07,2017-05-29 16:52:10,05/26/2017 13:04:02,2017-05-25 14:02:20,delivered,2017-05-25 13:50:11,salvador,BA,4.0,,0,-9.0
presidente prudente,SP,100,25,20,20,1.0,esporte_lazer,4,,168.35,1,credit_card,1,33.59,192.97,sao paulo,sao paulo,2017-12-22,2017-12-09 17:42:09,12/01/2017 19:27:09,2017-11-28 01:31:28,delivered,2017-11-28 00:34:46,coromandel,MG,11.0,,0,-13.0
holambra,SP,1800,25,25,25,,,1,,100.0,1,voucher,2,33.59,192.97,sao paulo,sao paulo,2017-09-06,2017-08-23 16:24:07,08/07/2017 19:12:28,2017-08-05 14:55:13,delivered,2017-08-05 14:39:14,charqueada,SP,18.0,,0,-14.0
mogi das cruzes,SP,10700,40,100,16,3.0,malas_acessorios,1,,77.89,1,credit_card,1,9.41,59.9,sao paulo,sao paulo,2017-09-01,2017-08-25 21:12:14,08/22/2017 13:40:08,2017-08-20 11:25:05,delivered,2017-08-20 11:07:39,osasco,SP,5.0,,0,-7.0
ararangua,SC,750,50,5,40,5.0,bebes,5,,99.43,1,credit_card,1,9.41,59.9,são paulo,são paulo,2018-07-31,2018-07-25 14:02:27,07/16/2018 13:45:00,2018-07-13 14:50:13,delivered,2018-07-13 13:42:50,itau de minas,MG,12.0,,0,-6.0
pinhais,PR,300,27,5,18,,,4,,407.9,1,credit_card,1,9.94,57.49,sao paulo,sao paulo,2018-01-05,2017-12-28 22:19:10,12/07/2017 12:34:07,2017-12-06 02:35:35,delivered,2017-12-05 15:24:25,sao paulo,SP,23.0,,0,-8.0
sao paulo,SP,250,18,19,15,2.0,automotivo,5,,15.0,1,voucher,3,18.36,158.0,sao paulo,sao paulo,2017-06-02,2017-05-19 16:36:08,05/16/2017 17:24:45,2017-05-06 13:02:28,delivered,2017-05-06 12:28:42,ibiruba,RS,13.0,,0,-14.0
sao caetano do sul,SP,461,18,10,14,5.0,esporte_lazer,4,,424.04,2,credit_card,1,12.69,39.9,sao paulo,sao paulo,2018-05-09,2018-05-09 15:08:44,04/13/2018 23:12:37,2018-04-13 12:55:48,delivered,2018-04-12 14:05:08,bertioga,SP,27.0,,0,0.0
sao paulo,SP,4000,65,25,25,1.0,automotivo,5,,157.2,3,credit_card,1,19.41,101.99,sao paulo,sao paulo,2017-05-08,2017-05-10 12:48:08,04/18/2017 14:51:36,2017-04-15 22:15:10,delivered,2017-04-15 22:00:21,brasilia,DF,24.0,,0,2.0
sao paulo,SP,1250,16,10,16,1.0,cama_mesa_banho,4,,162.03,4,credit_card,1,11.15,25.0,sao paulo,sao paulo,2018-01-11,2018-01-31 19:08:40,01/12/2018 00:35:33,2017-12-09 02:36:21,delivered,2017-12-08 11:38:00,contagem,MG,54.0,,0,20.0
londrina,PR,543,30,12,16,2.0,beleza_saude,5,super recomendo,188.5,8,credit_card,1,15.1,21.99,sao paulo,sao paulo,2017-05-11,2017-04-18 14:29:48,04/10/2017 15:57:03,2017-03-29 23:25:13,delivered,2017-03-29 23:16:20,ipiau,BA,19.0,,0,-23.0
sao paulo,SP,1000,28,13,13,6.0,alimentos_bebidas,5,,65.47,1,credit_card,1,15.1,21.99,sao paulo,sao paulo,2017-11-17,2017-11-23 21:48:41,11/20/2017 21:15:00,2017-10-24 17:56:20,delivered,2017-10-24 17:39:10,limeira,SP,30.0,,0,6.0
ribeirao preto,SP,9050,56,11,32,6.0,automotivo,5,,39.42,1,credit_card,1,25.66,359.0,sao paulo,sao paulo,2018-04-11,2018-03-28 18:21:15,03/26/2018 23:22:37,2018-03-23 16:50:56,delivered,2018-03-23 16:39:38,sao paulo,SP,5.0,,0,-14.0
ribeirao preto,SP,1550,32,8,29,1.0,cama_mesa_banho,5,,365.32,5,credit_card,1,14.85,157.77,sao paulo,sao paulo,2017-06-19,2017-06-07 17:40:04,06/06/2017 10:34:33,2017-06-05 11:55:15,delivered,2017-06-05 11:44:22,jau,SP,2.0,,0,-12.0
birigui,SP,300,20,20,20,1.0,esporte_lazer,1,,65.11,6,credit_card,1,12.13,89.9,são paulo,são paulo,2018-01-31,2018-01-16 18:43:16,01/05/2018 00:56:39,2017-12-28 20:08:04,delivered,2017-12-28 18:40:56,matozinhos,MG,19.0,,0,-15.0
sao paulo,SP,200,16,2,11,,,1,,188.34,10,credit_card,1,12.13,89.9,sao paulo,sao paulo,2018-02-19,2018-01-31 22:57:06,01/29/2018 19:08:49,2018-01-26 16:19:16,delivered,2018-01-26 15:52:15,volta redonda,RJ,5.0,,0,-19.0
goiania,GO,500,30,14,16,4.0,beleza_saude,3,,35.4,1,boleto,1,56.93,53.9,sao paulo,sao paulo,2018-04-23,2018-04-23 14:57:48,04/09/2018 23:33:03,2018-03-24 12:08:19,delivered,2018-03-24 11:58:06,curitiba,PR,30.0,,0,0.0
sao paulo,SP,9900,61,31,31,2.0,utilidades_domesticas,5,,590.72,10,credit_card,1,16.79,15.9,sao paulo,sao paulo,2018-05-28,2018-05-17 22:54:50,05/15/2018 13:45:00,2018-05-14 16:36:58,delivered,2018-05-14 16:18:26,teresina,PI,3.0,,0,-11.0
nova iguacu,RJ,875,65,23,20,1.0,brinquedos,5,,36.75,1,boleto,1,12.99,339.99,sao paulo,sao paulo,2017-08-22,2017-08-11 14:40:06,08/09/2017 14:00:41,2017-08-02 13:30:13,delivered,2017-08-02 13:18:30,sao paulo,SP,9.0,,0,-11.0
guarulhos,SP,1100,40,10,30,1.0,cama_mesa_banho,1,,81.73,2,credit_card,1,18.23,13.47,sao paulo,sao paulo,2017-03-28,2017-03-17 12:42:09,03/09/2017 15:38:15,2017-03-07 11:55:18,delivered,2017-03-07 11:47:20,uberlandia,MG,10.0,,0,-11.0
porto alegre,RS,200,16,12,20,3.0,instrumentos_musicais,1,,17.86,1,credit_card,1,31.6,103.99,são paulo,são paulo,2017-06-28,2017-06-19 18:33:40,06/13/2017 14:38:41,2017-06-11 18:02:36,delivered,2017-06-10 18:02:25,belo horizonte,MG,9.0,,1,-9.0
sao paulo,SP,50,18,6,11,3.0,telefonia,5,,108.97,1,boleto,1,18.02,109.9,sao paulo,sao paulo,2018-03-27,2018-03-27 22:06:48,02/27/2018 22:51:38,2018-02-25 19:07:29,delivered,2018-02-25 18:53:53,entre rios,BA,30.0,,0,0.0
sao paulo,SP,750,21,10,14,5.0,eletronicos,5,,569.66,10,credit_card,1,35.74,59.9,são paulo,são paulo,2018-01-26,2018-01-18 21:42:54,01/13/2018 15:33:47,2018-01-11 23:10:26,delivered,2018-01-11 22:59:49,itajuba,MG,6.0,,0,-8.0
limeira,SP,530,18,24,18,4.0,consoles_games,4,,48.13,4,credit_card,1,15.1,17.9,sao paulo,sao paulo,2017-12-07,2017-11-17 18:58:42,11/10/2017 18:48:59,2017-11-09 17:08:27,delivered,2017-11-08 17:08:56,campinas,SP,9.0,,0,-20.0
rio de janeiro,RJ,400,40,15,40,1.0,moveis_decoracao,5,,63.1,2,credit_card,1,11.81,59.99,sao paulo,sao paulo,2017-11-13,2017-11-17 23:59:11,10/17/2017 17:07:58,2017-10-12 21:56:20,delivered,2017-10-12 21:46:31,jandira,SP,36.0,,0,4.0
pato bragado,PR,250,16,11,14,1.0,beleza_saude,3,Bom,39.42,1,boleto,1,17.44,239.99,sao paulo,sao paulo,2017-09-06,2017-08-14 20:37:25,08/07/2017 14:57:56,2017-08-03 10:50:24,delivered,2017-08-03 10:39:39,sao paulo,SP,11.0,,0,-23.0
carazinho,RS,2000,20,40,30,2.0,esporte_lazer,4,,74.03,1,boleto,1,16.94,70.9,sao paulo,sao paulo,2018-07-11,2018-06-25 16:34:43,06/19/2018 09:19:00,2018-06-14 02:17:48,delivered,2018-06-13 11:29:48,juina,MT,12.0,,0,-16.0
arinos,MG,2400,41,11,36,1.0,cama_mesa_banho,5,,66.78,1,boleto,1,17.8,78.9,sao paulo,sao paulo,2017-04-13,2017-03-29 11:45:41,03/27/2017 15:39:59,2017-03-26 01:05:12,delivered,2017-03-25 23:51:57,divinopolis,MG,3.0,,0,-15.0
sao pedro,SP,500,23,2,16,1.0,livros_tecnicos,5,muito bom,36.59,1,credit_card,1,18.23,35.89,sao paulo,sao paulo,2018-03-22,2018-03-14 16:04:34,03/12/2018 23:14:47,2018-03-07 10:29:08,delivered,2018-03-06 17:12:14,porto alegre,RS,7.0,,0,-8.0
lages,SC,99,22,3,16,1.0,telefonia_fixa,5,,272.64,5,credit_card,1,13.41,49.0,sao paulo,sao paulo,2018-08-06,2018-08-06 17:40:28,07/27/2018 11:54:00,2018-07-17 00:35:16,delivered,2018-07-16 23:40:37,mairipora,SP,20.0,,0,0.0
sao paulo,SP,1150,16,12,12,1.0,esporte_lazer,5,,64.34,1,credit_card,1,7.78,16.9,são paulo,são paulo,2017-08-14,2017-07-28 19:03:09,07/17/2017 10:27:56,2017-07-12 02:10:49,delivered,2017-07-10 20:58:17,rio de janeiro,RJ,17.0,,1,-17.0
maua,SP,175,30,20,25,1.0,cool_stuff,5,,49.05,1,boleto,1,26.04,274.95,sao paulo,sao paulo,2018-02-22,2018-03-02 22:15:36,02/01/2018 00:38:54,2018-01-29 13:30:16,delivered,2018-01-29 13:09:31,sao paulo,SP,32.0,,0,8.0
sao paulo,SP,217,17,13,15,1.0,beleza_saude,3,,163.69,7,credit_card,1,16.86,59.9,sao paulo,sao paulo,2017-11-09,2017-10-30 20:54:30,10/24/2017 19:16:53,2017-10-22 16:21:22,delivered,2017-10-22 16:11:06,teresina,PI,8.0,,0,-10.0
porto ferreira,SP,100,16,5,16,1.0,fashion_bolsas_e_acessorios,3,,443.85,6,credit_card,1,7.78,19.99,sao paulo,sao paulo,2018-07-16,2018-06-28 22:03:55,06/25/2018 12:09:00,2018-06-24 11:58:02,delivered,2018-06-24 11:32:26,marechal candido rondon,PR,4.0,,0,-18.0
carapicuiba,SP,700,20,20,20,2.0,perfumaria,5,,165.31,6,credit_card,1,17.87,89.0,sao paulo,sao paulo,2017-05-02,2017-05-05 14:56:03,03/30/2017 16:08:45,2017-03-27 14:15:21,delivered,2017-03-27 14:04:58,votorantim,SP,39.0,,0,3.0
ampere,PR,900,30,14,11,1.0,informatica_acessorios,5,,1180.51,10,credit_card,1,29.11,398.0,sao paulo,sao paulo,2017-11-09,2017-11-01 19:32:24,10/30/2017 18:45:26,2017-10-27 19:15:19,delivered,2017-10-27 19:00:02,sao bernardo do campo,SP,5.0,,0,-8.0
divinopolis,MG,200,27,10,12,1.0,moveis_decoracao,5,,706.84,1,credit_card,1,29.11,398.0,são paulo,são paulo,2018-08-07,2018-07-24 20:15:34,07/17/2018 13:07:00,2018-07-16 09:04:17,delivered,2018-07-16 08:52:35,sao paulo,SP,8.0,,0,-14.0
belo horizonte,MG,2800,95,7,33,1.0,automotivo,5,,20.0,1,voucher,2,38.3,106.9,sao paulo,sao paulo,2018-02-09,2018-01-31 18:58:36,01/15/2018 16:44:54,2018-01-11 18:49:22,delivered,2018-01-11 18:37:55,vitoria,ES,20.0,,0,-9.0
sao jose dos pinhais,PR,500,16,11,11,1.0,relogios_presentes,5,recomendo,135.97,1,credit_card,1,22.06,24.89,sao paulo,sao paulo,2018-01-15,2018-01-10 20:46:45,12/26/2017 17:47:00,2017-12-25 20:28:19,delivered,2017-12-25 20:14:34,franco da rocha,SP,16.0,,0,-5.0
sao paulo,SP,1150,19,22,19,1.0,utilidades_domesticas,3,,56.99,1,credit_card,1,8.64,44.9,são paulo,são paulo,2017-04-04,2017-03-20 07:23:36,03/06/2017 08:48:21,2017-03-05 22:55:40,delivered,2017-03-05 22:44:58,belo horizonte,MG,14.0,,0,-15.0
itauna,MG,300,30,20,40,2.0,esporte_lazer,5,,43.58,1,credit_card,1,17.06,89.0,sao paulo,sao paulo,2018-01-11,2017-12-27 10:19:26,12/19/2017 19:26:10,2017-12-17 11:32:26,delivered,2017-12-17 11:25:52,cotia,SP,9.0,,0,-15.0
guaruja,SP,200,30,40,30,1.0,utilidades_domesticas,5,,48.15,4,credit_card,1,17.06,89.0,são paulo,são paulo,2018-03-01,2018-02-21 21:26:15,02/08/2018 21:16:40,2018-01-13 19:30:09,delivered,2018-01-11 21:42:30,avare,SP,40.0,,1,-8.0
sao paulo,SP,2550,105,3,70,3.0,moveis_decoracao,5,,76.87,1,credit_card,1,25.24,60.0,sao paulo,sao paulo,2018-08-29,2018-08-20 21:05:18,08/15/2018 14:45:00,2018-08-14 16:30:18,delivered,2018-08-14 16:20:40,sao bernardo do campo,SP,6.0,,0,-9.0
florianopolis,SC,200,18,3,16,6.0,telefonia,5,,2.78,1,credit_card,1,2.27,36.23,sao paulo,sao paulo,2018-02-26,2018-02-07 17:27:46,01/30/2018 14:17:11,2018-01-27 02:52:27,delivered,2018-01-25 23:32:16,rio de janeiro,RJ,12.0,,1,-19.0
sao paulo,SP,10900,45,15,35,2.0,cama_mesa_banho,5,,123.59,2,credit_card,1,59.78,79.0,sao paulo,sao paulo,2018-02-14,2018-01-31 18:33:28,01/22/2018 21:25:00,2018-01-20 12:51:00,delivered,2018-01-19 09:51:37,aparecida de goiania,GO,12.0,,1,-14.0
porto alegre,RS,300,17,14,14,1.0,beleza_saude,4,,128.07,1,boleto,1,15.26,73.0,são paulo,são paulo,2018-06-28,2018-06-07 20:06:04,05/29/2018 07:15:00,2018-05-22 09:36:22,delivered,2018-05-21 12:21:48,icem,SP,17.0,,0,-21.0
mogi mirim,SP,450,20,31,30,4.0,brinquedos,5,,185.84,2,credit_card,1,12.72,109.9,sao paulo,sao paulo,2017-12-22,2017-12-20 17:22:29,11/29/2017 21:11:41,2017-11-28 10:40:55,delivered,2017-11-28 10:27:09,anapolis,GO,22.0,,0,-2.0
joinville,SC,584,16,11,13,3.0,relogios_presentes,3,,85.81,1,credit_card,1,14.1,18.9,sao paulo,sao paulo,2018-07-16,2018-06-27 18:28:25,06/18/2018 13:22:00,2018-06-16 20:18:50,delivered,2018-06-16 19:48:05,sao sebastiao,SP,10.0,,0,-19.0
curitibanos,SC,2700,20,30,30,1.0,cama_mesa_banho,5,,149.54,1,credit_card,1,46.39,329.9,são paulo,são paulo,2017-05-25,2017-05-16 08:57:50,05/05/2017 12:07:58,2017-04-30 18:45:15,delivered,2017-04-30 18:34:22,sao roque,SP,15.0,,0,-9.0
brasilia df,DF,4200,34,10,38,1.0,cama_mesa_banho,5,,32.38,1,credit_card,1,16.79,17.9,sao paulo,sao paulo,2017-03-16,2017-02-20 12:29:30,02/13/2017 14:00:21,2017-02-12 13:02:08,delivered,2017-02-12 12:30:04,serra,ES,7.0,,0,-24.0
tres coracoes,MG,300,20,20,20,1.0,brinquedos,5,,23.38,1,credit_card,1,14.62,75.0,sao paulo,sao paulo,2018-04-09,2018-03-23 18:42:48,02/28/2018 22:08:33,2018-02-28 10:50:10,delivered,2018-02-27 10:31:04,mirassol,SP,24.0,,1,-17.0
sao paulo,SP,1400,30,20,26,6.0,cama_mesa_banho,5,,98.86,1,credit_card,1,27.84,219.9,sao paulo,sao paulo,2017-04-07,2017-03-20 15:04:03,03/10/2017 13:52:01,2017-03-07 06:45:09,delivered,2017-03-07 06:35:43,taperuaba,CE,13.0,,0,-18.0
fortaleza,CE,600,23,18,20,2.0,telefonia,5,,124.21,8,credit_card,1,13.54,34.0,sao paulo,sao paulo,2018-03-06,2018-02-21 13:39:15,02/15/2018 18:33:21,2018-02-10 12:07:44,delivered,2018-02-10 11:48:42,montes claros,MG,11.0,,0,-13.0
sao paulo,SP,2250,34,52,30,1.0,cool_stuff,5,,191.58,6,credit_card,1,34.16,114.94,sao paulo,sao paulo,2018-07-11,2018-06-14 14:51:45,06/05/2018 15:02:00,2018-05-28 13:14:03,delivered,2018-05-28 12:53:12,sorocaba,SP,17.0,,0,-27.0
sao paulo,SP,4500,102,12,12,6.0,artigos_de_festas,5,,123.04,2,credit_card,1,18.23,13.65,sao paulo,sao paulo,2018-06-18,2018-05-19 11:18:41,05/14/2018 12:02:00,2018-05-14 11:58:12,delivered,2018-05-14 11:28:58,sao paulo,SP,4.0,,0,-30.0
sao jose dos campos,SP,500,20,20,20,6.0,pet_shop,4,,26.38,1,credit_card,1,15.21,52.0,sao paulo,sao paulo,2017-11-27,2017-11-29 19:11:53,11/27/2017 19:48:51,2017-11-14 04:06:46,delivered,2017-11-13 11:16:06,carapicuiba,SP,16.0,,0,2.0
mogi das cruses,SP,900,23,18,18,1.0,esporte_lazer,5,Otimo produtos,71.49,2,credit_card,1,43.98,229.9,são paulo,são paulo,2018-04-26,2018-04-17 19:24:33,04/16/2018 19:48:43,2018-04-13 12:55:32,delivered,2018-04-12 09:52:07,alfenas,MG,5.0,,1,-9.0
sao paulo,SP,450,16,11,12,4.0,relogios_presentes,5,,153.98,1,credit_card,1,18.91,147.2,sao paulo,sao paulo,2017-11-13,2017-11-08 21:33:01,11/06/2017 21:25:31,2017-10-25 19:07:39,delivered,2017-10-25 18:57:29,santo andre,SP,14.0,,0,-5.0
sao paulo,SP,700,18,12,18,1.0,casa_conforto,5,Luminária excelente,55.91,1,credit_card,1,16.23,75.0,sao paulo,sao paulo,2017-12-15,2017-12-01 21:38:57,11/22/2017 17:02:16,2017-11-22 02:40:02,delivered,2017-11-17 13:00:10,leopoldina,MG,14.0,,4,-14.0
campinas,SP,200,27,9,26,4.0,pet_shop,5,recomendo a todos.otima.,86.06,6,credit_card,1,12.69,48.9,sao paulo,sao paulo,2017-09-01,2017-08-21 17:58:06,08/15/2017 15:32:51,2017-08-14 22:05:27,delivered,2017-08-14 21:13:44,brasilia,DF,6.0,,0,-11.0
hortolandia,SP,600,20,20,20,3.0,brinquedos,5,,33.1,1,credit_card,1,17.77,151.99,sao paulo,sao paulo,2018-01-30,2017-12-28 16:37:08,12/26/2017 19:08:59,2017-12-23 02:12:41,delivered,2017-12-21 20:55:24,sao joao da boa vista,SP,6.0,,1,-33.0
sao paulo,SP,75,19,3,11,1.0,telefonia,5,chegou antes do prazo de ,360.29,10,credit_card,1,14.88,69.9,sao paulo,sao paulo,2017-04-03,2017-03-09 09:26:09,03/02/2017 12:58:42,2017-03-01 18:41:59,delivered,2017-03-01 18:29:06,sao paulo,SP,7.0,,0,-25.0
belo horizonte,MG,600,19,10,15,2.0,relogios_presentes,5,,105.24,10,credit_card,1,16.11,28.9,sao paulo,sao paulo,2018-08-27,2018-08-20 22:03:36,08/14/2018 18:00:00,2018-08-10 08:50:10,delivered,2018-08-10 08:35:14,sao paulo,SP,10.0,,0,-7.0
maringa,PR,750,30,11,20,3.0,esporte_lazer,5,,114.85,3,credit_card,1,23.63,149.9,sao paulo,sao paulo,2017-08-10,2017-07-27 19:04:48,07/21/2017 15:03:23,2017-07-21 02:50:48,delivered,2017-07-19 16:45:17,uba,MG,8.0,,1,-14.0
rio de janeiro,RJ,100,16,5,16,2.0,automotivo,1,,0.01,1,voucher,2,9.07,79.9,sao paulo,sao paulo,2018-08-08,2018-07-26 20:44:34,07/24/2018 19:00:00,2018-07-18 21:50:23,delivered,2018-07-18 21:37:46,parnamirim,RN,7.0,,0,-13.0
atibaia,SP,110,17,2,14,1.0,consoles_games,3,,65.57,1,credit_card,1,12.99,92.65,sao paulo,sao paulo,2017-02-16,2017-01-30 15:06:11,01/26/2017 05:47:32,2017-01-23 20:55:19,delivered,2017-01-22 16:10:09,guarulhos,SP,7.0,,1,-17.0
porto belo,SC,125,24,12,20,3.0,beleza_saude,5,,88.9,3,credit_card,1,12.99,92.65,são paulo,são paulo,2018-08-09,2018-07-28 00:40:52,07/24/2018 14:15:00,2018-07-23 13:20:17,delivered,2018-07-23 10:11:13,teixeira de freitas,BA,4.0,,0,-12.0
toledo,PR,300,17,4,12,5.0,telefonia,4,,76.78,1,credit_card,1,20.02,150.0,sao paulo,sao paulo,2018-09-05,2018-08-21 11:48:48,08/17/2018 13:35:00,2018-08-14 11:44:06,delivered,2018-08-14 11:16:44,atibaia,SP,7.0,,0,-15.0
marilia,SP,133,16,12,15,1.0,informatica_acessorios,5,,680.96,10,credit_card,1,21.29,119.99,sao paulo,sao paulo,2017-05-15,2017-04-11 14:25:21,04/05/2017 12:42:51,2017-04-03 19:22:45,delivered,2017-04-03 19:07:32,porto alegre,RS,7.0,,0,-34.0
curitiba,PR,750,23,28,38,3.0,esporte_lazer,5,,27.91,1,voucher,5,15.1,33.6,são paulo,são paulo,2017-05-17,2017-05-12 12:22:06,05/10/2017 09:12:20,2017-04-20 21:15:11,delivered,2017-04-20 21:03:10,sao paulo,SP,21.0,,0,-5.0
ipatinga,MG,6700,70,25,22,3.0,automotivo,5,MUITO BOA AMERICANA ,61.79,2,credit_card,1,17.6,39.9,sao paulo,sao paulo,2017-08-15,2017-08-03 17:37:44,07/27/2017 18:12:34,2017-07-26 14:03:01,delivered,2017-07-26 13:47:20,joao pessoa,PB,8.0,,0,-12.0
caxias do sul,RS,16900,40,30,40,1.0,moveis_cozinha_area_de_servico_jantar_e_jardim,5,Excelente,40.96,1,credit_card,1,17.6,39.9,são paulo,são paulo,2018-07-19,2018-07-05 22:52:28,07/04/2018 12:14:00,2018-07-05 16:31:26,delivered,2018-07-03 23:40:16,chacara,MG,1.0,,1,-14.0
laguna,SP,4200,78,4,47,5.0,automotivo,2,Entrega de encomenda,149.0,2,credit_card,1,16.63,169.99,sao paulo,sao paulo,2018-04-26,2018-04-19 15:38:45,04/07/2018 00:58:32,2018-04-05 18:50:14,delivered,2018-04-05 18:34:49,rio novo do sul,ES,13.0,,0,-7.0
pedreira,SP,100,17,4,12,6.0,telefonia,5,,75.7,7,credit_card,1,7.87,16.0,sao paulo,sao paulo,2017-06-08,2017-05-31 08:18:34,05/22/2017 13:25:37,2017-05-16 21:45:16,delivered,2017-05-16 21:30:59,rio de janeiro,RJ,14.0,,0,-8.0
sao paulo,SP,150,26,16,16,1.0,utilidades_domesticas,5,,356.9,4,credit_card,1,12.04,118.9,sao paulo,sao paulo,2017-08-09,2017-08-07 17:43:07,07/24/2017 13:58:07,2017-07-18 06:03:49,delivered,2017-07-14 16:49:26,belo horizonte,MG,24.0,,3,-2.0
campinas,SP,550,23,37,35,1.0,cama_mesa_banho,5,,165.96,2,credit_card,1,14.59,51.4,sao paulo,sao paulo,2017-12-12,2017-12-22 17:44:27,11/24/2017 22:06:56,2017-11-19 13:35:26,delivered,2017-11-19 13:23:27,belo horizonte,MG,33.0,,0,10.0
atibaia,SP,7000,25,25,25,3.0,moveis_decoracao,3,,61.19,2,credit_card,1,16.05,184.99,sao paulo,sao paulo,2017-09-26,2017-09-19 17:54:20,09/12/2017 14:32:56,2017-09-09 06:34:59,delivered,2017-09-06 10:15:27,teresina,PI,13.0,,2,-7.0
juiz de fora,MG,1100,32,9,21,3.0,esporte_lazer,5,,43.37,1,credit_card,1,20.02,76.1,são paulo,são paulo,2018-06-28,2018-06-07 12:21:51,05/29/2018 15:41:00,2018-05-28 10:53:35,delivered,2018-05-28 10:31:05,salto de pirapora,SP,10.0,,0,-21.0
sao paulo,SP,3850,35,26,41,4.0,brinquedos,5,,40.86,2,credit_card,1,12.69,98.0,sao paulo,sao paulo,2018-07-03,2018-06-16 18:32:49,06/11/2018 15:43:00,2018-06-09 19:11:01,delivered,2018-06-09 18:56:00,sao paulo,SP,6.0,,0,-17.0
dores de campos,MG,800,21,8,14,3.0,automotivo,5,,84.81,1,credit_card,1,11.85,49.9,sao paulo,sao paulo,2018-08-20,2018-07-30 19:44:49,07/25/2018 06:00:00,2018-07-23 16:05:15,delivered,2018-07-23 14:56:35,belford roxo,RJ,7.0,,0,-21.0
sao paulo - sp,SP,1500,50,30,33,1.0,pet_shop,5,Excelente!,8.24,1,voucher,4,11.85,49.9,sao paulo,sao paulo,2017-10-11,2017-09-25 18:46:24,09/14/2017 21:14:49,2017-09-11 19:50:23,delivered,2017-09-11 19:42:40,sao paulo,SP,13.0,,0,-16.0
sao paulo,SP,450,16,16,22,2.0,perfumaria,4,,191.93,3,credit_card,1,12.83,55.0,sao paulo,sao paulo,2017-03-16,2017-02-01 00:52:30,01/26/2017 16:41:28,2017-01-25 02:55:21,delivered,2017-01-22 13:04:20,guapore,RS,9.0,,2,-43.0
sao caetano do sul,SP,2350,92,4,24,3.0,esporte_lazer,2,,32.72,1,credit_card,1,14.1,19.0,sao paulo,sao paulo,2017-06-06,2017-05-23 13:19:32,05/17/2017 09:23:09,2017-05-14 15:10:13,delivered,2017-05-14 14:56:41,rio branco,AC,8.0,,0,-14.0
araras,SP,700,28,10,11,1.0,beleza_saude,5,,32.77,1,boleto,1,12.84,24.98,sao paulo,sao paulo,2017-09-08,2017-09-06 19:46:59,08/29/2017 15:18:24,2017-08-28 18:55:17,delivered,2017-08-28 18:43:50,uberlandia,MG,9.0,,0,-2.0
divisa nova,MG,500,16,16,12,2.0,automotivo,4,,50.5,5,credit_card,1,15.1,48.99,sao paulo,sao paulo,2018-07-24,2018-07-05 21:48:42,07/03/2018 07:33:00,2018-06-30 19:55:10,delivered,2018-06-30 19:46:13,ferraz de vasconcelos,SP,5.0,,0,-19.0
sao paulo,SP,2100,40,6,29,1.0,cama_mesa_banho,5,,37.05,3,credit_card,1,12.48,19.9,sao paulo,sao paulo,2018-04-13,2018-04-09 13:32:46,03/21/2018 18:56:50,2018-03-17 12:50:30,delivered,2018-03-17 12:39:10,sao jose dos campos,SP,23.0,,0,-4.0
guarulhos,SP,4700,47,19,23,6.0,automotivo,4,,70.36,1,credit_card,1,12.48,19.9,sao paulo,sao paulo,2017-08-30,2017-08-16 20:34:51,08/11/2017 19:39:38,2017-08-11 06:45:09,delivered,2017-08-10 13:51:49,porto alegre,RS,6.0,,0,-14.0
santo andre,SP,200,20,20,20,1.0,esporte_lazer,1,,38.0,1,credit_card,1,25.78,138.0,sao paulo,sao paulo,2018-06-26,2018-06-16 16:44:34,06/08/2018 14:15:00,2018-06-07 23:53:58,delivered,2018-06-07 23:42:37,sao luis,MA,8.0,,0,-10.0
sorocaba,SP,900,16,10,16,1.0,cama_mesa_banho,5,,196.81,1,boleto,1,11.85,27.3,são paulo,são paulo,2018-07-03,2018-06-22 17:58:39,06/21/2018 15:17:00,2018-06-20 10:21:32,delivered,2018-06-20 09:46:53,taboao da serra,SP,2.0,,0,-11.0
campinas,SP,400,18,18,18,1.0,perfumaria,4,,46.84,1,boleto,1,15.1,45.9,sao paulo,sao paulo,2017-04-06,2017-03-16 12:45:39,03/10/2017 10:35:25,2017-03-09 16:18:47,delivered,2017-03-09 16:18:47,curitiba,PR,6.0,,0,-21.0
igaracu do tiete,SP,7000,57,11,52,1.0,informatica_acessorios,1,,367.2,10,credit_card,1,16.46,99.9,sao paulo,sao paulo,2017-10-18,2017-10-05 21:56:00,10/04/2017 16:50:10,2017-10-01 10:24:04,delivered,2017-10-01 10:11:40,maringa,PR,4.0,,0,-13.0
americana,SP,400,22,5,20,1.0,esporte_lazer,3,,195.36,4,credit_card,1,17.21,285.9,sao paulo,sao paulo,2018-02-01,2018-01-17 18:47:03,01/15/2018 20:29:48,2018-01-10 14:09:26,delivered,2018-01-10 13:58:09,petrolandia,SC,7.0,,0,-15.0
brusque,SC,1150,40,20,30,5.0,pet_shop,5,,144.8,7,credit_card,1,18.63,46.3,sao paulo,sao paulo,2018-04-04,2018-03-14 16:27:39,03/09/2018 17:48:49,2018-03-08 17:00:37,delivered,2018-03-08 16:00:56,guarulhos,SP,6.0,,0,-21.0
brusque,SC,100,16,8,16,2.0,eletronicos,5,,28.62,1,boleto,1,16.02,135.9,sao paulo,sao paulo,2018-05-30,2018-06-09 19:36:43,05/16/2018 11:00:00,2018-05-07 17:56:21,delivered,2018-05-07 10:59:47,niteroi,RJ,33.0,,0,10.0
sao caetano do sul,SP,10100,30,61,30,1.0,casa_construcao,4,,160.74,1,boleto,1,8.64,55.0,sao paulo,sao paulo,2018-01-19,2018-01-11 15:23:50,12/20/2017 19:42:19,2017-12-17 23:53:53,delivered,2017-12-17 22:49:34,rio de janeiro,RJ,24.0,,0,-8.0
uberlandia,MG,250,16,8,11,1.0,telefonia,4,,103.59,1,voucher,2,10.96,32.9,sao paulo,sao paulo,2017-12-19,2018-01-04 20:26:46,12/05/2017 00:46:43,2017-11-28 03:44:52,delivered,2017-11-24 22:21:21,aparecida de goiania,GO,40.0,,3,16.0
pitangueiras,SP,4500,59,10,59,1.0,automotivo,5,,10.39,1,credit_card,1,18.52,114.6,sao paulo,sao paulo,2018-08-13,2018-07-05 16:08:33,06/29/2018 14:21:00,2018-06-29 08:35:16,delivered,2018-06-28 22:11:43,goiania,GO,6.0,,0,-39.0
belo horizonte,MG,1550,16,10,16,6.0,esporte_lazer,5,,31.75,1,credit_card,1,19.32,47.9,sao paulo,sao paulo,2018-08-06,2018-07-31 19:18:49,07/30/2018 14:22:00,2018-07-27 15:35:19,delivered,2018-07-27 15:25:51,jundiai,SP,4.0,,0,-6.0
franca,SP,1000,20,20,14,1.0,esporte_lazer,4,Recomendo!,116.23,5,credit_card,1,18.65,78.0,sao paulo,sao paulo,2017-05-26,2017-05-10 09:03:40,05/09/2017 14:43:49,2017-05-05 14:02:30,delivered,2017-05-05 13:48:37,osasco,SP,4.0,,0,-16.0
sao paulo,SP,3000,55,25,35,1.0,cama_mesa_banho,3,,40.43,4,credit_card,1,68.13,165.0,sao paulo,sao paulo,2018-05-09,2018-05-17 21:43:34,04/17/2018 16:52:47,2018-04-14 18:52:37,delivered,2018-04-14 18:31:02,araruna,PR,33.0,,0,8.0
rio de janeiro,RJ,150,16,5,15,2.0,informatica_acessorios,5,,66.64,1,boleto,1,45.3,120.0,sao paulo,sao paulo,2018-04-16,2018-04-09 19:16:42,04/02/2018 16:46:43,2018-03-29 08:27:08,delivered,2018-03-27 15:55:38,gravata,PE,13.0,,1,-7.0
sao paulo,SP,2150,21,4,71,1.0,utilidades_domesticas,5,,17.01,1,voucher,1,14.59,59.9,sao paulo,sao paulo,2018-09-20,2018-08-28 15:11:50,08/27/2018 10:46:00,2018-08-25 22:30:10,delivered,2018-08-25 22:17:18,rio de janeiro,RJ,2.0,,0,-23.0
sao paulo,SP,550,27,25,25,1.0,esporte_lazer,3,,189.96,1,boleto,1,15.79,99.0,sao paulo,sao paulo,2017-07-13,2017-07-09 13:43:40,06/20/2017 10:42:07,2017-06-17 17:10:17,delivered,2017-06-17 16:54:26,alegre,ES,21.0,,0,-4.0
sao paulo,SP,17600,65,36,45,1.0,bebes,1,,170.37,1,boleto,1,8.29,59.9,são paulo,são paulo,2017-12-26,2017-12-18 18:42:42,11/27/2017 17:54:47,2017-11-25 01:31:23,delivered,2017-11-24 21:04:41,londrina,PR,23.0,,0,-8.0
curitiba,PR,250,16,23,14,2.0,utilidades_domesticas,5,,50.9,2,credit_card,1,14.43,41.95,sao paulo,sao paulo,2018-02-19,2018-01-29 15:48:31,01/26/2018 19:52:44,2018-01-26 03:16:31,delivered,2018-01-25 11:11:12,sao paulo,SP,4.0,,0,-21.0
guarulhos,SP,350,22,3,15,1.0,beleza_saude,1,,133.64,1,credit_card,1,20.59,199.9,sao paulo,sao paulo,2017-06-20,2017-06-16 21:37:34,06/13/2017 14:00:06,2017-06-07 02:30:13,delivered,2017-06-06 00:11:09,senhor do bonfim,BA,10.0,,1,-4.0
sorocaba,SP,2700,16,11,11,3.0,construcao_ferramentas_construcao,4,,543.29,1,boleto,1,7.82,79.8,sao paulo,sao paulo,2018-08-15,2018-07-31 19:22:12,07/26/2018 14:47:00,2018-07-25 13:35:14,delivered,2018-07-25 13:25:20,sao bernardo do campo,SP,6.0,,0,-15.0
curitiba,PR,17150,36,48,56,3.0,malas_acessorios,5,,42.75,2,credit_card,1,14.7,330.0,sao paulo,sao paulo,2017-08-17,2017-08-05 13:23:52,07/27/2017 21:37:58,2017-07-23 18:05:25,delivered,2017-07-23 17:53:00,santana de parnaiba,SP,12.0,,0,-12.0
campo grande,MS,300,26,3,26,3.0,tablets_impressao_imagem,5,,161.01,2,credit_card,1,17.74,69.9,sao paulo,sao paulo,2017-07-24,2017-07-18 19:53:36,07/14/2017 16:29:39,2017-07-11 17:55:20,delivered,2017-07-11 17:46:45,rio de janeiro,RJ,7.0,,0,-6.0
sao paulo,SP,250,17,12,12,1.0,beleza_saude,3,,72.83,1,boleto,1,15.1,29.9,sao paulo,sao paulo,2018-05-10,2018-05-17 22:28:30,04/18/2018 00:41:17,2018-04-16 14:33:17,delivered,2018-04-16 13:44:10,rio de janeiro,RJ,31.0,,0,7.0
sao paulo,SP,300,16,8,11,1.0,bebes,5,,1605.14,1,boleto,1,17.6,48.65,sao paulo,sao paulo,2018-08-27,2018-08-22 17:32:28,08/16/2018 15:47:00,2018-08-15 17:04:00,delivered,2018-08-15 16:30:22,piratininga,SP,7.0,,0,-5.0
sao paulo,SP,650,20,11,15,2.0,utilidades_domesticas,5,,130.6,1,boleto,1,11.73,39.9,sao paulo,sao paulo,2018-08-02,2018-07-23 14:42:45,07/19/2018 11:15:00,2018-07-16 12:10:11,delivered,2018-07-16 11:56:49,belo horizonte,MG,7.0,,0,-10.0
santo andre,SP,1700,34,18,16,3.0,automotivo,3,,69.67,1,credit_card,1,23.38,113.89,sao paulo,sao paulo,2018-01-24,2018-01-10 15:57:20,01/03/2018 18:17:51,2018-01-02 17:56:43,delivered,2018-01-02 17:46:40,porto alegre,RS,7.0,,0,-14.0
garca,SP,200,16,2,11,1.0,fashion_bolsas_e_acessorios,1,,70.97,2,credit_card,1,23.91,195.0,são paulo,são paulo,2017-05-04,2017-04-19 13:53:15,04/07/2017 14:42:20,2017-04-03 22:30:18,delivered,2017-04-03 22:19:08,maceio,AL,15.0,,0,-15.0
presidente epitacio,SP,6400,30,30,30,1.0,cama_mesa_banho,4,,255.76,10,credit_card,1,16.11,49.95,sao paulo,sao paulo,2017-07-18,2017-07-03 13:39:31,06/27/2017 14:18:02,2017-06-27 03:45:23,delivered,2017-06-24 17:11:53,duque de caxias,RJ,8.0,,2,-15.0
porto alegre,RS,200,21,7,14,1.0,eletronicos,4,,75.4,4,credit_card,1,15.1,29.9,sao paulo,sao paulo,2017-11-21,2017-11-14 17:47:07,10/30/2017 13:21:46,2017-10-27 12:28:41,delivered,2017-10-27 12:07:08,florianopolis,SC,18.0,,0,-7.0
ibitinga,SP,1350,50,11,11,2.0,cama_mesa_banho,1,,109.93,3,credit_card,1,35.83,72.9,sao paulo,sao paulo,2018-06-28,2018-06-14 22:28:26,06/13/2018 14:47:00,2018-06-13 09:57:08,delivered,2018-06-13 09:46:14,sao paulo,SP,1.0,,0,-14.0
sao paulo,SP,263,19,14,16,1.0,brinquedos,1,PRODUTO PÉSSIMO,71.14,1,credit_card,1,19.88,38.5,sao paulo,sao paulo,2018-03-06,2018-02-22 13:27:53,02/06/2018 22:42:45,2018-02-06 04:33:11,delivered,2018-02-04 19:34:05,jau,SP,17.0,,1,-12.0
belo horizonte,MG,1000,33,6,22,1.0,livros_interesse_geral,5,,113.33,3,credit_card,1,13.18,106.0,sao paulo,sao paulo,2018-07-24,2018-06-18 18:20:48,06/12/2018 14:10:00,2018-06-12 10:21:14,delivered,2018-06-12 09:51:55,sao paulo,SP,6.0,,0,-36.0
ibitinga,SP,4350,20,20,20,1.0,esporte_lazer,5,,292.86,1,credit_card,1,102.63,1240.0,sao paulo,sao paulo,2018-08-22,2018-08-16 23:21:14,08/13/2018 12:17:00,2018-08-12 19:45:23,delivered,2018-08-12 19:28:01,monte carmelo,MG,4.0,,0,-6.0
goiania,GO,303,14,14,28,1.0,moveis_decoracao,3,,129.15,2,credit_card,1,23.89,105.0,sao paulo,sao paulo,2018-05-17,2018-05-01 01:15:45,04/24/2018 22:08:41,2018-04-24 19:23:22,delivered,2018-04-23 10:50:18,sao paulo,SP,7.0,,1,-16.0
sao paulo,SP,200,22,16,16,2.0,telefonia,5,,177.67,7,credit_card,1,17.98,24.99,sao paulo,sao paulo,2017-11-16,2017-11-08 02:42:06,11/06/2017 19:22:34,2017-11-04 11:25:22,delivered,2017-11-03 11:29:00,aparecida de goiania,GO,4.0,,0,-8.0
tabatinga,SP,2950,17,22,17,3.0,alimentos_bebidas,5,Ótima ,27.48,1,credit_card,1,8.72,39.9,sao paulo,sao paulo,2017-05-16,2017-05-11 20:16:48,04/28/2017 09:14:05,2017-04-26 09:37:59,delivered,2017-04-24 09:37:26,atibaia,SP,17.0,,2,-5.0
sbc/sp,SP,100,16,8,11,2.0,informatica_acessorios,1,,140.94,1,credit_card,1,17.64,49.0,sao paulo,sao paulo,2018-04-20,2018-04-16 20:08:25,04/04/2018 22:42:55,2018-04-04 09:48:58,delivered,2018-04-03 15:03:21,ipiranga,PR,13.0,,0,-4.0
toledo,PR,130,100,25,35,3.0,cool_stuff,4,Boa,23.0,1,boleto,1,17.64,49.0,sao paulo,sao paulo,2018-06-11,2018-06-01 16:12:31,05/24/2018 15:22:00,2018-05-18 16:58:18,delivered,2018-05-17 16:46:58,belo horizonte,MG,14.0,,1,-10.0
curitiba,PR,350,16,10,16,1.0,cama_mesa_banho,4,,49.09,1,credit_card,1,18.38,39.99,sao paulo,sao paulo,2017-04-05,2017-03-28 13:48:15,03/21/2017 15:17:00,2017-03-15 15:54:53,delivered,2017-03-15 15:54:53,taubate,SP,12.0,,0,-8.0
joinville,SC,250,20,20,20,2.0,moveis_decoracao,5,,84.79,1,credit_card,1,13.37,28.9,sao paulo,sao paulo,2017-12-01,2017-11-20 22:42:38,11/17/2017 21:38:30,2017-11-14 08:26:37,delivered,2017-11-14 08:13:32,sao paulo,SP,6.0,,0,-11.0
sao paulo,SP,3300,19,7,16,6.0,moveis_decoracao,5,,111.02,1,boleto,1,27.34,1799.0,sao paulo,sao paulo,2018-09-17,2018-08-25 19:04:45,08/21/2018 12:03:00,2018-08-20 20:50:06,delivered,2018-08-20 20:28:26,concordia,SC,4.0,,0,-23.0
arraial d'ajuda (porto seguro),BA,5500,29,37,25,10.0,eletrodomesticos,5,,42.44,1,credit_card,1,17.68,56.99,sao paulo,sao paulo,2017-06-05,2017-05-19 14:13:02,05/16/2017 09:14:33,2017-05-12 11:05:13,delivered,2017-05-12 10:51:43,belo horizonte,MG,7.0,,0,-17.0
limeira,SP,200,24,7,14,2.0,papelaria,4,,210.56,1,credit_card,1,11.92,59.9,sao paulo,sao paulo,2018-08-02,2018-07-13 16:28:52,07/06/2018 09:03:00,2018-07-05 16:16:24,delivered,2018-07-03 10:03:33,rio de janeiro,RJ,10.0,,2,-20.0
pacatuba,CE,4200,30,20,20,1.0,construcao_ferramentas_construcao,4,,42.74,4,credit_card,1,7.78,12.67,sao paulo,sao paulo,2018-03-28,2018-04-06 17:45:29,03/13/2018 18:28:45,2018-03-08 10:08:48,delivered,2018-03-08 09:26:27,jacarei,SP,29.0,,0,9.0
serra negra,SP,217,17,10,14,1.0,beleza_saude,4,,50.1,1,boleto,1,7.39,18.9,são paulo,são paulo,2017-04-20,2017-04-06 12:38:15,03/31/2017 14:42:20,2017-03-25 19:25:18,delivered,2017-03-25 19:13:03,picos,PI,11.0,,0,-14.0
sao paulo,SP,5600,20,5,60,1.0,moveis_sala,1,,67.23,1,credit_card,1,19.39,27.9,sao paulo,sao paulo,2017-12-15,2017-12-06 17:37:11,11/27/2017 18:39:20,2017-11-25 01:31:35,delivered,2017-11-24 22:09:42,una,BA,11.0,,0,-9.0
rio de janeiro,RJ,150,16,13,11,2.0,beleza_saude,4,,46.66,4,credit_card,1,17.94,98.8,sao paulo,sao paulo,2017-10-04,2017-09-18 19:47:50,09/11/2017 19:25:51,2017-09-08 11:05:18,delivered,2017-09-08 10:57:39,salvador,BA,10.0,,0,-16.0
formosa,GO,239,27,8,16,3.0,informatica_acessorios,5,,201.05,1,credit_card,1,21.82,29.99,sao paulo,sao paulo,2018-09-04,2018-08-28 17:36:21,08/27/2018 17:58:00,2018-08-25 23:45:14,delivered,2018-08-25 23:32:01,taguai,SP,2.0,,0,-7.0
guarulhos,SP,1300,29,9,18,7.0,livros_importados,5,,81.47,4,credit_card,1,17.76,72.6,sao paulo,sao paulo,2018-03-12,2018-02-27 17:28:30,02/20/2018 23:25:12,2018-02-18 00:26:32,delivered,2018-02-18 00:10:50,ribeirao preto,SP,9.0,,0,-13.0
sao paulo,SP,200,16,2,11,1.0,fashion_bolsas_e_acessorios,5,Muito bom,79.69,1,boleto,1,17.71,139.94,sao paulo,sao paulo,2018-08-28,2018-08-22 22:34:34,08/21/2018 14:58:00,2018-08-20 23:15:15,delivered,2018-08-20 23:06:39,belo horizonte,MG,1.0,,0,-6.0
sao paulo,SP,800,39,6,28,1.0,utilidades_domesticas,3,,45.12,4,credit_card,1,9.18,284.8,são paulo,são paulo,2018-03-07,2018-02-16 14:53:06,02/08/2018 17:44:10,2018-02-08 07:35:58,delivered,2018-02-07 08:04:29,guarulhos,SP,9.0,,0,-19.0
niteroi,RJ,150,24,13,13,1.0,construcao_ferramentas_construcao,5,,250.04,1,boleto,1,14.3,199.0,sao paulo,sao paulo,2018-04-11,2018-03-23 18:45:50,03/19/2018 19:41:34,2018-03-17 20:16:07,delivered,2018-03-17 19:59:25,sao paulo,SP,5.0,,0,-19.0
borda da mata,MG,580,39,11,15,1.0,beleza_saude,1,,108.88,7,credit_card,1,18.98,125.0,sao paulo,sao paulo,2018-06-28,2018-06-15 17:27:44,06/12/2018 08:16:00,2018-06-11 16:42:16,delivered,2018-06-10 15:44:20,peabiru,PR,5.0,,1,-13.0
curitiba,PR,1600,25,9,17,4.0,automotivo,5,,189.66,1,credit_card,1,8.88,32.0,sao paulo,sao paulo,2018-06-21,2018-05-28 16:08:59,05/11/2018 14:03:00,2018-05-10 11:36:17,delivered,2018-05-10 11:04:45,sao paulo,SP,18.0,,0,-24.0
ubatuba,SP,100,17,3,12,1.0,fashion_bolsas_e_acessorios,5,,135.47,3,credit_card,1,14.79,149.0,sao paulo,sao paulo,2018-03-15,2018-02-24 15:27:31,02/20/2018 19:39:00,2018-02-20 07:27:16,delivered,2018-02-19 19:18:16,sao paulo,SP,4.0,,0,-19.0
entre rios do oeste,PR,1000,20,20,20,2.0,informatica_acessorios,1,,104.07,1,boleto,1,16.39,59.99,sao paulo,sao paulo,2017-05-23,2017-05-10 07:47:41,04/20/2017 14:04:00,2017-04-20 02:55:33,delivered,2017-04-18 16:00:31,carangola,MG,21.0,,1,-13.0
sao carlos,SP,1450,16,16,12,1.0,construcao_ferramentas_jardim,1,Meu produto não chegou,184.08,3,credit_card,1,8.11,13.3,sao paulo,sao paulo,2017-05-04,2017-04-15 06:52:47,04/12/2017 14:01:12,2017-04-12 02:25:12,delivered,2017-04-12 02:16:32,marilia,SP,3.0,,0,-19.0
sao paulo,SP,600,30,4,20,1.0,moveis_decoracao,5,,164.01,1,boleto,1,27.44,84.9,sao paulo,sao paulo,2017-11-28,2017-11-07 21:28:49,10/31/2017 16:43:41,2017-10-31 04:15:17,delivered,2017-10-29 23:44:13,conquista,MG,8.0,,1,-21.0
catanduva,SP,1200,19,6,14,2.0,automotivo,5,,91.21,3,credit_card,1,15.32,329.0,sao paulo,sao paulo,2018-06-07,2018-05-21 13:44:46,05/15/2018 09:02:00,2018-05-12 10:12:15,delivered,2018-05-12 09:58:38,cabo frio,RJ,9.0,,0,-17.0
santos,SP,1376,23,15,21,1.0,alimentos,1,,129.0,7,credit_card,1,28.99,83.9,sao paulo,sao paulo,2018-03-13,2018-03-12 23:36:07,02/23/2018 22:22:02,2018-02-23 02:08:59,delivered,2018-02-21 13:48:55,bicas,MG,19.0,,1,-1.0
rio de janeiro,RJ,350,16,6,11,,,5,,84.28,2,credit_card,1,19.36,559.99,sao paulo,sao paulo,2018-03-19,2018-04-05 21:37:26,03/02/2018 23:57:29,2018-03-01 17:09:42,delivered,2018-03-01 16:51:27,forquilha,CE,35.0,,0,17.0
taboao da serra,SP,220,22,13,12,1.0,informatica_acessorios,5,,57.67,1,credit_card,1,8.35,109.0,são paulo,são paulo,2017-12-06,2017-11-08 10:55:38,10/30/2017 19:30:02,2017-10-25 10:14:27,delivered,2017-10-25 10:03:39,macae,RJ,14.0,,0,-28.0
sao paulo,SP,6084,68,14,68,1.0,brinquedos,5,,97.79,3,credit_card,1,8.35,109.0,sao paulo,sao paulo,2018-04-12,2018-04-04 00:21:27,03/27/2018 19:54:45,2018-03-23 21:08:15,delivered,2018-03-23 20:57:50,brasilia,DF,11.0,,0,-8.0
formiga,MG,400,16,11,20,2.0,relogios_presentes,5,,53.9,1,debit_card,1,8.35,109.0,sao paulo,sao paulo,2018-05-23,2018-04-19 00:34:37,04/16/2018 23:30:42,2018-04-13 21:50:57,delivered,2018-04-13 21:18:46,canoas,RS,5.0,,0,-34.0
sao paulo,SP,300,17,12,11,1.0,beleza_saude,5,,35.09,1,boleto,1,14.1,25.0,sao paulo,sao paulo,2018-07-16,2018-06-25 20:21:34,06/18/2018 10:05:00,2018-06-16 19:58:28,delivered,2018-06-16 19:42:55,guaicara,SP,9.0,,0,-21.0
santos,SP,250,16,15,15,2.0,brinquedos,5,Otima,218.04,1,boleto,1,19.84,38.4,são paulo,são paulo,2017-08-18,2017-08-07 20:45:46,08/02/2017 19:46:14,2017-07-29 12:35:14,delivered,2017-07-29 12:18:53,campinas,SP,9.0,,0,-11.0
caxias do sul,RS,600,20,7,20,1.0,utilidades_domesticas,4,,67.93,1,boleto,1,19.84,38.4,sao paulo,sao paulo,2018-05-30,2018-05-22 18:12:23,05/17/2018 14:46:00,2018-05-16 16:57:04,delivered,2018-05-16 16:38:10,santa vitoria,MG,6.0,,0,-8.0
macae,RJ,317,20,7,16,2.0,consoles_games,5,,40.53,1,boleto,1,8.93,109.9,sao paulo,sao paulo,2017-10-10,2017-09-27 17:32:26,09/19/2017 11:54:10,2017-09-14 19:25:18,delivered,2017-09-14 19:12:49,sao paulo,SP,12.0,,0,-13.0
lauro de freitas,BA,2000,35,27,12,1.0,malas_acessorios,5,,97.23,6,credit_card,1,29.1,129.96,sao paulo,sao paulo,2018-02-16,2018-02-06 17:13:15,01/17/2018 15:42:18,2018-01-17 07:29:51,delivered,2018-01-17 07:22:36,adamantina,SP,20.0,,0,-10.0
belo horizonte,MG,5650,40,16,50,5.0,construcao_ferramentas_jardim,4,recomendaria sim,159.39,6,credit_card,1,17.63,59.9,sao paulo,sao paulo,2018-04-16,2018-04-23 10:41:24,03/20/2018 00:02:52,2018-03-14 16:10:39,delivered,2018-03-14 15:55:57,franco da rocha,SP,39.0,,0,7.0
rio claro,SP,575,20,10,15,1.0,automotivo,4,,167.07,1,boleto,1,14.63,76.9,sao paulo,sao paulo,2017-09-18,2017-08-29 08:15:48,08/14/2017 20:33:44,2017-08-11 08:55:06,delivered,2017-08-11 08:41:43,salvador,BA,17.0,,0,-20.0
lajeado,RS,18450,68,21,42,1.0,eletrodomesticos_2,5,,50.0,1,voucher,2,17.95,99.9,sao paulo,sao paulo,2017-05-04,2017-04-10 20:48:13,04/05/2017 10:00:47,2017-04-04 13:25:20,delivered,2017-04-04 13:15:05,sao paulo,SP,6.0,,0,-24.0
cascavel,PR,1000,35,10,34,1.0,malas_acessorios,5,,93.4,2,credit_card,1,22.99,133.0,sao paulo,sao paulo,2018-05-25,2018-05-17 14:48:44,05/16/2018 15:08:00,2018-05-15 04:52:38,delivered,2018-05-13 19:57:13,rio de janeiro,RJ,3.0,,1,-8.0
ribeirao preto,SP,450,35,35,11,1.0,moveis_decoracao,5,,276.11,4,credit_card,1,22.99,133.0,sao paulo,sao paulo,2017-05-03,2017-04-05 12:42:54,03/31/2017 20:21:27,2017-03-31 11:42:29,delivered,2017-03-31 11:30:55,sao paulo,SP,5.0,,0,-28.0
venancio aires,RS,75,16,15,15,2.0,automotivo,4,,149.16,3,credit_card,1,15.11,34.9,sao paulo,sao paulo,2018-03-02,2018-02-16 12:33:48,02/06/2018 18:38:52,2018-02-01 17:33:10,delivered,2018-02-01 17:15:54,sao roque,SP,14.0,,0,-14.0
campo grande,MS,200,20,5,13,3.0,perfumaria,5,Recomendo,175.13,2,credit_card,1,10.74,249.99,são paulo,são paulo,2018-05-29,2018-05-02 19:20:53,04/26/2018 14:48:00,2018-04-24 19:00:05,delivered,2018-04-20 12:53:58,franco da rocha,SP,12.0,,4,-27.0
sao jose do rio preto,SP,625,16,14,15,1.0,beleza_saude,5,,143.99,1,credit_card,1,10.74,249.99,sao paulo,sao paulo,2017-06-08,2017-05-26 14:45:57,05/18/2017 15:44:55,2017-05-18 09:45:14,delivered,2017-05-18 09:34:58,manaus,AM,8.0,,0,-13.0
navegantes,SC,200,16,2,11,,,4,,131.8,1,boleto,1,9.45,179.49,sao paulo,sao paulo,2018-08-28,2018-08-28 16:46:41,08/23/2018 15:30:00,2018-08-23 01:30:12,delivered,2018-08-22 01:35:54,rio claro,SP,6.0,,0,0.0
belo horizonte,MG,1500,40,45,30,2.0,pet_shop,5,,88.54,1,boleto,1,14.53,51.5,sao paulo,sao paulo,2018-07-20,2018-07-06 18:48:35,07/03/2018 14:54:00,2018-07-02 14:30:40,delivered,2018-07-02 14:20:11,vila velha,ES,4.0,,0,-14.0
sao bernardo do campo,SP,650,20,40,50,6.0,malas_acessorios,4,capa de notbuk ,109.31,1,credit_card,1,12.09,84.99,sao paulo,sao paulo,2017-09-14,2017-09-01 20:13:10,08/28/2017 20:59:37,2017-08-26 11:50:13,delivered,2017-08-24 19:35:00,sao jose de uba,RJ,8.0,,1,-13.0
cotia,SP,600,20,20,30,1.0,perfumaria,5,,63.05,1,boleto,1,55.36,479.0,sao paulo,sao paulo,2017-11-30,2017-11-16 21:31:55,11/08/2017 19:18:33,2017-11-07 09:35:32,delivered,2017-11-07 09:23:40,ribeirao preto,SP,9.0,,0,-14.0
sao paulo,SP,225,17,17,17,1.0,informatica_acessorios,5,,353.29,8,credit_card,1,12.69,38.4,sao paulo,sao paulo,2017-12-11,2017-12-02 21:08:47,11/22/2017 18:26:47,2017-11-20 16:47:01,delivered,2017-11-20 16:35:55,mogi das cruzes,SP,12.0,,0,-9.0
sao paulo,SP,550,20,13,21,1.0,eletroportateis,1,,276.44,3,credit_card,1,12.69,38.4,sao paulo,sao paulo,2018-08-30,2018-08-17 20:51:49,08/13/2018 14:00:00,2018-08-10 15:10:27,delivered,2018-08-10 14:54:25,sao paulo,SP,7.0,,0,-13.0
santos,SP,7175,50,22,40,1.0,brinquedos,4,,45.95,1,boleto,1,12.69,38.4,sao paulo,sao paulo,2018-02-16,2018-02-17 19:19:00,01/25/2018 18:46:57,2018-01-24 20:19:22,delivered,2018-01-24 20:07:10,araras,SP,23.0,,0,1.0
limeira,SP,300,16,2,20,3.0,relogios_presentes,4,,116.99,2,credit_card,1,11.85,49.95,sao paulo,sao paulo,2018-03-13,2018-03-12 23:56:17,02/21/2018 16:58:42,2018-02-20 07:15:29,delivered,2018-02-16 20:16:34,goiania,GO,24.0,,3,-1.0
santana de parnaiba,SP,350,19,22,17,2.0,brinquedos,5,,46.0,1,boleto,1,15.1,24.99,sao paulo,sao paulo,2018-02-22,2018-02-07 22:58:39,02/01/2018 18:48:34,2018-01-31 21:15:26,delivered,2018-01-31 21:04:47,sorriso,MT,7.0,,0,-15.0
curitiba,PR,650,19,20,15,4.0,moveis_decoracao,5,,23.23,1,voucher,2,16.79,31.9,sao paulo,sao paulo,2017-11-06,2017-10-18 19:32:50,10/13/2017 17:37:56,2017-10-13 10:28:15,delivered,2017-10-13 10:15:28,sao paulo,SP,5.0,,0,-19.0
cruzeiro,SP,424,25,10,19,3.0,informatica_acessorios,5,,119.18,1,credit_card,1,17.63,32.0,sao paulo,sao paulo,2017-12-08,2017-12-05 18:19:02,11/30/2017 22:37:03,2017-11-24 19:33:08,delivered,2017-11-24 15:54:35,rio de janeiro,RJ,11.0,,0,-3.0
sao paulo,SP,102,20,6,13,2.0,pet_shop,5,,32.13,1,boleto,1,27.26,70.0,são paulo,são paulo,2017-07-20,2017-07-12 19:59:22,06/19/2017 18:28:42,2017-06-17 03:48:11,delivered,2017-06-15 16:02:23,joinville,SC,27.0,,1,-8.0
ibitinga,SP,200,30,15,15,1.0,casa_conforto,5,,222.15,5,credit_card,1,8.88,59.99,sao paulo,sao paulo,2017-12-26,2017-12-13 17:35:03,12/04/2017 20:52:18,2017-12-01 11:31:59,delivered,2017-12-01 09:21:49,sao paulo,SP,12.0,,0,-13.0
diadema,SP,650,16,40,11,1.0,beleza_saude,4,,59.22,1,boleto,1,14.1,22.9,sao paulo,sao paulo,2018-02-15,2018-02-24 13:12:53,01/23/2018 22:57:46,2018-01-23 03:52:57,delivered,2018-01-21 13:28:36,vila velha,ES,33.0,,1,9.0
sao paulo,SP,400,21,7,15,7.0,papelaria,1,Entrega atrasada,204.81,1,boleto,1,11.62,49.9,são paulo,são paulo,2018-02-26,2018-02-06 21:56:52,02/05/2018 17:15:00,2018-02-01 14:55:28,delivered,2018-02-01 14:44:21,lages,SC,5.0,,0,-20.0
maringa,PR,200,16,11,11,2.0,relogios_presentes,4,,73.34,2,credit_card,1,28.63,989.0,sao paulo,sao paulo,2018-06-01,2018-05-15 14:15:31,04/27/2018 13:23:00,2018-04-26 22:55:14,delivered,2018-04-26 22:47:26,niteroi,RJ,18.0,,0,-17.0
santa maria,RS,400,16,28,16,2.0,moveis_decoracao,4,,131.03,1,credit_card,1,13.9,45.97,sao paulo,sao paulo,2018-08-15,2018-07-26 16:42:42,07/23/2018 10:09:00,2018-07-23 11:31:43,delivered,2018-07-22 10:28:14,aracaju,SE,4.0,,1,-20.0
brasilia,DF,2300,36,30,19,1.0,bebes,5,,57.69,3,credit_card,1,22.23,40.75,sao paulo,sao paulo,2017-05-24,2017-05-18 14:44:11,05/17/2017 15:49:59,2017-05-14 19:10:18,delivered,2017-05-14 19:00:05,nova iguacu,RJ,3.0,,0,-6.0
sorocaba,SP,400,20,17,17,2.0,esporte_lazer,5,,27.79,1,credit_card,1,12.19,99.9,sao paulo,sao paulo,2017-09-13,2017-08-29 19:41:49,08/18/2017 19:22:18,2017-08-16 03:26:11,delivered,2017-08-15 11:14:25,sao bernardo do campo,SP,14.0,,0,-15.0
sao jose do rio preto,SP,300,35,4,15,1.0,utilidades_domesticas,3,,224.45,1,boleto,1,13.82,99.9,sao paulo,sao paulo,2018-02-16,2018-01-31 17:08:35,01/30/2018 18:54:38,2018-01-30 04:31:29,delivered,2018-01-28 15:50:29,sao paulo,SP,3.0,,1,-16.0
mirassol,SP,150,32,20,20,2.0,beleza_saude,5,,135.6,1,credit_card,1,52.83,67.99,sao paulo,sao paulo,2018-06-14,2018-06-08 18:48:24,05/22/2018 13:15:00,2018-05-22 07:55:10,delivered,2018-05-21 13:31:41,pindamonhangaba,SP,18.0,,0,-6.0
osasco,SP,600,35,15,30,4.0,esporte_lazer,5,,76.08,7,credit_card,1,13.66,92.0,sao paulo,sao paulo,2018-03-07,2018-02-27 13:39:14,02/20/2018 19:54:53,2018-02-14 16:50:37,delivered,2018-02-14 16:38:58,porto alegre,RS,12.0,,0,-8.0
muriae,MG,10050,51,49,24,1.0,climatizacao,4,,67.14,1,credit_card,1,7.39,45.0,sao paulo,sao paulo,2018-03-14,2018-03-06 13:38:58,03/05/2018 20:55:04,2018-03-02 11:15:45,delivered,2018-03-02 11:04:18,valinhos,SP,4.0,,0,-8.0
sao paulo,SP,420,28,12,22,1.0,brinquedos,5,,137.97,1,boleto,1,13.71,99.0,sao paulo,sao paulo,2018-05-07,2018-04-24 19:28:56,04/19/2018 21:28:38,2018-04-17 17:10:42,delivered,2018-04-17 16:54:48,pindamonhangaba,SP,7.0,,0,-13.0
sao paulo,SP,200,16,2,11,3.0,relogios_presentes,1,Comprei 2 produtos ,68.12,1,boleto,1,12.84,57.2,são paulo,são paulo,2017-02-13,2017-01-16 15:18:08,01/11/2017 15:59:08,2017-01-07 03:44:28,delivered,2017-01-05 15:25:10,fortaleza,CE,10.0,,1,-28.0
canoas,RS,1200,35,3,30,1.0,cama_mesa_banho,3,,73.61,3,credit_card,1,16.39,89.99,sao paulo,sao paulo,2018-08-07,2018-07-23 15:51:06,07/18/2018 12:06:00,2018-07-17 04:31:53,delivered,2018-07-13 20:58:24,conselheiro lafaiete,MG,9.0,,3,-15.0
rio de janeiro,RJ,500,25,4,18,1.0,livros_tecnicos,4,,117.94,3,credit_card,1,13.71,29.9,sao paulo,sao paulo,2017-12-26,2018-01-03 19:24:57,11/28/2017 17:24:39,2017-11-28 07:59:26,delivered,2017-11-28 07:50:35,rio de janeiro,RJ,36.0,,0,8.0
sao bernardo do campo,SP,2250,55,12,35,6.0,brinquedos,4,,84.52,3,credit_card,1,18.27,24.9,sao paulo,sao paulo,2018-07-18,2018-06-13 20:41:21,06/07/2018 09:03:00,2018-06-06 22:12:13,delivered,2018-06-06 21:48:46,nova iguacu,RJ,6.0,,0,-35.0
sao jose do rio preto,SP,2300,40,10,30,1.0,moveis_decoracao,4,,138.84,8,credit_card,1,9.53,76.49,são paulo,são paulo,2017-09-06,2017-08-25 20:12:31,08/24/2017 16:13:41,2017-08-22 19:06:03,delivered,2017-08-22 18:53:15,sao paulo,SP,3.0,,0,-12.0
volta redonda,RJ,1500,20,30,30,1.0,cama_mesa_banho,4,,5.37,1,credit_card,1,14.33,103.9,sao paulo,sao paulo,2018-03-19,2018-03-14 00:58:46,03/06/2018 21:45:35,2018-03-02 02:15:27,delivered,2018-02-28 23:42:55,rio de janeiro,RJ,13.0,,1,-5.0
guarulhos,SP,250,22,10,15,1.0,esporte_lazer,5,,119.48,4,credit_card,1,98.77,550.0,sao paulo,sao paulo,2017-08-15,2017-07-28 21:10:50,07/27/2017 19:26:31,2017-07-27 11:25:23,delivered,2017-07-26 11:29:35,sao bernardo do campo,SP,2.0,,0,-18.0
sao paulo,SP,700,40,15,40,6.0,automotivo,5,,77.5,1,credit_card,1,21.09,149.99,sao paulo,sao paulo,2017-09-06,2017-08-10 15:08:35,08/07/2017 20:48:54,2017-08-06 23:55:16,delivered,2017-08-06 23:40:08,belo horizonte,MG,3.0,,0,-27.0
sao paulo,SP,300,20,30,20,1.0,moveis_decoracao,5,,84.05,1,boleto,1,21.15,32.99,sao paulo,sao paulo,2017-08-11,2017-07-31 13:35:52,07/18/2017 16:10:50,2017-07-16 09:25:08,delivered,2017-07-16 09:15:31,ipatinga,MG,15.0,,0,-11.0
sao paulo,SP,175,17,3,12,2.0,telefonia,5,,149.73,1,boleto,1,27.13,119.0,sao paulo,sao paulo,2018-09-04,2018-08-23 18:40:41,08/21/2018 19:21:00,2018-08-18 07:55:16,delivered,2018-08-17 07:59:51,sao bernardo do campo,SP,6.0,,0,-12.0
sao paulo,SP,3975,46,12,43,1.0,cama_mesa_banho,5,Muito Bom,93.8,1,boleto,1,11.85,35.9,são paulo,são paulo,2017-02-22,2017-02-08 14:47:25,01/27/2017 12:47:43,2017-01-26 16:35:22,delivered,2017-01-26 16:25:36,guarapuava,PR,12.0,,0,-14.0
santo andre/sao paulo,SP,18600,38,74,38,2.0,cool_stuff,2,,76.51,2,credit_card,1,17.53,89.0,sao paulo,sao paulo,2018-04-11,2018-04-03 20:42:52,03/20/2018 23:17:42,2018-03-16 14:10:57,delivered,2018-03-16 13:57:53,sao paulo,SP,18.0,,0,-8.0
ipe,RS,300,16,4,11,1.0,pet_shop,4,,121.6,1,boleto,1,16.66,146.99,sao paulo,sao paulo,2018-05-04,2018-04-19 23:31:32,04/18/2018 23:28:44,2018-04-18 10:11:00,delivered,2018-04-18 09:55:14,campinas,SP,1.0,,0,-15.0
sao paulo,SP,100,16,16,16,2.0,telefonia_fixa,5,,528.69,10,credit_card,1,19.59,50.0,sao paulo,sao paulo,2018-04-03,2018-03-31 14:18:36,03/12/2018 17:24:59,2018-03-11 22:28:09,delivered,2018-03-11 22:14:38,taguatinga,TO,19.0,,0,-3.0
messias targino,RN,200,16,2,11,1.0,fashion_bolsas_e_acessorios,5,,73.03,1,boleto,1,25.69,59.0,sao paulo,sao paulo,2017-12-28,2017-12-11 23:13:13,11/29/2017 19:56:49,2017-11-26 03:51:10,delivered,2017-11-26 03:42:06,tiangua,CE,15.0,,0,-17.0
petropolis,RJ,2550,20,40,25,1.0,beleza_saude,5,,70.0,2,credit_card,2,23.25,109.99,sao paulo,sao paulo,2018-07-17,2018-06-20 23:08:27,06/12/2018 11:04:00,2018-06-11 16:00:43,delivered,2018-06-11 15:32:06,itajuba,MG,9.0,,0,-27.0
sao paulo,SP,15050,60,25,60,1.0,utilidades_domesticas,5,,278.63,5,credit_card,1,16.56,38.9,sao paulo,sao paulo,2017-03-21,2017-02-15 18:51:40,02/03/2017 15:32:17,2017-02-02 23:35:17,delivered,2017-02-02 23:24:24,rio de janeiro,RJ,12.0,,0,-34.0
campinas,SP,1800,42,25,15,1.0,cool_stuff,5,,89.88,2,credit_card,1,19.76,109.9,sao paulo,sao paulo,2018-08-17,2018-08-08 13:48:22,08/03/2018 14:57:00,2018-08-02 20:50:19,delivered,2018-08-02 20:38:59,paranaiba,MS,5.0,,0,-9.0
sao paulo,SP,325,17,18,12,1.0,brinquedos,3,,117.38,1,boleto,1,66.63,259.99,são paulo,são paulo,2018-04-06,2018-03-29 16:19:02,03/27/2018 14:09:36,2018-03-25 16:55:50,delivered,2018-03-25 16:43:56,goiania,GO,3.0,,0,-8.0
curitiba,PR,9500,42,54,25,2.0,utilidades_domesticas,5,,180.47,3,credit_card,1,16.17,59.0,sao paulo,sao paulo,2018-08-08,2018-07-27 21:41:38,07/24/2018 15:45:00,2018-07-24 11:31:40,delivered,2018-07-22 20:04:02,sorocaba,SP,5.0,,1,-12.0
porto ferreira,SP,4000,30,21,24,6.0,ferramentas_jardim,5,,110.77,2,credit_card,1,13.84,69.0,sao paulo,sao paulo,2017-08-10,2017-07-18 17:03:18,07/13/2017 10:56:32,2017-07-10 18:25:20,delivered,2017-07-10 18:12:09,belo horizonte,MG,7.0,,0,-23.0
varginha,MG,30000,65,65,65,,,4,,28.7,2,credit_card,1,22.1,89.99,sao paulo,sao paulo,2018-08-20,2018-08-16 19:58:31,08/14/2018 15:01:00,2018-08-14 01:25:13,delivered,2018-08-14 01:13:48,sao paulo,SP,2.0,,0,-4.0
belo horizonte,MG,700,30,10,20,1.0,ferramentas_jardim,5,,23.47,1,credit_card,1,32.49,79.0,sao paulo,sao paulo,2018-08-02,2018-07-27 16:58:54,07/16/2018 08:47:00,2018-07-13 19:10:22,delivered,2018-07-13 19:00:27,david canabarro,RS,13.0,,0,-6.0
porto alegre,RS,150,20,5,12,2.0,telefonia,5,,50.0,1,voucher,2,3.25,99.0,sao paulo,sao paulo,2017-08-21,2017-08-02 17:37:22,07/24/2017 19:05:02,2017-07-22 02:15:47,delivered,2017-07-20 23:51:43,itarare,SP,12.0,,1,-19.0
brasilia,DF,200,18,8,14,1.0,esporte_lazer,4,,364.46,1,boleto,1,21.54,149.9,sao paulo,sao paulo,2017-07-11,2017-07-04 14:41:48,06/27/2017 16:37:54,2017-06-20 10:35:28,delivered,2017-06-18 19:51:54,sao paulo,SP,15.0,,1,-7.0
ribeirao preto,SP,150,27,13,17,1.0,eletrodomesticos,5,,48.23,1,credit_card,1,22.85,139.9,sao paulo,sao paulo,2017-04-06,2017-03-28 16:23:53,02/22/2017 14:25:33,2017-02-22 13:30:16,delivered,2017-02-22 13:22:13,maua,SP,34.0,,0,-9.0
botucatu,SP,100,16,8,11,1.0,beleza_saude,5,,78.97,6,credit_card,1,7.39,12.25,sao paulo,sao paulo,2017-09-29,2017-09-05 16:00:03,08/30/2017 20:26:55,2017-08-26 12:55:19,delivered,2017-08-26 12:43:02,curitiba,PR,10.0,,0,-24.0
curitiba,PR,595,8,6,6,2.0,eletronicos,5,,159.8,2,credit_card,1,7.39,46.9,sao paulo,sao paulo,2017-07-25,2017-07-14 14:57:56,07/04/2017 16:08:52,2017-07-04 04:45:13,delivered,2017-07-02 19:37:07,guarulhos,SP,11.0,,1,-11.0
sao paulo,SP,600,26,6,18,1.0,beleza_saude,4,,66.44,1,credit_card,1,14.05,99.0,são paulo,são paulo,2017-11-30,2017-10-13 18:32:35,09/29/2017 17:04:21,2017-09-27 12:49:12,delivered,2017-09-26 01:25:02,maceio,AL,17.0,,1,-48.0
domingos martins,ES,200,16,2,11,2.0,relogios_presentes,5,,71.13,2,credit_card,1,7.94,48.9,sao paulo,sao paulo,2017-08-01,2017-07-26 00:59:25,07/21/2017 21:12:07,2017-07-18 06:35:12,delivered,2017-07-17 13:51:31,cajueiro,AL,8.0,,0,-6.0
campinas,SP,2350,30,30,30,1.0,construcao_ferramentas_iluminacao,5,,76.29,1,credit_card,1,16.25,69.49,sao paulo,sao paulo,2017-03-30,2017-03-22 09:08:52,03/14/2017 14:14:03,2017-03-12 19:04:41,delivered,2017-03-12 19:04:41,jacarei,SP,9.0,,0,-8.0
sao paulo,SP,200,25,5,12,2.0,ferramentas_jardim,5,,188.93,1,voucher,2,74.99,149.0,são paulo,são paulo,2018-05-17,2018-05-09 23:12:02,04/30/2018 15:09:00,2018-04-29 14:53:31,delivered,2018-04-29 14:31:40,florianopolis,SC,10.0,,0,-8.0
uberaba,MG,500,16,15,20,4.0,esporte_lazer,4,,70.03,1,debit_card,1,34.98,129.0,sao paulo,sao paulo,2018-03-22,2018-03-09 20:03:55,02/27/2018 18:09:22,2018-02-26 11:15:34,delivered,2018-02-26 11:06:56,belo horizonte,MG,11.0,,0,-13.0
presidente prudente,SP,9000,33,30,44,17.0,pet_shop,5,,51.01,1,boleto,1,17.03,84.0,sao paulo,sao paulo,2017-07-25,2017-07-11 22:03:39,07/05/2017 13:44:46,2017-07-02 12:15:19,delivered,2017-07-02 12:03:31,uberlandia,MG,9.0,,0,-14.0
sao paulo,SP,500,80,10,60,2.0,moveis_decoracao,5,,162.75,2,credit_card,1,19.07,169.99,sao paulo,sao paulo,2017-11-22,2017-11-03 19:48:27,10/30/2017 20:22:33,2017-10-27 16:55:24,delivered,2017-10-27 16:44:14,santo andre,SP,7.0,,0,-19.0
sao paulo,SP,100,16,2,11,1.0,beleza_saude,3,Bom ,36.36,1,boleto,1,15.59,119.9,sao paulo,sao paulo,2018-05-23,2018-04-30 16:03:32,04/25/2018 13:41:00,2018-04-25 01:15:08,delivered,2018-04-25 01:03:27,sao paulo,SP,5.0,,0,-23.0
coronel fabriciano,MG,400,18,18,18,2.0,beleza_saude,5,,209.46,4,credit_card,1,11.62,73.9,sao paulo,sao paulo,2017-05-30,2017-05-09 08:03:01,05/03/2017 14:12:58,2017-04-30 15:02:33,delivered,2017-04-30 14:48:53,uberlandia,MG,8.0,,0,-21.0
sao paulo,SP,16900,38,70,38,4.0,ferramentas_jardim,5,,79.95,2,credit_card,1,17.06,17.9,sao paulo,sao paulo,2018-07-12,2018-06-11 18:03:59,06/06/2018 15:01:00,2018-05-30 17:58:05,delivered,2018-05-30 17:38:11,cruzeiro,SP,12.0,,0,-31.0
cachoeirinha,RS,200,19,4,11,3.0,telefonia,5,,134.49,1,credit_card,1,17.06,17.9,sao paulo,sao paulo,2018-01-30,2018-01-15 21:06:54,01/12/2018 23:10:32,2018-01-11 20:15:47,delivered,2018-01-11 20:04:57,fortaleza,CE,4.0,,0,-15.0
sao paulo,SP,150,29,2,16,1.0,consoles_games,5,Ótimo! ,111.02,6,credit_card,1,30.84,279.9,sao paulo,sao paulo,2018-04-10,2018-04-03 19:52:40,03/12/2018 21:50:55,2018-03-10 17:07:54,delivered,2018-03-10 16:15:17,rio de janeiro,RJ,24.0,,0,-7.0
ibitinga,SP,225,18,18,16,1.0,portateis_casa_forno_e_cafe,5,,53.88,1,credit_card,1,33.82,329.9,sao paulo,sao paulo,2017-08-23,2017-08-16 19:03:36,08/11/2017 13:52:35,2017-08-10 13:50:09,delivered,2017-08-10 13:35:55,aperibe,RJ,6.0,,0,-7.0
sao paulo,SP,18200,40,60,40,4.0,moveis_decoracao,5,,62.91,1,boleto,1,13.13,119.9,sao paulo,sao paulo,2017-05-11,2017-05-02 13:11:43,04/25/2017 11:45:19,2017-04-24 20:45:16,delivered,2017-04-24 20:32:15,santa cruz do sul,RS,7.0,,0,-9.0
maua,SP,790,28,24,31,2.0,brinquedos,3,,335.47,1,debit_card,1,12.33,119.9,sao paulo,sao paulo,2017-09-13,2017-09-01 19:11:46,08/23/2017 20:38:10,2017-08-23 02:47:28,delivered,2017-08-21 19:33:15,sao paulo,SP,10.0,,1,-12.0
sao goncalo,RJ,21467,76,57,51,1.0,bebes,1,,12.29,1,voucher,3,18.76,349.99,sao paulo,sao paulo,2018-01-03,2017-12-13 22:57:29,11/29/2017 23:06:22,2017-11-26 17:55:23,delivered,2017-11-26 17:47:17,belo horizonte,MG,17.0,,0,-21.0
sao bernardo do campo,SP,300,16,11,11,2.0,relogios_presentes,5,,237.54,8,credit_card,1,20.01,110.0,sao paulo,sao paulo,2018-04-12,2018-04-08 21:19:30,04/04/2018 23:27:38,2018-04-03 17:10:29,delivered,2018-04-02 16:10:57,porto alegre,RS,6.0,,1,-4.0
s jose do rio preto,SP,150,35,2,25,3.0,moveis_decoracao,5,,131.94,1,credit_card,1,18.3,27.9,sao paulo,sao paulo,2017-12-11,2017-12-04 17:54:51,11/30/2017 20:27:41,2017-11-29 18:10:32,delivered,2017-11-27 17:19:58,volta redonda,RJ,7.0,,2,-7.0
ribeirao preto,SP,975,19,12,15,1.0,beleza_saude,3,,191.28,1,debit_card,1,15.11,45.9,são paulo,são paulo,2017-12-19,2017-12-07 22:29:32,12/04/2017 20:07:13,2017-12-01 21:24:08,delivered,2017-12-01 20:48:11,presidente epitacio,SP,6.0,,0,-12.0
taruma,SP,304,19,11,16,2.0,telefonia,4,,85.24,6,credit_card,1,45.09,89.99,sao paulo,sao paulo,2017-05-10,2017-04-17 15:47:02,04/06/2017 14:43:20,2017-04-06 14:03:14,delivered,2017-04-06 13:45:15,porto alegre,RS,11.0,,0,-23.0
sao paulo,SP,8200,40,35,35,2.0,bebes,4,,37.99,1,credit_card,1,23.98,149.9,são paulo,são paulo,2018-06-12,2018-05-29 20:10:51,05/28/2018 15:04:00,2018-05-25 13:53:54,delivered,2018-05-25 13:28:45,belo horizonte,MG,4.0,,0,-14.0
garca,SP,700,16,35,25,2.0,pet_shop,5,,200.75,1,credit_card,1,25.37,177.65,sao paulo,sao paulo,2017-10-19,2017-10-10 22:58:36,09/27/2017 16:33:24,2017-09-25 10:04:02,delivered,2017-09-25 09:48:34,joinville,SC,15.0,,0,-9.0
guarulhos,SP,1400,60,30,16,1.0,brinquedos,5,,213.03,1,boleto,1,7.46,27.99,são paulo,são paulo,2017-09-29,2017-09-18 16:09:57,09/12/2017 21:48:54,2017-09-06 02:55:33,delivered,2017-09-04 11:39:25,vila velha,ES,14.0,,1,-11.0
uberlandia,MG,18000,50,20,20,8.0,automotivo,5,,74.16,1,boleto,1,34.04,79.98,sao paulo,sao paulo,2017-12-20,2017-12-09 15:36:43,12/02/2017 00:28:58,2017-11-29 11:37:34,delivered,2017-11-29 11:24:18,ribeirao pires,SP,10.0,,0,-11.0
limeira,SP,350,43,16,27,5.0,fashion_bolsas_e_acessorios,5,,55.09,1,voucher,1,21.33,349.9,sao paulo,sao paulo,2018-07-05,2018-06-19 21:46:19,06/15/2018 14:22:00,2018-06-14 12:19:40,delivered,2018-06-14 11:29:22,castanhal,PA,5.0,,0,-16.0
sao paulo,SP,1200,65,12,12,2.0,moveis_decoracao,5,,10.04,1,voucher,6,14.1,29.99,sao paulo,sao paulo,2018-05-28,2018-05-14 14:08:54,05/02/2018 11:22:00,2018-05-01 14:16:59,delivered,2018-05-01 13:44:06,belem,PA,13.0,,0,-14.0
sao paulo,SP,1200,42,25,15,1.0,cool_stuff,5,,57.8,1,credit_card,1,14.1,29.99,sao paulo,sao paulo,2017-10-05,2017-09-28 21:47:45,09/15/2017 18:30:17,2017-09-12 08:30:25,delivered,2017-09-12 08:16:19,cacapava,SP,16.0,,0,-7.0
sao paulo,SP,7683,38,45,52,2.0,cama_mesa_banho,5,,25.05,1,credit_card,1,16.18,59.99,sao paulo,sao paulo,2017-11-23,2017-11-09 20:09:34,11/04/2017 11:02:24,2017-11-02 09:45:18,delivered,2017-11-02 09:30:52,nova lima,MG,7.0,,0,-14.0
pirassununga,SP,100,22,4,11,2.0,eletronicos,4,,199.43,1,boleto,1,16.16,56.99,sao paulo,sao paulo,2018-07-20,2018-06-04 22:46:39,05/30/2018 14:52:00,2018-05-30 13:09:18,delivered,2018-05-30 12:58:00,sao paulo,SP,5.0,,0,-46.0
sao paulo,SP,600,65,11,11,2.0,moveis_decoracao,5,,172.29,3,credit_card,1,16.16,56.99,sao paulo,sao paulo,2017-06-01,2017-05-24 14:39:39,05/09/2017 11:14:03,2017-05-05 13:50:15,delivered,2017-05-05 13:35:44,cariacica,ES,19.0,,0,-8.0
sao paulo,SP,1400,35,3,35,,,2,,126.3,8,credit_card,1,8.21,89.0,sao paulo,sao paulo,2018-05-17,2018-05-09 17:57:27,05/08/2018 10:47:00,2018-05-08 04:55:20,delivered,2018-05-04 16:08:55,contagem,MG,5.0,,3,-8.0
sorocaba,SP,4550,40,21,32,1.0,climatizacao,5,,116.97,5,credit_card,1,7.78,49.0,sao paulo,sao paulo,2017-06-19,2017-06-03 10:57:54,06/02/2017 15:55:25,2017-06-02 10:30:19,delivered,2017-06-02 10:18:35,guarapuava,PR,1.0,,0,-16.0
sorocaba,SP,1588,48,12,44,1.0,cama_mesa_banho,4,Produto entregue,158.21,2,credit_card,1,52.85,146.94,sao paulo,sao paulo,2017-09-28,2017-09-18 21:44:59,09/14/2017 21:36:00,2017-09-13 17:55:29,delivered,2017-09-12 17:49:55,sao paulo,SP,6.0,,1,-10.0
sao paulo,SP,1400,20,16,22,6.0,pet_shop,4,Boa,247.16,1,voucher,2,52.85,146.94,sao paulo,sao paulo,2018-01-09,2017-12-21 21:17:08,12/05/2017 21:37:09,2017-12-04 18:30:31,delivered,2017-12-04 17:16:55,bom jesus dos perdoes,SP,17.0,,0,-19.0
belo horizonte,MG,1100,23,7,38,5.0,automotivo,4,,45.09,4,credit_card,1,18.35,36.2,sao paulo,sao paulo,2017-06-09,2017-05-30 12:13:30,05/24/2017 08:17:48,2017-05-22 16:05:19,delivered,2017-05-22 15:57:42,ipatinga,MG,7.0,,0,-10.0
ribeirao preto,SP,800,32,6,28,2.0,moveis_decoracao,1,,172.16,5,credit_card,1,12.31,509.0,sao paulo,sao paulo,2017-11-01,2017-10-13 21:36:49,10/09/2017 20:17:55,2017-10-08 15:07:11,delivered,2017-10-08 14:53:58,urucurituba,AM,5.0,,0,-19.0
campinas,SP,867,26,15,18,1.0,esporte_lazer,4,,189.37,2,credit_card,1,17.07,89.99,sao paulo,sao paulo,2018-06-07,2018-05-22 02:40:39,05/18/2018 14:35:00,2018-05-18 02:54:16,delivered,2018-05-17 16:37:03,jandira,SP,4.0,,0,-16.0
